,Title,Translator,Lang,Author,Text
0,מחנך ודרכו,,,זאב כרמי,"
הספר הזה, שקראנו לו “מחנך ודרכו”, הוא ספר זכרונותיו של זאב כרמי ז""ל, שכתב בסוף ימיו.
רב‑פעלים היה האיש, חולם ולוחם, ורבי‑חליפות היו חייו, יליד עיירה קטנה ונידחת באוקראינה, קיבל חינוך לא רגיל, ובגיל בר‑מצוה עזב את בית הוריו, השתלם בעצמו ועמד אחר‑כך בבחינות אכסטרניות למורים. בימי מלחמת רוסיה‑יאפאן נדד לאנגליה, ואחרי אכזבות קשות ומרות בלונדון החליט לשוב לרוסיה, התגלגל במקרה לגאליציה, שקיבלה אותו בלבביות. שם התחיל בהוראה מבורכת, מצא את רעיתו, ויחד אתה עלה ארצה בראשית העליה השניה. אחרי נסיונות ראשונים בארץ נשלח לשנה אחת להורות בביה“ס “אליאנס” בבירות כמורה לעברית, חזר לארץ, לגליל, כמורה ומנהל בית‑ספר תחילה ביבנאל ואחר‑כך במנחמיה, בה ישב ופעל עד סוף מלחמת העולם הראשונה. משם עבר להורות בראשון‑לציון, עבד בה שנה, ואחריה הגיע לחיפה, השתקע בה עד סוף ימיו והיה מבניה‑בוניה. כאן ייסד את ביה”ס “העממי א”, מוסד שהוא ציון דרך בחינוך העברי בארץ. הוא ניהל אותו במשך 27 שנים. לבסוף היה מנהל המחלקה לחינוך הראשון של עירית חיפה עד לפרישתו ב-1956. זאב כרמי נפטר בג' בתמוז תשכ""ד והוא בן שמונים. הוא השאיר אחריו מפעל‑חיים בר‑קיימא ומשפחה מושרשת באדמת המולדת.
רבים מפרקי הספר מרתקים ביחודם, בכנותם, בהומאניות העמוקה שלהם והם אוצר בלום לתולדות עם ישראל בגולה ובארץ. לתולדות החינוך בישראל ועדות חיה לנפתוליו של אדם בארצנו, בשני הדורות האחרונים.
המחבר מעלה בצורה חיה שפע של דמויות, רחוקות וקרובות, שנתקל בהן בימי חייו הארוכים. על כולן מאירה באור‑יקרות אישיותה של רעיתו פִּרחה כרמית ז""ל.
מתוך הוקרה עמוקה לאישיותו הראשונית של כותב הזכרונות הרינו מגישים את ספרו לקורא. והיו זכרונות אלה עדות לדורות.
יעמדו על הברכה המסייעים להוצאת ספר זה: משרד החינוך והתרבות, משפחת זאב כרמי ומועצת עירית חיפה וראשה.
משה רינות
מנהל המחלקה
לחינוך ולתרבות
 
ילדות נעורים ובחרות בגולה
 
ילדות
 
עיירת מולדתי
נולדתי בשנת 1884, בא' דחוה“מ של פסח, אי‑שם על שפת הדנייפר באוקראינה. הישוב בו ראיתי אור לראשונה בחיי היה פרוור מרוחק מהעיר צ’רקאסי שבפלך קיוב. הישוב ספק עיירה ספק כפר. בתוך ישוב צפוף של איכרים אוקראינים על החולות השתרעה עיירה קטנטונת חודיאקי. לפי הרושם שהתרשמתי בילדותי נמצאת עיירה עלובה זו בקצווי תבל. מסילות ברזל, כבישים או דרכי מעבר אחרים לא נראו בכל הסביבה. האורח היחידי שהיה נקלע לסביבה זו היה ה”אַקציזיניק“, פגיס מצ’רקאסי, שהיה בא לשם סידורי המיסים. כמאה משפחות יהודים, עניים ברובם, התגוררו בין המון האיכרים וסחרו אתם ומצאו פרנסתם בדוחק רב. את הווי חייהם תיאר בכשרון רב בן סביבתי, הסופר שלום‑עליכם. הוא נולד וחי מעבר לדנייפר בעיירה וורונקה. בשעה שהגיעו לידינו יצירותיו הראשונות ביידיש וקראנו על כתריאליבקה, היינו בטוחים, שהסופר מתאר את חודיאקי. רבים מגיבוריו הוכרו על ידינו ורבו הויכוחים בינינו על זהותם. חיבבנו מאד את שלום‑עליכם כולנו, כצעירים כקשישים, גם בשל ההומור הטוב הנובע מפי בן‑המקום ברוחו הטובה. טוביה החולב היה חביב עלינו למרות בטלנותו. השתתפנו כולנו בצערו וכאבו, כשבתו הלכה אחר הגוי, ושמחנו בהצלחותיו הפעוטות. אף הקייטנות שלו היו מוכרות לנו. וכי מי לא הכיר את יהופיץ? הלא זוהי קיוב שלנו, שאליה היינו מגיעים ב”פּארוֹחוֹד"" (אניית הקיטור). כל אלה תוארו ביד אמן ברוך הכשרון וחביב העם. בכל זאת עז רצוני להציב ציון דל וצנוע לשלשה מבני משפחתי: לסבא, לאבא ולאמא, שלהם היתה השפעה לא מעטה על דמותי לחיוב ולשלילה.
אמי היקרה מסרה את נפשה על ילדיה ועלי ביחוד (צעיר הבנים הייתי במשך שמונה שנים, עד שאחי הצעיר ירש באיחור זמן את מקומי). היא גוננה עלי לא רק מפני סכנות ומחלות ילדים, אלא גם מפני העונשים הרבים, שהיה ברצונו של אבא להטיל עלי לעיתים קרובות מאד. וסבא ואבא, כפי שהבינותי במשך הזמן, נלחמו על נפשי בלי הרף.
 
סבא – לייבקה גוי
את דמותו של סבי שלי הנני זוכר למן היותי בן ארבע –שבע. לפי הערכתי היה אז בן שישים – שבעים שנה. מי מנה אז את שנות החיים? יהודי גברתן היה, בעל קומה, איתן, רחב כתפיים, זקן ארוך ויפה עטר את פניו – לפי הרושם שלי כיום, שיתף סבי ביפי זקנו גם מספרים – פה ושם התגנב לתוכו שער שב. תספורת שער ראשו היתה עשויה במנהג הקאצאפים הרוסים. כן גם לבושו, החל במגפים, שלא נפרד מהם שמונה תשעה חדשים בשנה, וכלה בסרטוק הכחול, נוסח מוסקבה. בשפתו הרוסית בעלת המבטא הטוב, בעירותו ורעננותו, דמה יותר לגוי מאשר ליהודי גלותי. פקידי הרשות, שהיו באים לעיירה היו מתאכסנים תמיד בביתו הנאה. הם היו מכנים אותו בשם ליב איסאייביץ אוסטרובסקי. ואילו בני העיירה היהודים היו מכנים אותו בפניו ר' ליב ומאחורי גבו: “ליבקה גוי”. אני, שאהבתי אותו אהבת נפש וראיתיו יום יום מתעטף בטלית ומניח תפילין, התקשיתי להבין את טעם הכינוי “ליבקה גוי”. ופעם בשעת רצון – הייתי אז בן תשע או עשר – כשעזרתי על ידו בעבודה בגן, שאלתיו: “סבא, מדוע מכנים אותך השכנים בשם 'ליבקה גוי?”. הוא חייך, שתק רגע ושאל אותי: “האם נעלבת, ילדי, בגללי? אל תהא מודאג, המסכנים האלה מקנאים בי כולם ומדברים בגנותי והם חושבים, שכינוי זה מעליב אותי, אבל אני מצפצף עליהם”. “ומדוע הם מקנאים בך?”, הוספתי לשאול. “ראה ילדי, מה מסכנים הם בבקתות העלובות שלהם המכוסות קש. עלובים הם, היהודים האלה, ואילו אנחנו, ביתנו מכוסה פח. אולם הבית – שאורכו היה כעשרים מטר ורוחבו כששה מטרים מרוצף רצפת עץ צבועה ולאורכו שתי שורות פיקוסים בחביות צבועות – מעורר קנאה, כמובן, כי רק לפריצים אולם כזה. פקידי הרשות מתאכסנים אצלנו וידידי הם. כל אלה שיש להם בקשה לפקידים, לפי הם פונים? לעזרת ר' ליב, והם מקנאים בנו. אל תצטער על כך, נכדי”. ליד בית סבא היה גן נפלא, נטוע עצי פרי, פרחים וירקות. הגן גבל באגם גדול, והיה יחידי בעיירה בין היהודים. תפוחים ואגסים כשלנו לא היו בכל הסביבה, כי רק סבא ידע את סוד הרכבת העצים. הרהרתי הרבה בתשובתו ובלבי התגאיתי בסבא גיבור ועשיר. בגיל מבוגר יותר למדתי מתוך הסתכלותי בסבא, שלא מיצה את כל נימוסי הדת למרות תפילתו בטלית ותפילין. ראיתי שבחיי יום יום הוא נוהג מנהגי פריץ. מאכליו ומשקהו לא היו כמנהגי יהודי‑העיירה. בבריאותו ואף בהשקפותיו על החיים לא היה דומה לשאר היהודים, ולא היו ניכרים בו עקבות הגלות. הוא לא ידע פחד מפני גוי, ועל סף הזקנה לא נמנע מלהאבק עם כל “שיגץ” חצוף על הדשא ולהראות לו נחת זרועו.
הסתכלתי בו והשוויתי אותו לשאר יהודי העיירה. הרגשתי את רגש הסלידה שלו לנימוסי הבטלנות של תלמידי‑החכמים שבעיירה, לרבות אבי, חתנו. לא הובן לי בילדותי כיצד נקלע יהודי תלמיד‑חכם זה לבית “ליבקה גוי”. ורק בהתבגרותי נודעו לי פרטי גלגולו של אבי הרב, שהיה הוגה ימיו ולילותיו בספריו המרובים.
 
אבא – הרב ר' זלמן
יהודי דל ורזה היה אבי ר' זלמן פניו פני תלמיד ­חכם מובהק, בעל מצח ועינים יפות, זקן קטן שחור היה עוטר את פניו הרציניים והמהורהרים. מסתובב היה יהודי זה בבית סבא כעורב לבן בין השחורים. זר ומוזר היה לא רק בעיני חותנו אלא אף בעיני בניו ושונה היה מכל בני העיירה. הוא היה רב שלא על מנת לקבל שכר הוראה. מי מבני העיירה העלובה יכול לדאוג לשכר הוראה לרבם? בגיל מבוגר יותר נודעה לי מרמזי סבא, אבא, אחי ואחיותי הגדולים ממני, כל הטרגדיה של אבי.
בהגיע אמי לפרקה, נעלם סבא ביום בהיר אחד מהעיירה לשבועיים ימים. איש לא ידע את מטרת נסיעתו – סבתא כבר לא היתה אז בחיים. בשובו מן הדרך נתגלה הסוד: סבא קפץ לקורסון, עיירה שנתפרסמה בישיבתה החשובה. בקורסון פנה לר' הירשל, הרב דמתא וראש הישיבה: “רבי, יהודי עשיר אני ועם הארץ הנני. בתי הגיעה לפרקה ורצוני הוא שתבחר לי מטובי הבחורים שלכם חתן לבתי. בעיירה מכנים אותי בשם “ליבקה גוי”, אבל אני יהודי ככל יהודים ורצוני בחתן, שאוכל להתגאות בו. איני זקוק לחתן מפרנס. הוא יוכל להיות סמוך על שולחני, הוא, אשתו ובניו, כי בעל נכסים הנני. ישב לו ויעסוק בתורה”. אחרי ההקדמה הזאת והשיחה שאחריה מסר לר' הירשל מתנת‑כסף הגונה לישיבה, והלה הבטיח לו לשקול את הענין ולמלא את בקשתו. ימים אחדים לאחר מכן נקרא סבא לראש הישיבה. הוא הציג לפניו אברך משי מטובי תלמידיו ושמו זלמן. בחור זה היה יתום מאביו ומאמו, ללא כל קרובים בסביבה הקרובה. נראה לי, שהיה בן ליטא. עילוי, שגדל וחונך בישיבה. בגיל שמונה‑עשרה נסמך להוראה. אף מהצבא היה פטור, כי רשמו אותו כבן ליהודי חשוך‑בנים. אברך נאה ומוצלח. סבא היה מרוצה, אבל גמגם: “אי‑אפשר להביא בחור כזה הביתה, כשהוא ערום ויחף”. הוא דחה את שובו הביתה לשבוע ימים, הזמין למיועד להיות חתן לבתו בגדים נאים, קנה לו על ידי ר' הירשל ש""ס נאה וחזר הביתה עם החתן, כשהוא לבוש הדר ומביא אתו ארון ספרים, בגדים נאים וכלים נאים. ותוך חודש ימים נכנסו לחופה.
סבא מלא את כל הבטחותיו. אולם מה יכול היה לתת סיפוק למסכן זה באוירה מגושמת בבית בעל‑גוף עשיר ובעיירה נידחת זו? אמא, אשה כשרה וצנועה, עשתה כל אשר בידה לספק לבעלה את כל הדרוש לו, אבל הבדידות בבית ובעיירה אכלה אותו. בזכרוני מעלה אנו אותו, מתבודד באחד החדרים הרבים בבית סבא, סגור בחדרו בין ארונות הספרים. על שולחנו גל ספרים גדולים, יושב רוב הימים וחלק מהלילות, מזמזם לו את ניגונו המונוטוני בלימוד הגמרא. פעמים רבות אמא מתדפקת על הדלת ומזמינה אותו לסעוד את לבו, אולם – לפי דברי אמא – לעולם אינו טועם אוכל חם. הכל מצטנן, עד שהוא נזכר באכילה. בודד הוא סועד את לבו כל ימי השבוע פרט לשתי הסעודות, בליל שבת ולמחרתו, בשבת בצהרים. יום‑יום לפני הצהרים הוא נעלם לבית‑הכנסת ומבלה שם שעות מספר בתפילה ובעיון, ובערבים – קורא שעורו בפני בני המקום.
 
אמא
הה! אמי האהובה, אם יהודיה, נפש יקרה, שידעה לתת לבני משפחתה הכל, הכל, בלי לצפות לתגמול כלשהו מהם. מה רב צערי, כשאני מהרהר בה: שפחה נחרפת היתה לבעלה ולילדיה. הכל נעשה כדבר המובן מאליו"" עשרה ילדים ילדה, שבעה שנשארו בחיים גידלה, בכפר נדח, בלי שנראה אי‑פעם רופא. בריה זו לא היתה קיימת בכל כפרי המחוז ועיירותיה. מעולם לא נראה במקומנו חייט, סַפָּר וכו'. את תפקידיהם מילאה אמא. וכשמטה ידו של סבא לעת זקנה, הטילה על שכמה גם את פרנסת המשפחה. משתדל אני בזכרונותי להזכר באמא, כשהיא נחה פעם בעבודתה. לשוא, איני זוכר אותה בכך, פרט לשעות אחה“צ, בימי שבתות וחגים, כשהיא יושבת גחונה על ה”צאינה וראינה"" וקוראת את פרשת השבוע ביידיש. לעתים רחוקות מקבלת בשבת אחרי הצהרים איזו אורחת ידידה לשיחת‑סרק או סרה אליה לשעה קצרה בשעות שלפנות ערב.
בעצם לא ידעה מנוחה והנאת חיים גם בשבתות ובחגים. אבא, רב העיירה, היה יוצא מבית‑הכנסת עם אחרוני המתפללים, מלווה חסידים‑מעריצים, המלווים אותו לביתו לקידוש, הנמשך שעות, או לפעמים הוא סר לאחד מהם לקידוש. ובשעה שכל בני העיירה היו יושבים מסובים עם משפחותיהם סביב לשולחן ונהנים מסעודת השבת, היינו אנחנו, בני ביתנו, מעוצבנים ומצפים לרגע שיסתלקו האורחים בלתי הרצויים לנו, ונזכה גם אנחנו לסעודת שבת, שלרוב היתה מצוננת ובלתי טעימה. לעיתים זכתה אמא גם להערת ביקורת מאבא על טעם הצ’ולנט המצונן.
איני נזכר, שראיתי פעם את אמא בשוכבה לישון או בקומה. היא היתה האחרונה לשכיבה, אחרי שסידרה את כל בני ביתה, והראשונה לקימה לפנות בוקר, כדי להכין ארוחותינו לשעה הנכונה. אף את הבנות, שהיו עוזרות לה בעבודתה, לא היתה מעירה בשעה מוקדמת. אבא היה מתלוצץ על חשבון אמא, שבליל שישי בשבוע, ליל האפיה לכבוד שבת, לא היתה אמא ישנה כמעט; כי גם אחרי שכילתה עבודתה ושכבה לנוח, לא שקטה מפחד שתאחר ללישת הבצק ואפית הלחם, ועל‑כן היתה קמה שעות אחדות לפני עליית השחר. שעון מעורר, כמובן, לא היה קיים בעיירה. ולקריאת ה“גבר” לא חיכתה. אנו, הבנים, בקומנו משנתנו בבוקר יום השישי, הרגשנו תיכף ריח החלות הטריות; ולכל אחד מאתנו הוכן מין מאפה משארית הבצק, מאפה הדומה לפיתה ערבית בימינו. זו היתה פריסת השלום הראשונה מהשבת המתקרבת. וכל זה קיבלנו כדבר המובן מאליו. ובמה לא שלחה אמא את ידה? הן מחוץ לכל עבודות הבית במשפחה הענפה היתה היא התופרת לכולנו, פרט לבגדי סבא ואבא, וח""ו לא במכונת תפירה, שרק שימעה שמענו על קיומה בערים הגדולות. במחט רגילה עשתה כל עבודת התפירה. וכפי שאספר להלן, שלחה ידה גם בהוראה לבנה וולוולה – זה היה שמי בפי בני העיירה ביידיש (תרגום השם זאב). ואף במרחקים, לאחר שעזבנו את בית ההורים – כל הבנים והבנות פרחו להם מבית ההורים לעיר צ’רקאסי – הרגשנו יד אמא האוהבת. קבלנו פריסות שלום על ידי באי העיירה לצ’קראסי, על ידי מאפה טוב, שימורים שונים, זוג גרבים וכדומה. בשבתי בצ’רקאסי וחי חיי אקסטרן עלובים, היה ערך גדול לפריסות שלום מעין אלה, כי רעבתי למחצה בכל הימים “הטובים” ההם. הרגשנו יד אמא ושפע אהבתה בכל הזמנים הרעים ובכל צרה ופגע.
ומה הגמול שגמלנו לה? איני זוכר, שעלה פעם בדעתי, כי יש בכל מעשי אמא דבר היוצא מגדר הרגיל ואנו חייבים לה משהו. רק במרחקים, כשגדלנו ועזבנו את ביתה, הרגשנו בצער ובנוחם רב את חטאינו לאמא, אבל מה מעט היינו יכולים לתקן את המעוות. ואבא לא התפעל גם הוא ממסירותה. הוא קיבל את הכל כדבר המובן מאליו. הן עוסק הוא בתורה ומזכה בכך את כל המשפחה. והיא – שמעתי מפיה פעמים אחדות, ואף פעם לא הבנתי אם היא אומרת זאת ברצינות או בסארקאזם: “ומה לא תעשה אשה בישראל כדי לזכות ולשמש בעולם הבא הדום לרגלי בעלה בגן‑העדן?”.
 
מלמדי הראשון
לא רבה היתה הנחת, שגרמתי לאמי מיום עמדי על דעתי. בגיל ארבע נמסרתי לחדר – ועד היום אני חושב, שנולדתי במזל מאדים. כל ימי נלחמתי והנני נלחם. כאמור, נמסרתי בגיל ארבע למלמד דרדקי היחידי בעיירה, וולף בּר היה שמו, צולע על ירכו היה ועל‑כן כונה שלא בפניו בשם: “וולף בּר דער הינקנדר” 1. לכתחילה הלך הכל למישרין. אמא הביאה אותי לחדר – לא לפי כבוד הרב היה לעשות מלאכה זו לבנו –
כשאני עטוף בטלית. נתקבלתי בתרועות. האלף‑בית היה פרוש על השולחן ומרוח בדבש. הרבי עמד מאחורי, מצביע על האותיות: “אלף, ראה ילדי, זהו אלף”. ובו ברגע נופלת מלמעלה סוכריה, אחת ואחריה עוד אחת ועוד אחת. ורבי מכריז ואומר: קח, ולוולה, את הסוכריה ואכול, זה זרק לך המלאך מן השמים על שאתה לומד כה יפה. הדבר נתקבל על דעתי, צהלתי ואכלתי את הסוכריות, ואמי חילקה סוכריות לכל הילדים, והכל היה טוב ושמח. חיש חזרה אמא לביתה ואנוכי, תלמיד בין התלמידים, לומד ומשכיל. האידיליה נמשכה אמנם רק חודשים מעטים. כבר ידעתי את שמות האותיות והתנועות והתחלתי לצרף: קמץ אלף‑אוֹ, קמץ בית‑בוֹ וכו'. עד בוא היום המר והנמהר, ילד חדש הובא לחדר. ושוב כל אותה הצרמוניה. ואני שישבתי ממול הילד השגחתי, לתמהוני, שאת הסוכריות זורק הרבי ולא מלאך מן השמים. קפצתי ממקומי והרימותי קולי: “שקרן הרבי, לא מלאך זורק את הסוכריות, הוא זורק ואתן”. מיד מכת‑לחי חזקה הדהימה אותי לרגע. נתתי קולי בבכי ואמרתי: “וולף בר דער הינקנדר, שקרן”. לא ארכה השעה ואני הושלכתי החוצה: “שקץ, איני רוצה לראותך בחדר, הלאה מכאן!”. חזרתי הביתה וסיפרתי את כל הסיפור לאמא. היא לא הגיבה לעצם המקרה, רק אמרה: “אל תספר זאת לאבא, הוא יצטער מאד על כך”. עוד באותו יום ביקרה אמא אצל הרבי ובשובה אמרה לי, כי הרבי סלח לי על פטפטי, ואני יכול לשוב לחדר. אבל אני הודעתי קטגורית, שלעולם לא אלך לשקרן ההינקנדר, לעולם!
קיימתי דברי. לא נשארה ברירה בידי אמא, אלא להביא את הדבר בפני אבא. הוא רצה לקחת בידו מיד את חינוכי ותפס מקל מתאים לכך, אבל אמא מחתה בתוקף בפניו: “מה אתה רוצה מהילד? מה הוא מבין? האם על פטפוט ילדים יש להכות אותו ולזרקו מן החדר?”.
אבא הודיע נמרצות, שלעולם לא ילמד אותי אלף‑בית, ואפילו אתהלך בטל כל ימי ואצא לתרבות רעה. “לא?”, אמרה אמא: “אין דבר, רווח והצלה יעמוד לילד ממקום אחר”. ובזה נגמרה ראשית הקריירה החינוכית שלי בכשלון חרוץ.
 
אמא – מורתי
עברו ימים אחדים. פעם אחת, לאחר שאבא הלך לבית‑הכנסת וסבא היה עסוק בעבודתו בגן, קראה לי אמא לחדר בפנים מחדר והתחילה להסתודד אתי. אם אני מבטיח להיות ילד טוב ושומר סוד, היא תלמד אותי “עברי” 2, טוב יותר מהרבי, וגם לא תכה אותי, אבל בתנאי שאהיה מתמיד ושומר סוד: “אפילו לסבא לא תספר, כי אני מלמדת אותך”. לא הבינותי את טעם הסוד, אבל הדבר נתקבל על דעתי. מאז מצאה אמא מדי יום ביומו שעה פנויה, כשהגברים לא היו בבית, ולימדה אותי בסידור “עברי”.
