,Title,Translator,Lang,Author,Text
עבר שבוע ללידת הבנות והיינו מוכרחים לפנות את המיטה בבית‑החולים. בעזרת ידידים הושגה בשבילנו דירה בת שני חדרים, מחצלאות וכלי‑בישול וכל ההכרחי. “בני ציון” ו“בנות ציון” הגישו לנו את כל העזרה האפשרית. גם לציונה הותר לעזוב את בית‑החולים. שמחה רבה היתה בפגישתה עם אמה ואחיותיה. עברנו לדירה לגור שם עד גמר ההסגר. קשה להבין כיצד החזקנו מעמד. חיינו בחדרים, שמלבד מחצלאות לא היו בהם כל ריהוט, עם שתי תינוקות ואם חולה למחצה בתוך עיר כטבריה. מוקפים חולים ומתים, בדירה שאין בה כל סידורים סאניטאריים והיגייניים. זכינו אמנם לעזרה מקסימלית, האפשרית בימים כאלה. אף לביקור הרופא היחידי של “הדסה”. הוא עודד אותנו וקווינו לימים, בהם נזכה לעזוב את העיר. הימים לא היו כל‑כך רעים, אבל בלילות ערכו הבנות קונצרטים, שהוציאו מהכלים את כל השכנים בבית זה. לילה אחד שמענו קינטור קולני מצד אחת השכנות, המאשימה אותנו שהננו אכזרים, מרעיבים את התינוקות ושוללים אפשרות של מנוחה בלילות ממחצית העיר. היה גם איום בקול, שהגיע אלינו, כי מחר ילכו למשטרה להתאונן עלינו.
 
אנו שבים לביתנו
עברו שבועיים ימים. המגיפה שקטה בעיר. ההסגר הוסר, ואנו מהרנו לביתנו. שבנו, משפחה בת חמש נפשות, מלאי שמחה ותקוות. פתחנו את בית‑הספר ואף פרחה חזרה לעבודתה בו.
וכאן כדאי לספר על אצבע אלהים: יום אחד נכנסה לביתנו אשה יהודיה, טברינית טיפוסית, ושאלה ביידיש אם יש לנו עבודת כביסה. רחל היה שמה. ברצון מסרה לה פרחה עבודה. בשעת ההפסקה לארוחת הצהרים נכנסה פרחה אתה בשיחה: מאין היא? כמה זמן היא במושבה? וכו'. היא סיפרה לנו על צרותיה: היא בת טבריה, נשואה לאיש מגיל שבע‑עשרה. בעלה שוחט, יש לה ילד בן עשר שנים, בעלה מתאכזר עליה והיא סובלת קשות. לבסוף החליטה לברוח מהבית. בעיר הפיצה שמועות בין שכניה, שהיא בורחת לתל‑אביב. בשום אופן לא תחזור לבעלה. היא לא הרחיקה לנדוד כדי לדעת משהו על בנה. במושבה עברה את רוב הבתים בביקוש עבודה ולא השיגה כלום, אף כי פה ושם ראתה ערביות עובדות. זה היה יומה הראשון בעבודה. היא גמרה את עבודתה, קיבלה את התשלום והתכוננה לעזוב את הבית. אמרה לה פרחה, כי ברצון היתה משאירה אותה אצלנו בעבודה קבועה. לו היתה יודעת לדבר עברית; הסבירה לה, שאין אנחנו מדברים בשפה אחרת. היא הורידה ראשה ביגון, שצער אותנו. שאלה אותה פרחה, אם היא מוכנה ללמוד עברית, ואז היא תלמד אותה ערב ערב את הדרוש לשיחה קלה אתנו. בדמעות בעיניה הודתה לה ונשארה בבית.
בקיצור הקיצורים: שתים‑עשרה שנה עבדה אצלנו רחל זו, גידלה לנו את גאולה ואת דרורה ואחר שנים גם את תמי. הספיקה ללמוד עברית עד כדי דיבור שוטף, קריאת עתון וספר. בעזרת השם ובעזרת רחל הסתדרנו איך שהוא, אפילו מיטות ילדים השגנו בנס ואמבטיה של פח, והתכוננו לחיים עליזים. הילדות היו דומות בכל. איש זר לא הבחין ביניהן מי היא גאולה ומי היא דרורה. ואנו השתעשענו בזה. קרה גם מקרה, שהאם החליפה ביניהן.
 
שמחתנו לא ארכה
בת שבועיים חלתה גאולה בקדחת. הרופא ד""ר דוד חשב, שהיא נולדה נגועה במלריה. אבל לא זה הענין, העיקר היה למצוא ארוכה למחלתה. ניסינו את כל התרופות, שהרופא ידע עליהן, ולא נרפאה. עבר חודש ימים והרופא חשב, שעזיבת המקום הוא תנאי להבראת התינוקת והמשך חייה. בימים אלה נזדמן למושבה מר שבתאי לוי, הפקיד הבכיר של פקידות הבארון. הוא ברך אותי במזל‑טוב, ואני תיניתי בפניו את צרותינו. עשיתי רושם של מיואש, אבל הוא מצא תרופה מניה וביה: בית‑הספר קטן, אחרי שהוצאו ממנו בני מעון הילדים; ולפי דעתו, לא יקרה אסון, אם פרחה לא תלמד השנה. אני והמורה השלישי נתאמץ מאמץ נוסף, והכל יבוא על מקומו בשלום. יש להם בסג’רה בית‑הפקידות, בית גדול, שיוסף ווייץ תופס בקושי את מחציתו, תעבור לשם פרחה עם הילדים וככלות השנה נראה מה לעשות. סג’רה היתה ידועה באקלימה הטוב, על‑כן הייתי מלא הכרת תודה למר לוי. לא התעניינתי אם תקבל פרחה את משכורתה. (למעשה, שילמו לה את משכורתה במילואה).
ביום השישי רכבתי על מוצה לסג’רה, סיפרתי לווייץ את סיפורי, בשמחה נתן הוראה להכין לנו מיד את הדירה, ואף מצא מקום ברפת לשתי פרות משלנו; וביום הראשון אחר הצהרים הגענו לסג’רה בעגלה עמוסה, וגם הפרות והעגלות הובאו אתנו. ביום השני בבוקר באתי לבית‑הספר לשעור הראשון. עזבתי את ביתנו, כי מי יוכל להחזיקו? עברתי לגור בחדרי הפקידות וסעדתי על שולחן אחד האיכרים. השמש עזרא דאג למשקי וזכה בביצים ומעט חלב, ואני חייתי ככה מהיום הראשון בשבוע עד היום השישי. בצהרי כל יום שישי הייתי אורח במשפחה בסג’רה לשבתות עד היום הראשון בבוקר. מצב הילדה הוטב קצת, אך לא הבריאה לגמרי, ומיפינו לימות הפגרה כדי לנסוע לד“ר יפה, שעבר בינתיים לחיפה. רופאים שנזדמנו אלינו ובדקו את הילדה, מצאו אותה נגועה בחיידקי המלריה המכלים את דמה. היא היתה ירקרקת, תנוכי אוזניה היו שקופות עד לידי זועה. נרמז לנו, כי אין להעלות על הדעת, שנוכל לשוב אתה למלחמיה, אם רוצים אנו בהבראתה. למזלנו, נזדמן לסג’רה גם הד”ר יפה, בדק אותה בהזדמנות ביעף ושמע מפינו, כי בראשית הפגרה נבקר אותו בחיפה.
 
הגילויים המופלאים
השנה הראשונה לכיבוש הגליל היתה בשבילנו תקופת גילויים מופלאים על הנעשה בעולם היהודי בחו""ל ואף ביהודה. כל השמועות והלחישות שהגיעו אלינו בסודות והיו מעורפלות בשעתן, נתבררו לנו עם פתיחת הדרך לתל‑אביב – ירושלים. וגם ידידינו הפליטים, שחזרו מיד לבתיהם, המטירו עלינו ידיעות רבות.
ראשית, הצהרת בלפור; שנית, הגדודים העברים; שלישית, “ועד הצירים” שהגיע לארץ. בכל אלה, שרק עכשיו נתגלו לנו על כל פרטיהם, ראינו “עקבות משיח”.
 
הגדודים האוסטראליים
גם אחר גמר הקרבות חנו בארץ כמה גדודים אנגליים שונים, ביניהם גם הגדוד העברי וגם כמה גדודים אוסטראליים. הצבא הבריטי הסתייג מאתנו. יתכן שהיה בזה רמז מגבוה, ויתכן שהדבר היה תלוי באופי האנשים. גם אנו לא השתדלנו להתקרב אליהם, אולי מתוך כעס על יחס ראשי‑הצבא לבעיותינו – היה סוד גלוי כי רוב קציני הצבא היו פרו‑ערביים – ואולי היתה זאת תגובה טבעית על יחסם הם אלינו. אחרים היו היחסים בינינו לבין האוסטראליים. האחרונים, כפי שמסרו לנו, היו ברובם אנשים חקלאיים בביתם, אנשים פשוטים ותמימים. הם התנדבו לצבא ללא גיוס רשמי מחייב. את סוסיהם הביאו אתם. המפקדים היו משלהם, שהבינו לרוח בני עמם. המשמעת החיצונית בגדודים אלה היתה רפויה, לבושם היה מרושל במקצת, אולם אנשי לחימה טובים היו כולם. בבואם ארצה מצאו בחקלאינו מין את מינו, והתקרבו אליהם, אולם גם בישובים העירוניים הם התקרבו ליהודים.
זוכרני, כי בטבריה אחרי כיבושה מונה זמנית למפקד העיר קצין אוסטראלי. בימים המעטים שישב בעיר היה משתדל לקשור קשרי ידידות אתנו. יום אחד הביע לפנינו רצון להכיר את חיי התושבים בעיר, אולם ללא כל פורמאליות. הכנסנו אותו לבית יהודי ולבית ערבי. לבית היהודי בחרנו את בית הגברת ברסקי, שעברה לגור אז בטבריה. נכנסנו הביתה ללא פורמאליות יתרה. הוגש קפה והחלה שיחה ידידותית בינינו. בינתיים ראה הקצין תצלום על הקיר. היתה זו תמונה של בחור נאה, זה היה צילומו האחרון של משה ברסקי, שנפל על אדמת דגניה. היות שהיה זה תצלום יחידי בחדר, התעניין הקצין לדעת מה טיבו. הגברת ברסקי החלה לספר בלב שבור על אסונה: בנה נהרג ע“י שודדים ערבים, והוא בן תשע‑עשרה בסך‑הכל. לא זכה לחיות בארץ ולהשתרש בה. קולה היה רווי‑דמעות והשתררה מועקה בנו. הקצין החל לנחם אותה: “הן רבבות אנשים צעירים נפלו במלחמה, וראי, בנך קידש את שם האומה שלו, בא הנה ונלחם על תחית מולדתו; ואילו אנחנו, הרחוקים כל‑כך מאתכם, באנו הנה ושפכנו את דמנו כדי להקים לכם מחדש את מולדתכם”. כשראה תימהון על פני הגברת ברסקי, שאל אותה: “האם לא הגיעו אליכם ידיעות על ‘הצהרת בלפור’? לנו נאמר כי כוונת כיבוש הארץ היא לכבוש אותה מידי התורקים ולהקים בה ממלכת ישראל. זה קסם לנו, עזבנו את משפחותינו, עברנו ימים, נלחמנו, ואנו שמחים שיהיה חלקנו בתחית מולדתכם הישנה. התנחמי גם את, שגם לבנך היה חלק בפועל זה”. שמענו את דבריו בנחמה גדולה והרהרנו: “הלואי והיה זה אמת לאמיתה”. אולם בטוחני, שהוא דיבר בכנות; ואין פגם בדבר, אם שחרור א”י היה מתוך אינטרס בריטי נוסף.
 
אני מנסה שנית להאחז בקרקע
יוסף ווייץ ברשימתו בספר “העליה השניה” מספר על עליתו לגליל. הוא מספר שם עלי ועל פרחה, ובין השאר כותב שם, כי עבודתי בחינוך היתה אצלי הוראת שעה, עד שאמצא אפשרות להאחז בקרקע המולדת ולעבדה. הוא לא צדק בענין זה. חלומי היה למצוא מיזוג של שתי “אהבות” אלי: הוראה ועבודת אדמה. על נסיון אחד בלתי מוצלח סיפרתי לעיל. נסיון שני נעשה על ידי בעזרתו של יוסף ווייץ עצמו. בשעתה נוסדה ברחובות חברה, שבראשה עמד אהרון אייזנברג וחותנו של ווייץ אלטשולר. מטרתה היתה רכישת קרקע והכשרתה, נטיעת מטעים ומכירתם לעולים או גם לבני הארץ. חברה זו רכשה גם בסג’רה מפקידות הבארון שטח קרקע נטוע זיתים, חילקה אותו לחלקות בנות חמישים דונם, שיקמה את העצים המוזנחים, גם נטעה עצים נוספים, והכריזה על מכירת החלקות האלה בתשלומים לשעורין. יוסף ווייץ נתמנה למנהל החברה בסכ’רה והתיישב בה. לי וכן לשאר חברינו בגליל גרם בואו קורת‑רוח. הוא שהתדפק על בזמנו על דלתות האיכרים וביקש עבודת יום כפועל ולא נענה, התיאש אז מהגליל וחזר ליהודה. עתה הופיע ווייץ כבעל בעמיו וחביב החוגים שלנו. חיש הוכנס לועד של מושבות הגליל, והיה גם ראשון למעשים במערכת העלון, שהחילונו להוציא לאור (אף אני הייתי בו חבר המערכת). כולנו קיווינו לפריחת הגליל הקרובה. אני, ה“מנחם מנדל” הוותיק, ראיתי בבוא ווייץ לגליל אצבע הגורל. נאחזתי בענין סג’רה בהתלהבות. בחלומי ראיתי את עצמי מורה בסג’רה – אידיאל שלא קשה היה להשיגו – ובעל משק עזר מסועף. “חצר” היתה לי: פרות, סוסה, אתון, עופות – ואם אוסיף לזה גינה וחמישים דונם זיתים, הרי אני “בעל גוף” חשוב. קניתי חלקה, שילמתי דמי קדימה והוספתי לשלם מדי חודש בחודשו את התשלומים לפי החוזה. החברה התכוננה לגלות מים במקום לשם השקיית חלקה לירקות. וראו בחזון תחית המושבה העלובה.
לצערי, נשאה הרוח את כל התקוות. החברה לא הצליחה בפעולתה ועזבה את המקום. ואני שבעתי רצון, כשהוחזר לי כספי, שהשקעתי בענין זה, והוספתי לחלום את חלומי על המיזוג הנכסף בדרכים אחרות.
 
הישוב בארץ וחינוך בניו
הישוב בארץ היה מפוזר ומפורד. ירושלים היתה מופת לרעה בענין זה: אשכנזים וספרדים, תימנים ועיראקים, צפון‑אפריקאים וכו‘, ובתוך כל אחד מהקיבוצים האלה כוללים נפרדים וכל אלה חיים א חייהם בנפרד. לא מעט גרם ריבוי השפות לפרוד הלבבות. במשאל בין ילדי גן‑ילדים אחד בירושלים נמצא, ששלושים החניכים בגן זה מדברים בבתיהם בשמונה‑עשרה שפות. לא טוב בהרבה היה המצב ביפו, בחברון, בטבריה, בצפת ובחיפה. אמנם גון‑חיים חדש צץ במושבות. כל אחת ממושבות אלה היתה תא מוניציפאלי, התושבים היו משלמים לועד המושבה מסים, שכספיהם הוצאו לחינוך, לבריאות ולדאגה לכושל – עזרה סוציאלית בימינו. לא מעט עזרה לבני המושבות פקידות הנדיב לשם החזקת בתי‑הספר, משכורת לרופא וכו’. אבל שום אירגון מאחד את תושבי הארץ לא היה קיים. בתי‑הספר, החדרים, הכותבים, בערים הוחזקו ע""י מוסדות חוץ והכוללים. ברוב המושבות שלטה בבתי‑הספר השפה הצרפתית ורק בתקופה האחרונה הושלטה ברובם העברית כשפת הלימודים, ביחוד במושבות הגליל, והצרפתית או העברית נלמדו בהם כשפה זרה. בערים קיימו חברות‑חוץ בתי‑ספר: “עזרה” הגרמנית קיימה בירושלים סמינר למורים, גן‑ילדים ובתי‑ספר, ובזמן האחרון פתחו מוסדות‑חינוך גם ביפו ובחיפה, ושם שלטה השפה הגרמנית. עברית נלמדה כשפה וגם נסבלה במקצועות היהדות. “אליאנס” החזיקה בתי‑ספר בערים – גם את “מקוה ישראל” – ובהם שלטה השפה הצרפתית שלטון גמור. היה גם בית‑ספר אנגלי בירושלים.
בתקופה האחרונה שלפני מלחמת העולם התמרדו תלמידי בתי‑הספר בסמינר של “עזרה” ודרשו ללמדם רך ורק בעברית. תקופה סוערת מאד החלה בימים ההם ביחוד לקראת פתיחת הטכניון בחיפה. תלמידי הסמינר בירושלים הכריזו על שביתה. “עזרה” מצידה השביתה את הלימודים בכל בתי‑הספר שלה. כתוצאה מ“מלחמת השפות” הוקמו בתי‑ספר עבריים בארץ. עם בוא “ועד הצירים” ויסוד מחלקת החינוך בו רוכזו כל בתי‑הספר בידיה ובכולם הושלטה השפה העברית. רק פה ושם נשארו עוד בתי‑ספר מעטים, כגון מוסדות “אליאנס”, שבהם עוד שימשה הצרפתית כשפת הלימודים.
 
על פרשת דרכים
הגיעה פגרת בתי‑הספר. נסתיימה שנה קשה בשבילנו. אני הייתי נע ונד ממלחמיה לסג’רה וחזרה. גאולתנו לא הבריאה, אף כי חלה בה הטבה. גם דרורה, אחותה התאומה, סבלה בגלל אחותה מנדודים. גם ציונה לא נהנתה מחייה בסג’רה. החליפין בבתי‑הספר לא היו נוחים לה. בית‑הספר בסג’רה היה שונה מזה שבמלחמיה. פרחה, אם הבנות, אמנם הבריאה ועמדה בנסיון, אבל גם לה היו קשים החיים בנכר. עזרתי לה היתה מועטת, הצטמצמה רק לימי השבתות.
עם סגירת בתי‑הספר נסענו מיד לחיפה לביקור אצל הד“ר יפה. הדיאגנוזה שלו לא היתה שונה בהרבה מזו של הרופאים שבגליל, אבל הוא החליט לנסות את כוחו ולרפא אותה מן המלריה הקשה והמושרשת בה. התיישבו חמשתנו במלון הלפרין, מלון ממדרגה בינונית. בסג’רה נשארה רק רחל לטפל במשק. למזלנו, קיבלנו כספים רבים בזהב מאת הפקידות כפיצויים על ההיזקות שלנו בימות המלחמה, שחיינו על ניירות התורכים, שערכם היה לכל היותר חמישית המחיר הנקוב, יכולנו איפוא להרשות לעצמנו ולנסות הכל שבידי בני‑תמותה כדי להציל את הילדה. יום אחד החליט הד”ר יפה לעשות נסיון בזריקת כינין. דבר זה היה חידוש בארץ ופחדנו מזה. ופחדנו לא היה לשווא. ימים אחדים אחרי הזריקה נראה אודם רב במקום הזריקה וחום בו במקום. וכאשר ענין זה לא עבר במשך יומיים, שבנו לד“ר יפה. הוא היה נרעש. נתברר, כי היתה אינפקציה. הוא שער, שהחומר היה מיושן, והיה חשש למורסה. במקרה זה אין ברירה אלא ניתוח. מה לעשות? קיבלנו עלינו את הכל. האם היתה בידנו איזו ברירה? כעבור כמה ימים הוא עשה את הניתוח. האם המסכנה היתה צריכה לשמש אסיסטנטית, ולהחזיק את הילדה ולהגיע אותה. אחר ימים אחדים קיבלה גם שעור איך להחליף לה את הפתילות וכו'. היא עשתה זאת ימים אחדים בפיקוח הרופא, ואחר‑כך חזרנו לסג’רה. כעבור שבועות אחדים, כאשר המורסה נתרפאה והוטב לילדה, נסענו שוב לד”ר יפה לביקורת. הוא היה שבע‑רצון מהתוצאות, אבל באופן קטגורי הודיע לנו שעלינו לעזוב את מלחמיה.
 
נדודים
פסק‑הדין של הד“ר יפה הכריע את גורלנו והחלטנו לעזוב את מלחמיה ולחפש מקום שאקלימו נוח יותר. פניתי במכתב לפקידות הבארון, הסברתי להם את מצבנו וביקשתי את עזרתם. אחרי ימים אחדים קיבלתי תשובה מהם, כי אין מצידם כל התנגדות שלחרר אותנו ממלחמיה; ואם נראה לפנינו מקום מתאים במושבה אחרת, שביה”ס מוחזק שם על ידיהם, הם יעבירו אותנו שמה. במקרה אחר הם מוכנים לשחרר אותנו מתפקידינו. נוצר מצב קשה, בגליל התחתון וגם העליון לא נראתה לנו כל משרה פנויה.
בינתיים נודע הענין, שאנו עומדים לעזוב את מלחמיה, וקיבלנו שתי הצעות עבודה. מנהל ביה“ס בפתח‑תקוה, מר חיון, הציע לנו לעבור אליהם, קיבלנו גם הצעה מלבבת יותר ממנהל ביה”ס בראשון‑לציון, מר אברהם הלוי. שקלנו את הדבר ברצינות רבה. לפי מצב הדברים עמדו אנשי הבארון למסור את בתי‑הספר שלהם למחלקת החינוך של ועד הצירים. במקרה זה מתקבל על הדעת, שהם יעניקו פיצויים לכל המורים המועברים. ראשון‑לציון לא היתה שייכת לפקידות, והיתה סכנה שנפסיד את הפיצויים שלנו. אולם נמשכנו לראשון, מר הלוי היה ידידנו. הוא היה אדם יקר וחשוב, והיתה תקווה שהעבודה בהנהלתו תנעם עלינו. בינתיים נסעתי לירושלים ופניתי לד“ר לוריא, מנהל מחלקת החינוך, בבקשת עבודה. הוא קיבל אותי בחביבות גדולה, התעניין לדעת אם ברצוני לקבל משרת מנהל דווקא, או מסכים אני לעבוד כמורה. לא עמדתי כל כך, שתנתן לי הנהלת ביה”ס, גם קראתי לפניו את שם ראשון‑לציון. הוא הציע לי משרה מלבבת מאד בשבילי. הוראת עברית ב“מקוה ישראל”. אולם לפרחה לא היתה שם משרה. הסכמנו לראשון‑לציון – בסיכון פיצויינו – ולראשית השנה עברנו למקומנו החדש. מכרנו את משקנו לברנשטטר ביבנאל, את כל הפרות, האתון וכו‘; רק פרה אחת, הטובה שבינהן, השארנו לנו אצל ברנשטטר ל“פנסיון”, מתוך מחשבה להעבירה לראשון‑לציון, שארית החקלאות שלנו וביטוח הזנה לתינוקות. פרחה קיבלה חמש‑עשרה שעות בהוראת הטבע ואני משרה שלמה בעבודת‑גן ושאר המקצועות וחינוך בכתה ו’.
 
שלום, שלום לך, הגליל היקר שלי!
עשר שנים פוריות – אף כי די קשות – בילינו בך. למדתי ולימדתי את תלמידי לאהוב את הארץ, לעבוד את אדמתה ולהגן עליה ועלינו. לא פיללתי להפרד ממך כל כך מהר, אבל נפשי, נפשי לבתי הקטנטונת והיקרה ולהצלת חייה. בגדתי בך, הגליל. זכרונות טובים הנני לוקח אתי. ומה בעתיד? אין תקווה להשתכן במחנה עובדים, מחנה היקר לי. בקיבוצים עדיין אין ילדים, ואין צורך בי. ומה מצפה לי במושבה? לעתיד הקרוב פתרונים.
 
בראשון‑לציון
 
ראשון‑לציון
