,Title,Translator,Lang,Author,Text
הביקור הראשון שערכנו בעיר היה, כמובן, בבית אלי רוס, סבא של ארוסתי. כאשר קלט סבא את מחשבותינו, “המחשבה הזרה”, לשכור לנו דירה משותפת עד עלותנו אצה, הוא מחה נגד רעיון זה ברכות אבהית. הוא פנה למצפוני: “סבור אני, שהנך די חכם להבין לרוחו של אבי בלומה. הוא חסיד, קנאי, ואת חופש. מובן, שלא לחתן כזה היה יכול אי‑פעם לשאת נפשו. יש להבין לו ולצערו. אין אתם צריכים להכנע לו. יש לכם, לדעתי זכות לסדר חייכם כרצונכם וכהבנתכם, אבל חייבים אתם לעשות זאת בעדינות, להתחשב בו, ברגשותיו, ובעיקר ברגשות האם… לי יש מחשבה לבוא באיזו דרך לעזרתכם, על זה נדבר בפעם אחרת. אבל הן לבלומה יש בית סבא בדרוהוביץ', ולו בית מרווח, האם לא הגיוני הוא, שתגור היא בביתי? ובאשר לך – הנה ממולי גרה משפחה הגונה ובביתה חדר פנוי להשכרה. הגברת מקבלת דיירים גם לפנסיון. נשכור את החדר המרוחק רק מטרים אחדים מהבית, שכלתך גרה שם. סבא וסבתא, הוסיף בקריצת עין, יעלימו עין מפגישותיכם בביתנו ואפילו בחדרך, סוף‑סוף היינו גם אנו פעם צעירים ומבינים לרוחכם”. וכך קם הדבר והיה. גרתי בחדר במשפחת בית פסמן, פקיד בבית חרושת, והיה טוב לי שם. את זמני הפנוי מבית‑הספר היינו מבלים, כמובן, בחדרה של בלומה. גם בבית‑הספר נהנינו. המנהל שקדמני, קויטנר, היה אדם מסודר והשאיר את בית‑הספר במצב טוב. גם היחסים בינינו ובין הועד המנהל היו טובים. אנשי הועד ידעו, כי זמניים אנו ומתכוננים לעליה, ואף בקביעת משכורתנו התחשבו בנימוק של עליה והגדילו אותה. הן חייבים הם לדאוג, שמוריהם לא יהיו דחוקים בהוצאות הדרך ולחיים בארץ בחודשים הראשונים. הכל הלך למישרין. אם ארוסתי היתה מוצאת אמתלאות לסור לדרוהוביץ' לראותנו ולכבדנו במטעמים מעשי ידיה והתידדתי אתה, כי עם קבלת תשובתה של אמי היא נרגעה לגמרי והיתה מסתודדת הרבה עם חמיה בענינים, שכנראה נגעו בנו.
 
הרבי מדרוהוביץ', מר חיימוני
בגמגום‑מה הסיחה לפני בלומה, שלפי בקשת מישהו מקרובי משפחתה הנני נשאל, אם מעונין אני להכיר את הרבי חיימוני. רבי זה (אגב, סבו של ש. שלום) היה מגזע בין ריז’ין, שגם האדמו“ר בצ’ורטקוב היה נצר ממנו, והיה מקובל על כל חסידי צ’ורטקוב. היו מבקרים אותו ומכבדים אותו בכל הכיבודים המקובלים למרות כמה וכמה פקפוקים: הוא היה חשוד על חיבה לציונות, בהזדמנויות שונות היה משוחח עם הנוער הציוני עברית, היה מטיף להבנה הדדית עם הדור הצעיר וכו'. בני משפחת רוס, הדברים ברבי הצ’ורטקובי, היו מבאי ביתו, ודוד רוס היה ממעריציו, למרות ההסתייגויות שנ”ל. אלי אוס, כמובן, לא היה מוכר בבית הרבי, אלא כאביו של דוד רוס. שאלתה של בלומה הפתיעה אותי והבינותי, ש“מישהו” זה היה סבא שלה. תשובתי היתה, שאין לי ענין מיוחד ברבי; אבל אם הרבי יזמין אותי, אקבל את ההזמנה ברצון ואכבד אותה. כעבור ימים אחדים הביאה לי בלומה כרטיס ביקור מאת הרבי חיימוני, המבקשני לבקרו ביום ובשעה מסוימים. סבא אלי סיפר לי, ששמע מפי בלומה שהוזמנתי לרבי, אבל לא רמז לי כלל וכלל, שהוא ידע על כך ושידו היתה בהזמנה זו. בשעה הקבועה הופענו, אני ובת החסיד, לחצר הרבי. לאחר שנכנסנו לחדר הראשון, קיבל את פנינו הגבאי, ורמז לבלומה שתיכנס לחדר הרבנית, ואילו אותי הכניס לחדר הרבי, לאחר שהודיע לו על בואי. נכנסתי לחדר וראיתי לפני את הרבי, אדם חביב, אם כי פניו לא דמו לרביים, שראיתי בימי ילדותי ברוסיה. הוא שבה את לבי בפניו המסבירות, בבגדיו הנאים ובהדרת הפנים העטורות זקן‑נחושת. התקרבתי אליו וברכתיו בקידה מנומסת. הרבי הושיט לי את ידו לשלום, ברכני בעברית וביקשני לשבת על הכסא שעל ידו. בינתיים שמתי לב, כי האחורי כסאו עומד יהודי בלתי מוכר לי, בעל פנים רציניים ביותר, מתוח, כראוי למעמד הרבי. רבי חיימוני נכנס בשיחה אתי בעברית טובה. הוא שואל ואני משיב – מאין אני, במה עסק אבי; וכששמע שאבי היה רב, שאלני גם אם היה חסיד. כשעניתי בחיוב, שאל על הרבי, וכשעניתיו שהוא הרבי מאוסטראופולי, שיבח טעמו וחישבותו של הרבי. “נו, ואתה? חושש אני שאינך חסיד?”. עניתי: “כדבריך, רבי”. “ואבא ודאי הצטער על כך?”. “מנים כך היה”. עניתי, “אבל בדורנו כל אחד בוחר לו את דרכו בחיים לפי הבנתו ועלינו להסתגל ולהתחשב גם בדעת הזולת”. הוא הסכים לכך. “אבל, ידידי הצעיר, שמעתי טובות עליך. הנך מפיץ ידיעת לשון‑הקודש והנך הגון במעשיך”. ומיד עבר לשיחה פוליטית בעניני מלחמת‑הבחירות לפרלמנט האוסטרי. “אגב, מספרים עליך, שאתה מתכונן לעלות לארץ הקדושה”. וכשעניתי בחיוב, הוסיף בבדיחות הדעת: “אומרים אפילו שאתה מתכונן להעלות אתך בחורה משלנו”. עניתי גם על זה בחיוב. ופתאום הוא מפנה את עצמו ליהודי העומד מאחוריו ואומר ביידיש: “ואתה, דוד, הנך באמת אַנאריש קינד 9. הזמין הקב”ה לבתך בחור טוב והגון, הרוצה להעלות אתו לישראל את בתך, ואת במקום לשמוח על המזל הזה ולראות בכך אצבע אלקים, אתה מעמיד פנים חמוצות. האם אינך מבין: אני ואתה, יהודים לא‑צעירים, יכולים לחיות בגלות הקשה ולמרות הכל לקיים תרי“ג מצוות ולהשאר יהודים. אבל הדור הצעיר קשה לו! אוי, מה קשה להיות יהודים בגלות המרה. ושם, בארצנ הקדושה, הלא מוכרחים הם להיות יהודים טובים. מבין אתה, כשדורך שם יהודי בסביבות העיר חברון ונזכר: כאן רעה דוד המלך את צאנו; כשרואה הוא את שארית מחמדנו, את הכותל המערבי, ונזכר שכאן עמד בית מקדשנו, האם יכול הוא לבלי היות שם יהודי טוב? אתה שותק דוד”. והיהודי יוצא ממחבואו ומתחיל להתנצל: “רבי, איך זאג דען עפעס? 10האם לא אקבל את דעת כבוד הרבי?”. “הרע הוא בזה, שאינך אומר כלום. ואם מבין אתה את הענין, עליך לקום, לגשת לבחור היושב לפניך, להושיט לו יד ולברך אותו במזל טוב וברכה לדרך. ואם ירצה השם, יסתדרו הם בארץ, יזמינו גם אותך ואת אשתך שמה ותחיו חיים מאושרים”. והוסיף כשעיניו כלפי מעלה: “ואם ירצה הקב”ה, אפשר שגם אני אזכה לחיות שם בארץ הקדושה"".
הבינותי כי דוד זה, העומד לפני, הוא דוד רוס, אביה של בלומה וחותני לעתיד. במאמץ מר יצא ר' דוד רוס ממחבואו, מאחורי כסאו של הרבי, הסתכל בי, הושיט לי ידו ומלמל: “מזל טוב” ונשתתק. אני קמתי לפניו ועניתי בברכה. הרבי הרגיש בכך ואמר מתוך בדיחות הדעת: “אוי לי, נתעלם ממני ענין כה חשוב, הן יש לקרוא לנערה ולשאול את פיה, שמא היא אינה רוצה בו, בבחור דנן?”. נכנס הגבאי לתוך דבריו ואמר: “רבי, הנערה כאן, אצל הרבנית”. “קרא‑נא אותה הנה”. הוא רץ והופיע מיד עם בלומה, והרבי פונה אליה. “בלומה, בתי, אבא שלך ברך לפני רגע את מר קראמארוב בברכת מזל‑טוב; אבל שכחנו לגמרי לקיים נוהג מקובל ולשאול את פי הנערה: האם נראה לך הבחור דנן? האם רוצה את להינשא לו? הוא רוצה לקחת אותך לארץ הקדושה, האם מסכימה את לשידוך זה?”. ובלומה מתאדמת, כרגיל, ועונה בלשון רפה: “כן, רבי, אני מסכימה להינשא לו ואף לעלות לארץ‑ישראל”. “אם כך”, אומר הרבי לגבאי, “תן לנו משקה ונשתה לחיים לכבוד החתן והכלה ולכבוד דוד”. היין הוגש, שתינו לחיים ולמזל‑טוב. ברכתי א הרבי, הודיתי על טרחתו, הבעת את תקוותי שפגישתנו הבאה תהיה בירושלים, ויצאנו מבית הרבי, בלומה, אני ואביה. הלכנו לבית סבא. הדרך הזאת היתה הקשה ביותר שאני זוכר בחיי, עברנו כל הדרך בשתיקה. לא מצאנו שפה משותפת. לא ידעתי אם הוא יודע עברית, ואף נושא משותף לא היה לנו, בשמחה פגש אותנו סבא אֶלי ובחיוך על פניו אמר: “או, איפה נזדמנתם כולכם יחד, יקירי? ומה חדש?”. כאשר הודיע לו בנו, כי נפגשנו אצל הרבי חיימוני, והרבי ברך את מר קראמארוב ואת בלומה לנשואיהם, התפלא הזקן והתמם. אולם ברור היה, כי לא קיבל את כל הסיפור ברצינות. הוא ידע את אשר ידע, וכאשר שאל אותי בפני בנו: “ומתי רוצים אתם להתחתן?”. עניתי: “אפילו מחר”. הוא שחק ואמר: “סע ברענט ביי אייך?” 11. הוא הסביר לי, שבלומה היא בת‑טובים, ולא יוציאו אותה בלי “פובעלע”, בלי חגיגת נשואים הגונה. לכך דרוש, לפחות, חודש ימים להכנות. “מה אתה אומר, דוד, יספיק חודש?”. האב גמגם משהו והניע בראש. פסק סבא: נו, אם ירצה השם, נזמין אתכם לחתונה. סבתא עשתה את שלה, נשקה רבות את נכדתה, הגישה יין ומגדנות, שתינו לחיים ולמזל‑טוב, וסוף‑סוף שחררנו את ה“מסכן” לנסוע לביתו ולהתחיל בהכנות לחתונה. אני ובלומה נכנסנו לחדרה ובילינו שעתנו בשמחה ובבדיחות הדעת על מעשי הרבי וסבא וגמר הפתרון במזל‑טוב.
 
ערב הנישואין
ליל‑נדודים קשה וארוך עבר עלי. ידעתי מה צפוי לי ביום הנישואין, הנני הולך לגוב האריות – או נכון יותר לגוב התנים – מאד מאד לא אהבתי את ה“חברה”. אויבי בנפש היו החסידים האלה, שהם יהיו המחותנים והאורחים. נזכרתי ברב, שעתיד למסור לידי מחר את אהובת נפשי, באב האומלל, שמסר את בתו לאדם הפסול בעיניו בכל, באם המסכנה וכו' וכו'. ידעתי, כי איש מידידי לא ישתתף בטכס הזה, כי כך נדברנו אתם, לפי בקשת המועדון “עבריה”, שהזמינו אותי למסיבה מיוחדת במועדון, אולם סבור הייתי, כי חייב אני לעשות כל הנדרש ממני ע""י הורי ארוסתי: כי מאידך גיסא, הרי אני הוא שפרצתי למשפחה, שדדתי ממנה את הבת ומרחיק אותה מביתה, מארצה וממולדתה, וגרמתי לאב צרות כל‑כך הרבה. ומה הוא ערך הגמול הדרוש ממני? הנני מוכן לגמול להם ביום זה את כל הרצוי להם.
בבוקר גמרתי את כל ההכנות, וב-11 בצהרים, ביום חורף נאה, נסעתי לבוריסלאב, בלווית הזוג אוברלנדר, דודה החורגת של בלומה ובעלה. בבוריסלאב סרו למלון נאה, וב-2 אחה“צ הובאתי לדוד יעקב, שביתו היה סמוך לבית הורי בלומה, שם חיכו לי הדוד והדודה ומשפחתה, תלמידותי לשעבר, חברות “עבריה”, שגם בת הדוד היתה אחת מהן, באו לקדם את פני ולברך אותי לנשואי, אחרי שעשו זאת לבלומה, הביאו לי מגילת ברכה כתובה על קלף והסתלקו. ב-3.30 מסר לי הדוד סידור‑תפילה בסימון התפילות, שעלי להתפלל ביום זה. קבלתי זאת עלי ברצינות (הפעם הראשונה בחיי) והתפללתי את כל התפילה בהגינות, לפנות ערב באו סבא והאב וכמה מקרובי המשפחה ולקחוני לחופה, שהיתה בתוך בית ההורים, כרגיל, הייתי צריך למלא כמה מנהגים תפלים. באדישות נמסרתי לידיהם ועשיתי ככל אשר צוויתי. מה מגוחך היה הכל. הייתי צריך לחזור על דברי מסדר הקידושים, יהודי זקן מרופט לבוש “בקשה” חסידית, בעל זקן שלא טעם מימיו טעם מסרק, המקריא לי בעברית משובשת במבטא אשכנזי: “הרי – הרי, את – את, מקודשת –מקודשת, לי – לי, בטבעת – בטבעת, זו – זו, כדת – כדת, משה – משה, – וישראל – וישראל”. חלילה לי לומר הכל בבת אחת בלי עזרתו של היהודי הזה ובשפה מתוקנת. כן נקראה לפני ה”כתובה"" בשפה הארמית, שקניתי לי אשה במחיר 100 קרונות, שאצטרך להחזיר אותן לה, אם אשלח אותה ברצוני מביתי, ועד אז אני צריך להאכיל אותה ולהלבישה וכו‘. הצד הטוב היחידי שבטכס זה היה קיצורו. הקהל היה מצומצם, כפי שנאה לחתונה כפויה (אשטילע חופה). נו, “מזל טוב!” האם עצרה בכל כוחותיה בעד דמעותיה. האב התלבט בצערו, ובזה נסתיימה הפרשה. “קהל ידידי” התפזרו, אני נשארתי לשבות בבית‑ההורים. הונח לנו, כשהאב מהר לבית‑הכנסת, המסכן אף לא הזמין אותי לשם, כמובן, בארוחת הערב עשיתי לו נחת‑רוח, שהעלתה חיוך על פניו, בקידוש לפני הברכה על הכוס במקום: “סברי מרנן ורבנן” אמרתי: “ברשות חותני הנכבד, אבי אשתי”, לא לפי הנוסח הקבוע בסידור. השיחה בשעת הארוחה היתה כמובן ביידיש. הארוחה לא ארכה הרבה ואחריה יצאנו, הזוג הצעיר, לרחוב לטיול. נשמנו אז לרווחה וטיילנו כשעתיים. אחרי שליוויתי את בלומה לבית הוריה, סרתי למלון. מעניין הדבר, שגם למחרת לא הזמין אותר ר’ דוד רוס לבית‑הכנסת. רזיגנאציה גמורה.
במוצ“ש התכנסו לבית ר' דוד רוס ידידי האב, הגברים החסידים, בילו על כוס יין ושירי חסידים. אני ובלומה ישבנו מן הצד, הסתכלנו במסיבה זו ומצאנו בה ענין. כרגיל, במסיבות מוצ”ש מספר אחד החסידים מופתים של הרבי. פתאום הציע מישהו מהם: “שמא יספר לנו החתן איזה מופת מהרבנים שלהם?”. לא נעימה היתה לי חברתם, אבל בראותי את עיני אשתי מופנות אלי, כמבקשות לעשות הפעם נחת‑רוח לאב, ניגשתי לשולחנם וסיפרתי להם ביידיש את סיפורו של פרץ: “אם לא למעלה מזה”. התפעלותם עברה כל גבול. עמי‑ארצות אלה לא שמעו על פרץ והיו בטוחים, שאני מספר להם יצירה משלי. ולפי בקשתם הוספתי להם עוד סיפור על הרבי משפולה, שאחר ל“כל נדרי”. לפי הסיפור, היה הרבי משפולה נוהג לפני יום‑הדין לגנוב פרוטה מכספי מאיר‑בעל‑הנס, והיה אומר באנחה: “רבונו‑של‑עולם! מוטב שה”סבא משפולה"" יהיה גנב ויבוא על עונשו בעלם הזה ובעולם הבא ובלבד שעמך ישראל לא יהיו לוקים בגופם!“. נזדעזעו החסידים מגודל אהבת ה”סבא"" לבני עמו משמרו את הדבר בלבם. החסידים שלי נתלהבו מאד מסיפורי ואחד מהם הכריז: “ואני אומר לכם, ש”‘פוני’ זה הוא אחד מל“ו הצדיקים, אֵ”ניסתר“!” צחקנו כולנו בלב טוב, נפרדתי מהם ואני ואשתי הלכנו בלב שמח לטייל ברחובות העיר.
למחרת בבוקר עזבנו את בית ההורים וחזרנו לדרוהוביץ' לבית סבא. ועד בית‑הספר זיכנו בשבוע של חופש, שבעת ימי המשתה, וניצלנו את הזמן לשכירת דירה מרוהטת לחודשים מספר. חותנתי באה בלווית שרה, סידרו אותנו ודאגו, שבלומצ’ה לא תטרח ותיהנה מפגרתה. כך עברו עלינו החודשים האחרונים לישיבתנו בגולה. חיינו בדירתנו כמאמר ההמון: “ישבנו על מזוודותינו”.
 
העליה לארץ
 
מימי העליה השניה עד מלחמת העולם הראשונה
 
העליה ארצה
 
הכנותינו לעליה
החורף של שנת 1908–1907 קרב לקיצו והכנותינו לעליה מתנהלות בקדחתנות רבה: אנו מחפשים מועמדים למלא מקומנו בבית‑הספר “שפה ברורה” בדרוהוביץ‘, מחסלים את משק ביתנו הזעיר. את חסכונותינו הדלים – 1200 כתר אוסטרי – העברנו לבנק אפ“ק ביפו. מתהלכים אנו נרגשים בבחינת “וגילו ברעדה”, על צד האמת, לא פחדנו מהבאות בארץ האבות, שום דאגה לא העיבה את שמינו על חיינו וקיומנו בארץ. גם לא החלטנו בשאלת עבודתנו שם, אם כי זה חודשים רבים נמצאנו בין שני כוחות משיכה עזים: הוראה בבית‑ספר באיזו מושבה או “כיבוש עבודה בפרדסי היהודים במושבים”. לא הרבה ידענו על העבודה החקלאית וכיבושה, אבל משהו למדנו מתוך כרוזו של ויתקין “עלו” כן קראנו את החוברות הראשונות של “הפועל הצעיר” וחשבנו את עצמנו מוכנים לחיי העבודה, אם כי החיבה והנטיה להוראה לא נחלשה בלבנו. הדאגה הגדולה ביותר נגרמה לנו על ידי חוסר דרכון שלי לכניסה לארץ. בגאליציה הייתי פליט, שהבריח את הגבול הרוסי וחסר כל תעודה. פרחה רעיתי היתה מצויידת בדרכון אוסטרי כשר, אבל כיצד אחדור אני לארץ האבות? ניסיתי בדרכים שונות לקבל עצה והדרכיה והעליתי חרס בידי: פניתי ללשכת המודיעין של מר שיינקין בשני מכתבים. הודעתי להם, כי יש בידי אמצעי‑כסף מספיקים לפתיחת שערי הארץ בשבילי, רק עצה ביקשתי מהם – מה עלי לעשות? ולצערי ולבושתי, לא קבלתי כל תשובה על מכתבי. י”ח ברנר, שהתגורר בימים אלה בלבוב, התקשר עמי (הכרנו זה את זה בלונדון). הוא ביקש ממני עצה באותו ענין, הוא היה בטוח, שגיבור כמוני חזקה עליו שיוכל לפתוח את כל השערים בתבונה, כאשר שמע על התלבטויותי ואזלת ידי, החליט לדחות את עלייתו, כד שאגיע אני ארצה ואדריך אותו משם על הצעדים הדרושים לכניסה ליפו, ואז ילך בעקבותי. (אגב, קיימתי את הבטחתי ותארתי לו את הצלחתי לחדור ליפו למרות הכל). ברין ברירה עזבנו את דרוהוביץ’ בלב כבד ושמנו פעמינו לוינה‑טריאסט. ושלום שלום לאכסניה החביבה שלי – גאליציה – בדרכי לארץ האבות.
 
וינה – טריאסט
תחנתנו הראשונה בדרכנו ארצה היתה וינה, שהינו בה יום. בוינה, עירו של הרצל, היתה קיימת לשכת ייעוץ והדרכה לעולים לארץ‑ישראל באותו הבית ב“טירקענשטראסע” שבו היה לפנים משרדו הציוני של המנהיג הדגול. הגענו למשרד ומצאנו בו איזה יהודי נוקשה ורגזן. הוא שמע אותנו ללא סבלנות יתרה וענה לי תשובה פסקנית, קצרה ויבשה, בגרמנית: “אדוני! עוד לא חזר יהודי מיפו מחמת סגירת שערי הארץ בפניו”. בזה נסתיימה הדרכתו ועזרתו לעולים הצעירים. ניסיתי לדובב את שפתיו, אבל הוא ענה לי, כי שיחתנו באה לקיצה. קמנו ברוגז והלכנו לדרכנו לטריאסט. קנינו שם כרטיס נסיעה באוניה, שלא ידענו טיבה, לא היה מי שייעץ לנו. קנינו לנו צידה לדרך לשבועיים, מיטה מתקפלת, פתיליה, והסתדרנו באונית המשא בין הסיפונים. בלעדינו היה שם רק נוסע אחד, גם הוא פליט צעיר מאודיסה. כמונו היה גם הוא חסר כל תעודה והדרכה. טולטלנו באוניה זו 10 ימים עד הגיענו לאלכסנדריה שבמצרים. קשה היתה דרך זו לפרחה. רוב זמנה בילתה בשכיבה במיטה ובהקאה. אני, שאיני סובל ממחלת‑ים, טיפלתי בה והייתי ממונה קבוע על הפתיליה ועל הכנת תה בלימון וכדומה.
 
במצרים
