,Title,Translator,Lang,Author,Text
כלל קבענו לנו בבואנו ליבנאל לתאם את חיינו לחיי הכפר. בגדינו היו פשוטים והתאימו לבגדי האיכרים, מאכלנו היה פשוט ואף גרוע מאשר מאכל רוב האיכרים, כי פרחה במחילה, לא ידעה את תורה הבישול וגם היתה טרודה בעבודתה בבית‑הספר ובטיפול בילדה. והספרדיה הטברינית בישלה והזינה אותנו מאכלים ספרדים וערבים לפי טעמה והבנתה. הדבר היחידי, שלמדה פרחה ממנה על בוריו, היה המאכל הנזכר על ידי יוסף ווייץ: אורז מתובל בצימוקים וקנמון. אני מתגעגע עליו עד היום הזה.
מהיום הראשון לבואנו ליבנאל התחלנו להתעניין בחקלאות. זוכר אני את שיחות המשפחה העגומות: מצאנו סיפוק רב בהוראה, אהבנו את התלמידים ואת עבודתנו בבית‑הספר, ברצון טיילנו עם הילדים בסביבת המושבה, שיחקנו אתם בכל מיני משחרים, אבל לנו לעצמנו חסרה החקלאות.
לא שכחתי אף ליום אחד את תורתו של א""ד גורדון והשקפתו על חינוך הנוער לחקלאות. קמה פרחה הטובה שלי והחלה לנחם אותי: “טוב, הגורל הוטל ואנו מורים, אבל בידינו לשלם את המגיע מאתנו גם לחקלאות. מי ימנע מאתנו להקדיש את זמננו הפנוי ושארית כוחותנו למשק זעיר שנייסד לנו?”.
המושגים של “משק עזר” עדיין לא היו אז ברורים ונהירים לנו. אבל ניגשנו לפעולה בגישושים. הענין היה לשיחה במושבה: המורים מתאווים לעבוד בחקלאות. זה בא ומציע לנו לקנות ממנו תרנגולות, השני אווזים, השלישי עזים, ואנו חוטפים מכל הבא ליד, והחצר שלנו מתמלאת והולכת. אגב, מוכר האווזים היה הערום ביותר: מכר לנו ארבע אווזות ואווז אחד, לתמהוננו, לא הטילו האווזות ביצים; ורק אחרי חודשים מספר נתברר לנו על ידי אחד האיכרים, שהאיכר רימה אותנו ומכר לנו חמישה זכרים. קנינו שלוש עזים וחכינו להמלטה ולחלב. מאחורי ביתנו היה מקום לגן, כמו לכל איכר, והחילונו לעבדו. היה זה שטח של ארבעה דונמים. ואל תקנאו בנו בעסקנו זה. התלמידים בני ז' וח' היו מתקהלים מסביבנו לקיים את הבטחתם וללמד את המורים חקלאות. נזכרתי אמנם מעט מעיבוד גנו של סבא, אבל הידיעות לא הספיקו ולא התאימו לאקלים ארצנו ולמנהגים המקובלים בה. בלילות ישבנו על ספרים ולמדנו ככל האפשר. גם התלמידים קיימו את הבטחתם.  שימשנו חומר מצויין להלצות בין האיכרים, אבל הנבונים שבהם היו אומרים: “לאט לכם ללעוג לאנשים אלה – הם עתידים עוד ללמד אותנו פרק בחקלאות”. ובינתיים שתיים משלוש העזים מתו ונשארה לנו לחליבה עז יחידה. היא שימשה בית‑ספר ללימוד חקלאות לפרחה. אני לא העזתי לשלוח יד במלאכת החליבה. הקטנטונת ציונה היתה מטפלת בתרנגולות ומפזרת להם גרעיני מאכל. והנה חשקה נפשנו בפרה: משק הרי הוא משק, והוא צריך להיום מגוון. אמנם ידידינו במושבה התרו בנו ואמרו: “שום איכר לא ימכור לכם פרה טובה”; ואחרים יעצו לנו לפנות לערבים השכנים. אבל אנו לא התאפקנו וקנינו פרה מהאיכר סולימאן הכורדי.
 
היסוסים וגישושים
מורים צעירים היינו בימים ההם. דרכנו לא היתה סלולה בשיטות ההוראה, וכן היססנו אם מותר לנו, לאנשי “הפועל הצעיר”, לבוא לישוב השטוף בעבודה זרה, בהסתגל, ולעבור על כך בשתיקה בפני תלמידינו; או מחובתנו לדבר אמת גלויה בפניהם, ולו תהיה מרה כלענה, ולו גם תרחיק את הילדים מאבותיהם ותקומם אותם נגדם? גם הצעד המעשי לא היה בלתי חשוב. הדוגמא של ארליך לא היתה פחותת ערך. היינו אנשים בודדים ללא אמדה ציבורית. לא היו מאחורינו, כמו בימינו אלה, הסתדרות מורים לוחמת, הסתדרות העובדים. רבים היו הפקפוקים והשיחות בינינו, המורים, והחלטנו ללכת בדרכנו, לחיות ולעבוד לפי מצפוננו. מהימים הראשונים ביבנאל הנהגנו שיחות עם התלמידים הבכירים, מעין זה שהיה נהוג אז בגרמניה ושלא ידענו על זה הרבה: “געזאמט‑אונטריכט”. היינו מרשים לילדים בשעות השיחות לשול ולדבר על כל העולה על דעתם.
מובן, שהילדים התעניינו בדברים שבהם יש חילוקי‑דעות בציבור, כגון שאלת העבודה העברית והשמירה יהודית, נושא שעורר וויכוחים בכל בית ללא פוגה. מה צריכה להיות עמדתנו? ראשית, שללנו את ההתרברבות של הילדים כלפי הוריהם. טענו: “אין לכם זכות לבטל את הוריכם ומעשיהם, הם עזבו בית הורים, היגרו, עלו לארץ, התמסרו לעבודה חקלאית שלא נוסו בה בבית הוריהם. התיישבו בחבל פרוע ושומם והקימו ישוב במאמצים רבים. ואתם, שעדיין לא עשיתם כלום בארץ, האם יש לכם זכות לגנות את מעשי הוריכם וחטאיהם?”. ושוב, למשל: “ערביה באה לחצרכם וחולבת את הפרות. זהו עוול משווע. זהו אסון. הנימוקים ברורים, אבל לוּ אַת, הנערה, היית מעמיסה על עצמך את החליבה ומשחררת את אמא העייפה והכושלת מרוב עבודתה, האם לא היית מנצחת? ויחשוב כל נער עד כמה הוא יכול לעזור לאביו ולהקל עליו את עולו, עד שלא יהיה זקוק לעזרה הערבית. זוהי הדרך ואין אחרת”.
לא העלמתי את שייכותי למפלגת “הפועל הצעיר”, אבל אמרתי: “אני איני מתרברב, לא אדון את הוריכם לכף חובה, מכיון שלא הגעתי למקומם, אבל אשפיע עליהם בכל מאמצי להתגבר על החולשה ולהגיע לידי עבודה עברית. וכן גם ביחס לשמירה: יכול אני על נקלה לצעוק ולגנות את הוריכם הנפחדים, אבל המותר לי לשכוח, שהם דואגים לא רק לעצמם אלא גם לכם? אולם, אם אני אעמיד את עצמי לרשות השומרים, אקח חלק בהגנה על המושבה, אצא לעזור בשמירה, תהיה לי אז הזכות לדרוש מההורים שמירה יהודית. על‑כן אני מזדיין, על‑כן אני לומד רכיבה, קליעה, ריצה, ולזה אני רוצה להכין גם אתכם”. וכאשר ההורים היו טוענים, שאני גוזל מהם את ילדיהם ומקומם אותם נגדם, הייתי מוכיח להם, כי אני רוצה שהילדים ילכו באותה דרך, שפעם הלכו בה גם הם בהיותם צעירים, אבל איני מפחית את ערכם בעיני הילדים. הייתי אומר: “אני מצטער על החקלאי, שצריך לקנות ירקות מרוכלים ערביים, שאין לכם חלב בחלק הגון של השנה, אבל מעולם איני משפיל אתכם בעיני תלמידי”.
הצבעתי על הגרים ופועלם בחיפושי אמת ואמונה למרות הסכנות, שהיו צפויות להם, ודרשתי מהתלמידים שישלימו פועל הוריהם. הילדים חיבבו אותנו, המורים, ומזכירים אותנו עד עכשיו. כשנפגש אני אתם, והם כבר הורים לילדים, הם עדיין זוכרים אותנו ומזכירים בגעגועים את הימים הטובים ההם. נודעו לי לא פעם מקרים של התאוננות ההורים בביתם נגדי, שתלמידי היו מגינים עלינו וטוענים, שלא שמעו מפינו שום לעז על הוריהם. הייתי טוען תמיד: “יתמו חטאים ולא חוטאים”. גזרנו עלינו, שלא לעורר תשומת‑לב מיוחדת בלבושנו, שהיה כלבושם הרגיל של כל האיכרים. כמות עבודתנו לא היתה קטנה מכמותה של עבודת האיכר. גם מאכלנו לא עלה על מאכל האיכרים. מורתם היתה מהיחידות במושבה, שחלבה את פרתה ועבדה על עבודה קשה בבית ובחצר, וכל זה אחרי עבודה לא קלה בבית‑הספר, רצוננו היה נחוש להכין לנו משק‑עזר חקלאי ויהי מה. עמלנו על כך עשר שנים ולא יכולנו.
ובעבודתנו הפדגוגית: לא היינו מחוסרי כשרון. פרחה היתה מלאה ידיעות במקצועותיה כרימון. אני למדתי בלי הרף ומצאתי מופת נפלא בוולקומיץ שבראש פינה. את יחסי לוולקומיץ, יחס הערצה, והחכמה שלמדתי ממנו תארתי במאמרי בספר “המורה”, שיצא לאור על ידי הסתדרות המורים. ביחוד לקחתי לדוגמא את הוראת החקלאות בגן הנפלא על יד בית‑הספר בראש פינה. חיקיתי את עבודתו של המורה וולקומיץ, ואף העזתי לחלוק עליו בכמה דברים.
 
החיים בביתנו
סידור החיים בביתנו לא היה קל. רוחמה, הספרדיה מטבריה, לא החזיקה מעמד בביתנו. חסרה לה החברה משלה. גם לנו לא היה קל להסתגל למאכליה, ובכלל לא היה נעים לנו, אנשי “הפועל הצעיר”, להעסיק עובדת שכירה וחיפשנו דרך לסגל את חיינו לפרינציפים שלנו. היינו מוכרחים למצוא אדם, שיטפל בילדה ושיעזור לנו במשק הבית. נוסף לכל חיפשנו אדם, שידע את השפה וידע להתהלך עם הילדה. ברצוני לציין כמה קוריוזים ומכשולים בדרכנו זו. חיפשנו בין עולות העליה השניה עובדת משכילה, להזמין אותה לתפקיד המדובר. פועל אחד ממכרינו הציע לנו את קרובתו לעבודה זו במשק ביתנו. כדי שלא תרגיש את עצמה מנוצלת, הוחלט בינינו, שנחלק את הכנסותינו חלק כחלק: אנו נכניס למשק הבית את כל משכורתנו, נוציא להספקה כמה שנוציא, ואת השאר נחלק בינינו לשלושה חלקים חלק כחלק. האידיליה נמשכה כשלושה חודשים, וביום בהיר אחד הודיעה לנו העובדת, כי היא מתחרטת על התנאים ועוזבת אותנו. לדעתה, אוכלת הילדה הרבה עוגיות, וזה נופל גם על חלקה. נשארנו שוב ללא עובדת. שוב חיפושים בטבריה, שוב ספרדיה, ומאז עד היום הזה עשרות שנים לא מצאנו שום סידור, שיניח את דעתנו, פרט לסידור עם רחל סופר, שאספר עליו בדפים הבאים.
 
לילית
משאת נפשנו היה “משק עזר” לבית, מס לגעגועינו על חיי חקלאות. ואין משק בית ללא פרה. למרות אזהרת ידידנו, שלא לקנות פרה מיהודי המקום, קנינו מאת סולימאן הכורדי פרה במחיר תשעה נפוליאונים זהב. סמכנו על הנחתום, שהעיד על עיסתו, שהפרה טובה ובריאה ותהיה שופעת חלב אחרי ההמלטה. קיבלנו את הפרה, כינינו אותה בשם “לילית” בגלל הבטה הזועם וחיכינו להמלטה. השתוקקנו לחוויה של המלטת העגל בחצרנו. הפרה היתה אדמדמת, יפה, אבל משום‑מה נדמה לנו כי מבטה מרושע. ביום שהביאו אותה אלינו ערכנו לה כירה עשירה מסובין, שהיו במחסננו, והשתדלנו כל הזמן לקנות ליבה ב“מגדנות”. סמכנו על מאמר חז""ל: “גדולה לגימה, שמקרבת את הרחוקים”. פרחה חיפשה לה הזדמנויות להסתכל בחצרות האיכרים בחליבת פרות, שהקדימו להמליט, ופה ושם ניתנה לה אפשרות לחלוב קצת, והיינו מוכנים לקראת הימים הגדולים והחשובים.
ערב אחד חזרה הפרה מן העדר, כשהרועה נושא על גבו עגלה, אדמדמה ונאה. רבה היתה השמחה במעוננו, ביחוד שמחת ציונה הקטנה, ועשירה היתה הכירה שערכנו לכבוד האם היולדת. הגיעה השעה לחליבה. ראשית החלב ניתנה לעגלה. הפרות הערביות אינן שופעות חלקבן לפני שהעגל שבע, וגם לאחר מכן צריך העגל להשאר על ידן – נכון יותר על רגלן. קשרנו את העגלה אצל הפרה, פרחה ברכה “שהחיינו” והתכוננה למלאכה. ואני מכרכר סביבה. היא התיישבה לחליבה, רק נגעה בעטין – ופתאום הושלכה הצידה על ידי בעיטה מחוצפת של לילית. רע היה המצב, אבל לא אמרנו להיכנע. הבאתי חבל, זרקתי אותו בצורה שיכולתי לכבול את רגלי לילית האחוריות, בלי שתצליח לעשות לי מה שעשתה לפרחה. ופרחה ניגשה שוב לחליבה. הפרה השתוללה והתוצאה היתה אחרי מאמצים רבים שלוש ארבע כוסות חלב הביתה. אמנם אין משתמשים בחלב בימים הראשונים להמלטה, אבל פחדנו שלא לחלוב אותה, כי העגלה לא תוכל להוציא מעטיניה את כל החלב. בינתיים התברר לפרחה, שלילית חולבת רק בשלושה דדים, מהדד הרביעי לא יצאה אף טיפת חלב אחת. מאז נקבע המנהג של חלוקת העבודה. אני, מנהל‑בית הספר, כובל את רגלי הפרה ומכרכר סביב אשתי החולבת, העושה מאמצים ריבם להרבות את החלב – ולשוא.
 
סיכום עבודתי בשנה הראשונה לחיי בגליל
הקיץ קרב לקיצו והחלטתי לרשום ביומן את סיכום עבודת השנה ביבנאל. וזה אשר מצאתי ברשימותי הקצרות ביומני.
בעבודה הפדגוגית:
עמלתי הרבה בלילות בקריאה בספרות הפדגוגית, בעיקר בשפה הגרמנית, השתדלתי להגשים רעיונות ונסיונות פדגוגיים. אולם רבות למדתי מפי מר וולקומיץ, שהערצתיו עוד לפני שהכרתי אותו פנים אל פנים וראיתיו בעבודתו. פעולתו בחינוך לחקלאות לקחה את לבי שבי עוד מיום שהתפרסמה הרצאתו באספת המורים בזכרון‑יעקב. עשיתי לילות כימים ברכיבה לראש‑פינה כדי לבקר יום תמים בבית‑ספרו.
חודשים מספר אחרי בואי ליבנאל עליתי בפעם הראשונה לראש‑פינה. אחד המתיישבים הצעירים ביבנאל היה בן ראש‑פינה ובעבר תלמידו של וולקומיץ. הוא סיפר לי רבות על מורו וגם הציע לי ללוות אותי שמה באחד הימים של הפסקה בעבודה לרגל מזג אויר רע.
במוצאי אחת השבתות אחר חצות רכבנו שנינו על הסוסים בשבילי שבילים – בדרך טבריה אין לעבור ללא נשק וזיון – בגלל הסכנה הגדולה בדרכים.
עם צאת החמה הגענו לראש‑פינה. סרנו לבית הוריו של מלווי, סידרנו שם את הסוסים, נתכבדנו בארוחת בוקר, ואני שמתי פני לביה""ס.
לא קשה היה להכיר את בנין ביה“ס, בנין גדול‑מידות בין בתי האיכרים הקטנים שמסביב לו. השעה היתה מוקדמת ובביה”ס נמצא רק השמש. חמקתי לחצר ביה""ס ומשם ראיתי את הגן שטוח לפני במלוא הדרו, כי החצר היתה גבוהה ממנו מטרים אחדים. הגן מעובד בקפדנות, זרוע ושתול. כל חלקה מוקפת גובל פשתים, עשבי בר אינם נראים כלל ובכל ניכר חינוך עבודה קפדני. טיילתי בשבילים נלהב ולא שמתי לב, כי מישהו עוקב אחרי, עד שהתקרב אלי. הבטתי בו ומיד הכרתי את מר וולקומיץ. ניגשתי אליו, הצגתי את עצמי וביקשתי סליחתו על שחדרתי לגן ללא רשות. הוא קיבלני בסבר פנים יפות. את שמי כבר ידע, אבל, לפי דבריו, איני עושה עליו בחיצוניותי רושם של מורה: “לפי לבושך, מגפיך והליכותיך הייתי חושב, כי לפני איכר גלילי משכיל, פועל ואולי שומר”. “השתפכתי” לפניו על מראה הגן ועל שמו הטוב של בית‑ספרו וביקשתיו לתת לי אפשרות להכיר את מפעלו, להכיר את מורי המוסד ודרכי ההוראה בו וללכת בדרכי המנהל: “צעיר אני וחסר נסיון וזקוק לרחמים”.
הוא פתח לפני באדיבות את בית‑ספרו וכך נעשיתי אורח תדיר שם, שמעתי שיעורים, בעיקר שעוריו שלו, ולמדתי ממנו הרבה. חברי שביקרו לעתים בשעורי התלוצצו עלי ואמרו, שמשתדל אני לחקות את שיעורי וולקומיץ. לא התביישתי בכך, כי אמן ההוראה היה וולקומיץ. אני מטבעי אוהב שיחה ומרבה בה. בכיתות הרגשתי, שאני מדבר יותר מדי ותלמידי פסיביים מדי והנה ראיתי את וולוקמיץ בכיתה העובדת במרץ ובחשק – נחיל דבורים ממושמע – ועליה עומד המורה פסיבי, לכאורה, שאינו מרבה בדיבור, והרושם הוא כאילו מיותר הנהו בכיתה. פה ושם הוא מכניס תיקון בדבריהם או מסכם את הנאמר.
זוכרני, שפעם החלטתי לספור את המשפטים, שהשמיע פדגוג מעולה זה ולא הגעתי לשלושים! שום בעיות של סדר ומשמעת לא נתעוררו, כמובן, בכיתתו.
שיעורים נפלאים שלו שמעתי בהנדסה, בכימיה, בתורת הצמחים וכו'.
ככלות העבודה בביה“ס לא נתנו לי האדון והגב' וולקומיץ – שניהם היו מכניסי אורחים – לשוב לביתי בלי שאסעד על שולחנם. בהזדמנות זו שוחחנו הרבה על ביה”ס ועל ההוראה. וולקומיץ היה “בעל מלאכה אחת”. כל ימיו חי בכפרים נידחים ועמל לחנך את תלמידיו לחיי עמל ועבודת האדמה. ההצליח? למרבה הצער לא היתה הצלחתו רבה. העזיבה בכפר היתה מרובה הצעירים שאפו לחיים קלים, היגרו לאוסטרליה ושאר הארצות בעולם ובכפר היה חסר נוער.
אנו, בני הגליל התחתון, חיינו חיים פשוטים יותר ממורי הגליל העליון, התערבנו גם בעניני הציבור, במלחמה לעובדה עברית, לשמירה עברית, וגם בשיטות העבודה החקלאית. בני הנוער במושבה היו כרוכים אחרינו בחיי המעשה.
אולם אין לזקוף את הצלחתנו היחסית רק לזכותנו. בגליל התחתון ראו תלמידינו פועל יהודי ושומר הכפר והשדות משלו והושפעו מהם במידה לא מעטה.
וולקומיץ היה מנהל בית‑הספר בראש‑פינה ומפקח על שאר בתיה“ס בגליל העליון, לרבות ביה”ס העברי בצפת.
בודדה מאד היתה משפחת המורים, ביחוד לפני בואם של טורקניץ ז“ל ויבלח”א הד“ר ב' בן‑יהודה, שהיטו שכם לעבודה הפדגוגית בביה”ס והפיגו במעט את בדידותה של משפחת המורים.
צר מאד שלא זכה המנוח לראות את בתו עבריה ובנו עמי אסף חקלאים עובדים וממשיכי מורשתו בעבודה ובחינוך.
מובן, שפה ושם חידשתי משהו בדרכי החינוך: השתדלתי לחנך את תלמידי ברוח הרעיונות של א“ד גורדון, עד כמה שאפשר בכלל לחנך נוער ב”דיבורים"". שוחחתי רבות עם התלמידים בכיתות הגבוהות על עבודה עברית ושמירה עברית. רבים מתלמידי התרשמו מחיינו, מהפשטות שבהם במאכל, בלבוש, בדירה וכו'.
הייתי גם פעיל בציבוריות. השתתפתי בסניף המורים, שהיו בו עשרה מורים מיבנאל, מרכז הגליל התחתון בימים ההם, ממלחמיה, מכפר תבור וסג’רה. חידשנו את החג ט""ו בשבט, ובשנתי הראשונה ביבנאל ערכנו פגישת תלמידים מארבע המושבות ונטענו עצים במגרש, שניבנה עליו בימים ההם בנין חדש לבית‑ספרנו.
פרחה הגבילה עצמה במקצועותיה, המשיכה לאסוף מצמחי המקום וההרבריום שלה גדל משבת לשבת. הצל היחיד בחיינו בקיץ ההוא היתה המלריה, ששוב חלתה בה פרחה ובמקצת גם הבת ציונה. לא רבה היתה השפעת התרופות הפרימיטיביות, שהשתמשו בהם רופאי המושבות והרוקח ביבנאל. נוספה על זה גם מחלת עינים של בתנו. המצב הזה נודע גם להורינו בבוריסלאב, ופרחה נדרשה לבקר בבית ההורים בחודשי הפגרה השנתית. האם הקדישה לכך את חסכונותיה, כי עזים היו געגועי המשפחה על הבת והנכדה. ואומנם כשבוע לפני גמר הלימודי הפליגה פרחה לחיפה עם בתה לטריאסט ומשם בוריסלאבה.
חודיים ימים של מנוחה ומרגוע בקארפאטים, טיפולם המסור של בני המשפחה העלו ארוכה לארץ‑ישראליות ובשובן אלי היכרתין בקושי. שתיהן הבריאו ופרחו לשמחת כל ידידינו. ובזה נכנסנו בכל המרץ לעובדתנו בשנה השניה בגליל.
 
שנתנו השניה בגליל
בשנה השניה בבית‑הספר ביבנאל הלך הכל למישרים. פה ושם הכנסנו שיפורים בעבודת ההוראה. הבנין החדש הכניס נוחיות ועליצות בחיינו. גם בית‑הספר גדל והשתפר. השתדלתי לחקות את גן ראש‑פינה. אומנם ידיעותי בחקלאות לא רבו, אבל תלמידי היו בקירים בעבודה המעשית ולא נתקלנו בקשיים רבים, אם כי המים להשקיה היו לנו במשורה. פרחה העישרה לאט לאט את ההרבריום שלה. זכינו גם לעובדת טוב, והיא חיינה, חברתנו ב“הפועל הצעיר”, שגמרה את עבודתה בקבוצת אום דשוני שהתפזרה. חיינה היתה זקוקה לעבודה קלה יותר וקיבלה עליה ברצון את הנהלת משק ביתנו. היא התנחמה בזה, שיש לנו משק עזר: שתי פרות, עזים ועופות. היא גם שמחה להזדמנות שניתנה לה להשתלמות בדיבור העברי בביתנו.
 
כ' בתמוז
