,Title,Translator,Lang,Author,Text
0,בָּרוּך בּוֹאֲךָ הַדוֹד שַאלַא.,,,אביגדור המאירי,"
הגעת, הדוד שאלא יקירי, הגעת למחוז כל חלומותיך, הגעת, סוף־כל־סוף, הביתה.
עזבת את הטַּרַרַם הארור של בודפשט השכורה, עזבת את המכונות הרועשות
שבליטוגרפיות וצינקוגרפיות שונות, שכל ימי חייך, זה שׁלשים שנה, טלטלת בהן
ובאותיותיהן וכל עמלך היה ליהד אותן, לסגנן אותן סגנון עברי־מזרחי, לשפוך
בהן את נשמתך היהודית, שהתגנבה אלינו מימים קדמונים וששום איש לא הבין אותה
שם. זוכר אני, הדוד שאלא יקירי, זוכר אני, איך ישבת כתם־העבודה היהודית על
שלחנך וכל רמ""ח אבריך עסוקים היו בנפתולי האותיות העבריות, שפרשת את רשתן
היפה, האמנותית על כל בודפשט, על העתונים, על טפיטי בתי הסגנים, על מרבדי
הגרַפים ועל כתליהם העדינים וזוכרני, איך שמחו לקראת המוטיבים המזרחיים
היפים, איך שמחו המדיארים העדינים ולא ידעו, שמוטיבים הללו, המזמרים לה
מכתליהם, ממרבדיהם ומטפיטיהם – לא רק מזרחיים הם אלא פשוט יהודיים, עבריים
ממש. וזוכרני, איך שמחה בתו הענוגה של הגרף טיסא לקראת תבניותיך, לקראת
“התפארת המזרחית הטהורה”, שנתת לה והיא בעצמה שזרה אותן, טותה אותן וענדה
בהן את חדריה – ולא ידעה, שתבניות הללו שירה יהודית פַנטית ספונה בהן,
שמצטרפות הן לפַתוס עברי קדוש: “ומי כעמך ישראל גוי אחד בארץ!” – רמית
אותה, הדוד שאלא, רמיה קדושה, אותה ומאַת אחרים דומים לה ובסלונים הבהירים
של האריסטוקרטיה הבודפשטית שרתה שכינתנו וזמרה את זמירתה: “ומי כעמך ישראל
גוי אחד בארץ!” – – ורק את אחינו בני ישראל לא יכלת לרמות בשׁום אופן. הם
הבינו, הם חדרו לתוך נפתולי האותיות וכשקראו את התכן שלהן – נרתעו לאחור
והשיבו אותן לך בשאט־נפש. – כן זכורני, הדוד שאלא. – ועכשׁיו שבתָ סוף־סוף
הביתה, לארצך, לערס האותיות הללו ולערס שכינת היופי שלנו. ברוכה שיבתך,
הדוד שאלא! פה תוכל לעבוד ולהשתובב, סוף־סוף כדג במי הים. פה אפשר שלא
ירתעו אחינו בני ישראל מפסוקים הנפתולים נפתולי־ריתמוס בכסף, בזהב, בנחשת,
בעץ, בארג ובכל אשר ידיבך לבך לשפוך את שירת יפיינו בנדיבות וברוח טהורה.
ברוך הבא הדוד שאלא! הדוד זעלענפריינד, הדוד ידידיה, ברוכה שיבתך! –
– – כן – ומה דבר המכשׁירין שלך? היש לך כבר פונטים אחדים לפדות אותם מיד
“המעבירים”? התוכל בשנים הקרובות לפדות את המכשירין שלך בכדי לשבת ולהמשיך
את עבודתך? – – אומרים, שועד הצירים נותן למטרה זו, לפדות כל מיני מכשירין
שהם. – –
"
