,Title,Translator,Lang,Author,Text
שמעה משפט כזה, דסדמונה. הים היה שקט, ובלילה הכוכבים קרצו לנו בעד האשנב
העגול, אבל דסדמונה היתה ישנה שינה עמוקה. מה לא ידוע על דסדמונה? ריחה
אינו ידוּע, ריחה מקרוב. הייתי נרדם על הרצפה הקשה, נרדם ומתעורר, נופל
לתוך חלום ומתעורר עם תמונות ברורות, פעם של איזו ונציאנית רכה שקוראת לי
מבעד לסורגים לבנים ומסתלסלים של חלון ונציאני, פעם של אנדי משתזפת בשמש,
אתה זוכר את אמה של אנדי, צלינה, היא השביעה אותי שלא ארשה לאנדי ליחשף
לשמש בצהריים, שזה ממש קטלני, משתזפת בשמש פרקדן ועל־ידה איזה איטלקי שחום,
ופעם של דסדמונה האוספת את שערה וצוחקת. עם שחר, אחרי חילוף היצועים, שאלתי
את דסדמונה איזה תמונות היא רואה בחלום. היא ענתה לי בחיוך מלא נכונות, בתא
הקטנטן ממש יכולתי להרגיש את הבל פיה, מור ולבונה ומה לא, היא ענתה מיד,
כאילו כל הזמן רק חיכתה לשאלה הזאת: היא רואה את איתיאל, תמיד את איתיאל,
איתיאל זה כמובן בעלה, רק אותו. רק אותו, דסדמונה, תמיד רק אותו? רק אותו
תמיד רק אותו, חולמת על איתיאל, תמיד עליו ורק עליו, מאז הכירו בסיבוב
כפר־סבא, היא היתה אז בת חמש־עשרה…
מה אתה מתכוון להגיד בזה?
שעד היום כולי תימהון, ובזה אנדי לגמרי אתי, אנדי מכירה את סיפור דסדמונה,
דסדמונה כבר סבתא, רואה חיים עם סבא איתיאל, ואני עדיין כולי תימהון…
מה אתה מתכוון להגיד בזה? חזר משה בקוצר רוח.
אוריה התנער, קולו של משה נשמע יבש עד כדי עלבון. החושך ירד בינתיים,
ובחושך כאילו ציפה לדיבור אחר.
מה אני מתכוון להגיד בזה? ראשית שבשום אופן לא הייתי מבין את אנדי אילו
חלמה תמיד עלי.
וככה אתה מבין אותה?
באוויר פשטה צינת־הערב ואבני־המעקה הפיקו חמימות. אוריה מיתח את גבו, חשב:
עוד נקודת־אפתעה לזכותו של משה, ועקב אחרי אור קלוש של פנס־כיס שניתק
משורת־החלונות הקיצונית ופנה לעבר הטירה בקו קצבי וזיגזגי, בוודאי לא מאיה,
בוודאי לא אנדי. שמע שני קולות רחוקים, גבר ואשה או נערה ונער. אולי כבר
שומר־הלילה, עם אשתו או עם נערתו המתלווה אליו לסיבוב של סגירת־שערים,
ואולי שניים שיוצאים לסגור קו־השקיה במטע או לפתוח קו־השקיה? ואולי אל
המערה שבפתח הטירה, לשכב שם בחושך, בדולים לעצמם, לטעום טעם־קדומים של
מערות? הפנס כבה, הקולות השתתקו, השניים אולי נצמדו בחיבוק. ושוב אותו אור
קלוש, קו קצבי וזיגזגי. אוריה שמע את עצמו חושב, כאילו באמת נועדה מחשבתו
להישמע: ולוואי והיתה זו אנדי, והוסיף וחשב, אולי כדי לבטל את החשד שרק רצה
לשמוע את עצמו אומר כך, ולוואי והיתה זאת אנדי, למשל עם אותו צעיר, ראה
אותה רוקדת לצדו באיזו מסיבת־כלולות, פניה מכונסות וקורנות כפני נערה, לא
כפני נערה אלא כפני אשה שכובשת לה דבר־מה שלא היה לה בעודה נערה, איזו
אפשרות להיות לשעה בת־בלי־גיל, זה היה צעיר נאה שמותניו צרים, שערו מאפיר
קצת, רק קצת, תנועות מותניו היו ללא דופי, הם לא נגעו זה בזה, גם לא הביטו
זה בזה, אבל גם בפניו היה אותו חיוך מכונס, ולאוריה היה נדמה שהוא יכול
למשש בידו, בקצות־אצבעותיו, את הקשר שנקשר ביניהם, את זה הממשי ואת זה
האפשרי. עד כאן, מה, הנה הוא ממשיך אותה שיחה מתמשכת עם אנדי, עד כאן אַת
אתי ומכאן והלאה הַס, איפה נשארנו תקועים, עם גיד חודר או גיד נחלץ, זה מה
שחשוב, זה מה שקובע, בזה זה מתחיל ובזה זה מסתיים, כך וכך סמטימטרים חודרים
ונחלצים, אני מצהיר אם־כן, ואני מתכוון לזה בדיוק ובכל המובנים, ואני יכול
לדמות לעצמי את המעמד בבירור ובפועל ממש, את המשכב, או המעמד, לא משנה, זה
הענין, לא משנה, כל זה לא משנה ולא־כלום, מסתבר שמשנה, שמע את אנדי, מה
מסתבר, שאל אותה, מסתבר שמשנה, שמע אותה מתעקשת, כי אם לא משנה אז מדוע
בכלל חיים בשניים? באמת שאלה של מה־בכך, אַ קלייניקייט היה ליאון אומר,
טוב, מתחילים מהתחלה, וכאן התערה לו קולו של משה, ואוריה עוד הספיק לחייך
אל אנדי שלא, שהוא לא משתמט משאלות, פשוט קולו של משה:
ושנית?
ושנית, שאולי בכל־זאת אפשר ללמוד משהו.
למשל?
אוריה שתק. כל מה שניסה לענות, למשל שכמוה כמוך, זכותה כזכותך, למשל שאתה
דבק בכמה הנחות מאובנות, כל זה נראה לו תפל עד יאוש, הנה למד מאנדי לפחד
מתפלוּת. ואנדי גם היא למדה משהו, בין אם היה המשך לסיפור דסדמונה ובין אם
לא היה, המשך כזה או אחר, עם דסדמונה זו או אחרת, המשך אמיתי או בדוי, המשך
מפתיע, צבעוני וחריף, אותו התכוון לספר למשה, היא למדה משהו מכל ההסתרים
שלו, האמיתיים או הבדויים, מעצם הניחוש, מעצם התחרות המשוערת, גם זה דברים
תפלים, שיהיה תפלים, למדה מעט צחוק ומעט הפקר על משכבה, ואם אין המשך
לסיפורים אולי זה בכלל מפני הטורח…
למשל, שהמרתיע הוא אולי בסך־הכל הטורח.
סליחה? אמר משה.
הטורח, אמר אוריה, ושוב חש בחמימות האבנים שבגבו, זה יכול להיות בסך־הכל גם
הטורח, למצוא אמתלה, זמן, מקום, לפשוט בגדים, להתוודות, לא להתוודות, הוא
יסבול, לא יסבול, היא תסבול, לא תסבול, הטורח שבגילוי והטורח שבהסתר, אז
מאיה לא הסתירה, ובכן? ומפני שמשה שתק אמר עוד: מותר לשאול על מה אתה חושב?
למה לא, חשבתי על אמי, ענה משה מיד, ואחרי ששניהם שתקו רגע ארוך, הוסיף:
אמי היתה אשה יפה מאוד, ואף אחד לא היה מעלה על דעתו להתעניין על מה ועל מי
חלמה.
אדרבה, אמר אוריה, תכפר על זה למאיה! ומיד ידע שאמר משהו לא בדיוק למשה,
ולא בדיוק על מאיה, משהו שבוודאי לא הובן, ורצה להוסיף, אולי אף להסביר, או
לשאול האם באמת ובלי מנוס מוכרחים להשחית את מה שמצוי ביד, והלא אפשר היה
לחיות, אפשר היה לחיות. אבל משה לא הגיב, ולא שאל למה הכוונה, כאילו לא שמע
כלל, ורק אמר בקול חד:
תגיד, גם את זה לא הסתירה, גם את זה סיפרה לאנדי, מי הבחור?
לא, לא חושב שסיפרה. גם לא התעניינתי. אני אינני חושב שחייבים להתעניין
בכל.
משה גיחך:
בזה אני מוכן להסכים אתך, לא חייבים להתעניין בכל.



ט""ו
למחרת נסע משה לטייל באיזור, לבדו, יחזור אחרי הצהריים, אמרה מאיה, שחדלה
לשבת על הספסל וכבר נהגה כאילו סתם באה להתארח. בערב, על הדשא שלפני הבית,
ניסה אוריה לקשור שיחה על איזה נושא כללי, הזכיר מאמר מעניין שקרא על
האינטואיציה ועל מגבלות המחשב, אבל אף אחד לא גילה התעניינות מיוחדת במאמר
ואנדי הציעה: בואו ניכנס פנימה ונאכל גלידה. ישבו סביב השולחן העגול של
פינת־האוכל, הילד הכריז שהוא נורא אוהב גלידה וביקש מנה גדולה, מאיה אמרה
שהיא אוהבת רק וניל ומוקה, בלי שום תוספות, לא, גם לא קצפת. אחר־כך סיפרה
ששמעה על המאהארישי, הכוהן הגדול של המכורים למדיטציה, שהוא חי ימים שלמים
רק על גלידה. אוריה אמר, תוך כדי חלוקת הגלידה, שזאת נקודה לטובת
המאהארישי, שבמובן זה הוא מוכן להימנות על מעריציו, שהגלידה היא באמת מן
ההמצאות הגאוניות של האנושות, ושאל את משה האם ידוע לו מהו מקום־הולדתה של
הגלידה. משה לא ידע והבטיח להתעניין. הכפיות הזעירות, המיוחדות לכך, היו
מקישות בעליזות על דפנות גביעי־הזכוכית. היתה שתיקה והילד אמר שהוא רוצה
לספר את הבדיחה על אורחים, שכשבאים כולם שמחים וכשנוסעים כולם עצובים אבל
מה שבין זה לזה, אוף, וכולם פרצו בצחוק קולני, גם אנדי, ורק עכשיו ראה
אוריה כמה היא עייפה, וחשב שהיא מוטרדת, בנוסף לכל, גם מזה שמאיה העלימה
ממנה מי הבחור, שדווקא זהותו, כמסתבר, העסיקה את משה במיוחד, ושאם כך אולי
היא מעלימה בכלל, אולי איננה כפי שנדמתה לה אלא לגמרי אחרת. הילד נראה
מאושר שהצליח להצחיק את כולם, כבר היה עייף ובא להתרפק על מאיה, ומשה ביקש
קפה ואמר שעוד הלילה הוא חוזר לחיפה. מאיה הזכירה לו שצריך לקנות אוכל
לסיאם ולאמסטרדם, ומשה אמר שיזכור ושיקנה גם גלידה מוקה־וניל, ואת
משיכת־הכתפיים שלו כשאמר “מוקה־וניל שיהיה מוקה־וניל” ראה אוריה כפתח של
תקווה, ושאל את עצמו מה התקווה ומה יצא מכל זה. מאיה לא הלכה ללוות את משה
למכונית (גם זה נראה כאילו משהו עומד להיתקן ונזהרים שלא לקלקל שוב), רק
אמרה שאנדי והיא תבואנה לחיפה מחר, ברכבת, שאנדי רוצה להתארח אצלם
יום־יומיים, ומשה אמר שיחכה בבית לטלפון ויבוא לאסוף אותן מהתחנה.
אוריה לקח לו יום־חופש וחזר לישון אחרי שאנדי ומאיה נסעו. התעורר מאוחר.
השקט שעמד בדירה היה ממתן את תנועותיו. יותר מתמיד הקפיד בגילוח. הראי היה
מלא לובן־אריחים ולובן־קצף גילוח וכמעט־לובן צדעות, ואוריה קרא בעיניים
המביטות בו את הרהור־הבוקר השגרתי, כבר שבועות, כבר חודשים, לא ידע ממתי
ומדוע, אבל תמיד בשעת גילוח: אז לאן, עוד יום ועוד לילה עברו, עוד יום ועוד
לילה אינם, איפה הם, גם זמן־השאלה “איפה הם” כבר איננו. יום אחד לפנות ערב
אמר לילד: תביט, הפרח הולך ונסגר לקראת חשיכה, ממש רואים איך הוא הולך
ונסגר, הילד מחא כפיים ואוריה נשטף זיעה קרה, והביט אסיר־תודה בעצים
שאי־אפשר לראות איך הם צומחים, כפי שאי־אפשר לראות איך מתחלף צבעו של אפרסק
מירוק־כהה לירוק־בהיר ירוק־צהוב צהוב־כתום כתום־אדום, באין־ספור מעברים
שהעין אינה תופשת, צבע אוזל, איננו, לא רואים איך אוזל, מצפים לצבע שיצדיק
קטיף, לתחילת עונה, לסוף עונה. אוריה ניסה לחשוף בעיניים שבראי את מבטו של
הכסיל, התם שהופל בפח ונלכד בציפיות, שכבר יסעו להם מפה, משה, מאיה, שכבר
יסעו להם, שכבר יישאר לבד עם אנדי, שכבר יהיה ערב, שכבר תהיה שבת, שהילד
יגדל, שהניסוי יצליח, שההצעה תתקבל, שאפשר יהיה שוב לנסוע לקלארנדון, לנסוע
שוב לוונציה, לחשוף את מבטו של התם הזה שמדי בוקר מתגלח ומדי בוקר נערך
לקראת אותו מירוץ חד־סטרי, אותו מירוץ עצמו, כאילו מחכה איזו זכיה בקצהו.
לאחרונה טייל עם אורח אחד, פילוסוף שדיבר בנוסח של טענות וטענות־שכנגד,
הלוך ושוב לאורך שדרת־הקזוארינות שבמטע, האורח אמר שנדמה לו שבמקום הזה
מהלכים יותר לאט מאשר במקומות אחרים, ומכאן שיש יותר זמן לחשוב, אחר־כך
השתהה רגע ליד עץ קיצוני, התבונן בזיקית ירוקה־כהה שחמקה ועטתה צבע
אפור־חום של גמל, ואמר: לפני עשרים ואחת שנים שמעתי דרשה ובה ארבע מלים
שכבר שמעתי קודם־לכן מאות פעמים, כמעט יום־יום, ופתאום המלים האלה היכו בי,
ומאז אני מרבה להתפלל. אשריו וטוב לו, גם פילוסוף של טענות וטענות־שכנגד
וגם מרבה להתפלל, דיבר אוריה, לא בהתרסה כי־אם בחיוך של קוצר־יד, אל התם
הממשיך במירוץ זיגזגי אבל חד־סטרי של מיני זמן שונים, ריב ופיוס, שלווה
ומירוט־עצבים, טרגדיה ולא־כלום, מוטב טרגדיה מלא־כלום, כל דבר ולא לא־כלום,
קח שני בני־אדם, הושב אותם לפניך שיספרו כל מה שזכור להם מחייהם עד כה, אחד
ידחוס הכל לתוך שעות אחדות, השני לא יחדל לספר, זמנו של זה לעומת זמנו של
זה, זמן זה כזמן זה כבר איננו, דברים ידועים, הרהורי־בוקר בגרוש, זה שבוע
כמעט שלא ישן דיו. טוב שכבר נסעו, ואולי משה עוד יוכיח משהו, הוא כבר הוכיח
בחייו הרבה דברים, מדוע לא יוכיח עכשיו שדווקא, מאיה תלד לו שבעה ילדים,
נגד כולם ונגד הכל, והם יחיו באושר ובעושר ובריב ובפיוס ימים רבים, ואנדי
תוכיח שצריך לנסוע לווארשה, לחפש את הפסל של מאדונה־עם־הילד העשוי
קרשי־ארון־דפוקים־יחד, ולהשיג ולפענח אותם פסי־קול חסויים של ליאון.
אוריה הציץ בשעון, הרגל מגונה, חשב, מה דוחק עליו, רק שעתיים וחצי, לא יותר, עברו
מאז שקם, ממש עם זריחה, להעיר את אנדי ואת מאיה, ומאיה השהתה את ידו על
מצחה, הגיש להן קפה, לאנדי בספל הכחול הכבד, לא יותר מדי חלב, לא ספל מלא
לגמרי, הפעם בדיוק עד לקו הדמיוני שעדיין לומדים אותו, למאיה לא חשוב איזה
קפה, העיקר שמגישים לה למיטה, איך שכבה עם מאהבה הצעיר, לא חשוב, העיקר
ששוכבים, בכל־זאת היה משהו מיוחד בדרך שהשהתה את ידו על מצחה, סוגרת עליה
בשתי ידיה החמות משינה. אוריה גיחך בחצי־קול, מחליט להתייחס בכובד־ראש
ובכל־הרצון־הטוב לרשימת־הדברים־לסידור שאנדי השאירה על מגש־הנחושת העגול
שעל המקרר (ברגע האחרון עוד חזרה מן השביל להזכיר לו: הרשימה על המקרר),
לתת אוכל לזלמן שבעליו, השכנים, יצאו לחופשה, לא לשכוח (מודגש בקו) לבדוק
אם פיתגורס קשור שם ממול, שלא יאכל את זלמן (אנדי ודאי העבירה אל הדף חיוך
מן החיוכים שבפגישות־השביל הקצרות עם השכנים הצעירים החביבים עליה), לחפש
יחד עם הילד חומר לחיבור על התפתחות הרכבת, להשקות את הגינה, להביא אספירין
מן המרפאה וסוכר מן הכל־בו. היום הוא לא ישכח דבר, אדרבה, היום יתעכב, גם
יעביר יד, מחווה לאנדי, על גבו המתקמר של זלמן, למרות שבדרך־כלל אין לו שום
משיכה לגבות מתקמרים של חתולים, אף יגדיל לעשות ויושיט יד לפיתגורס, יש
להודות שהוא יפה, כלב־סאלוקי למהדרין אומרים מביני־דבר, ויקשור אתו שיחה,
לא פחות מוצלחת משיחותיהם של כל חובבי־הכלבים: אז מה אתה אומר על זה,
פיתגורס, הלא קראו לך כך מתוך סברה שאתה חכם הולך על ארבע, ושהפילוסופים
ההולכים על שתיים רק הולכים הולכים ומסתבכים, חוץ מאלה שפתאום מתחילים
להתפלל. איפה ימצא חומר על התפתחות הרכבת? אנדי שיבחה את בחירתו של הילד
בנושא הרכבת, אמרה לו שהיא עצמה מאוד אוהבת רכבות, ורק כשנשארו בשניים שאלה
את אוריה האם יש לספר לילד את מה שידוע להם על השימוש ברכבות, או שלצורך
העבודה הזאת, בנושא־תחבורה, יש להתעלם. לצורך עבודת־כיתה בנושא־תחבורה יש
להתעלם, חתך אוריה, ואנדי הסכימה אתו, אבל הוא לא היה בטוח שתעמוד בהסכמתה.
כשאנדי היתה מכירה בצורך להעלים דבר־מה, או לעקוף דבר־מה, היתה פונה
לעזרתו, ואכן את הצורך הזה הוא ידע למלא טוב ממנה. הלא גם מה שקרה לו באותה
רכבת־נוסעים מיד אחרי המלחמה, לא סיפר לה עד עכשיו, רק לליאון סיפר, דווקא
לליאון, ואיך בדיוק זה היה. גם על דסדמונה לא סיפר לה בדיוק, לא על דסדמונה
זאת ולא על אחרת, ולא יספר. צביעות? גם לצביעות אין גבולות מוגדרים
וברורים.
אוריה ישב לשתות את קפה־הבוקר, ביחידות, על הכסא שלו, כמנהגו מדי יום, לא
בדיוק מול החלון הפתוח אלא באלכסון אליו. ערפילי־השחר החלביים עוד היו
מתרוממים וכבר נראה עלעול צהוב עולה מן האדמה ונע על־פני האופק המתגלה
והולך. אוריה לגם מן הקפה, הביט אל העלעול, וחזר בשקט אל השעה שהיה חוזר
אליה מדי פעם, איך ראה את אנדי לראשונה, בדירתו של ליאון, ששימשה גם אכסניה
לכל המקורבים אליו, וחלונותיה צפו אל חורבות הגיטו. את החורבות כבר היו
מפנים מבוקר עד דמדומים, במין חיפזון קדחתני, אבל השעה הזאת היתה שעת־ערב
מאוחרת. הפשפשים ששרצו במיטות־העץ הכבדות, המגולפות לתפארת בידי
נגרים־אומנים שזמנם בידם, לא נתנו להירדם. אנדי נכנסה, גבוהה (נראתה לו אז
גבוהה מכפי שהיא באמת), במעיל כבד, רדיד כחול־כהה כרוך לצווארה וברט
כחול־כהה חבוש לראשה. אוריה זוכר שחשב: שונָה, לא שייכת, וגם היום אינו
מוצא מלים טובות מאלה לתאר את מה שחשב אז. אנדי נכנסה, העלתה אור במטבח,
עמדה שניות אחדות בדלת המוארת, כיבתה את האור, חלפה על־פניו בחשיכה, מדיפה
ריחות של חוּץ וּווֹדקה. הנה, גם עכשיו העדיף לעקוף ולדלג מיד אל הערב או
הלילה והיום שלמחרתו, לזכור צחוק מסוים בין אנדי לליאון, מאוחר יותר, מבט
מסוים בין אנדי לאֶחד מבאי־הבית, זֶמֶר מסוים שלידיה ביקשה מאנדי לשיר. אלא
שאותו לילה שראה את אנדי לראשונה הלא היה לילה בסופו של יום שבבוקרו יצא
ברכבת אל עיר־מולדתו שעל הוויסלה, מצפון־מערב לווארשה. לא לשֵם ביקור
בעיר־מולדתו בא לפולין, בא להוליך פליטים יהודים אל נמלי הים־התיכון, אבל
איש לא עיכב בעדו. עירו, שזכר אותה יפה וכהה, כולה מופנית כלפי הנהר, לא
נפגעה במלחמה, כך סופר לו. לא ראה בדרך את אפילת יערות־האורן המקיפים אותה,
לא את תחנת־הרכבת האדומה והמפויחת, לא את אבני־הגוויל של הרחובות הצרים
הטבועים ברגליו, את כל זה ראה אחר־כך. בבת־אחת נזרק אל כיכר־השוק, עיניו
בסורגי־הברזל המסולסלים של המרפסת בקומה השניה. מבין כל הדברים זכר במיוחד,
אולי מאז הוצא לראשונה לראות אור־עולם על מרפסת צרה זו, את הסורגים האלה
המסתיימים כולם באותו קו שבלולי. ילדה עמדה על המרפסת, שערה הפשתני הגיע עד
לקו העליון של סורגי־המעקה, מאחוריה אפילת דלת ודירה שקירותיה ודאי מכוסים
עדיין אותה טפטים, טפטים מאיכות טובה נשמרים שנים רבות, ירוקים־כהים עם
ניצני־ורדים בחדר־השינה של אמא־אבא, בפסי תכלת־ואפור עם עלעלים חומים
עדינים בכל שאר החדרים. הילדה הסתכלה בו בעיניה הקטנות, הוא הסתכל בחלונות
המשחירים מול השמש. מעל לבית ומעל לעיר נישא ריח מתקתק של תפוחים ושל
עשן־רכבות. איזו הלוויה שרכה דרכה בכיכר, כרכרה שחורה רתומה לשני
צמדי־סוסים מכוסים בד שחור, שמשות הכרכרה וקישוטי־הזהב של רתמות־הסוסים
התנוצצו בשמש, הוא ניפנף בכובעו לילדה ולא חבש אותו עוד, החזיק את
מצחת־הכובע בשתי ידיו לפניו, כדרך המתאבלים, וכמו נמשך אחרי הכובע סב על
עקביו והתערב בין מלווי המת האלמוני. שניים־שלושה מהם ליכסנו אליו מבט והוא
התעקש להמשיך וללכת אתם. זכר שבית־הקברות הנוצרי נמצא לא רחוק מתחנת־הרכבת,
ממש לחוף הנהר.
בחר ברכבת־הצהריים המהירה כדי להקדים ולחזור לווארשה. עכשיו ראה בעד החלון
הרחב של התא את אפילת היערות הנוטפים ירוקת אפילו בצהרי יום בהיר, מטליות
טחב ירוק־שחור מכסות ביצות נעלמות. כמעט לא ביצבצו שמיים מבין הצמרות
הצפופות. היערות היו נסוגים מעבר לחלון ואוריה חשב שכאן ניתן היה אולי
להסתתר, שהטחב והאיזוב עשויים היו להבליע עקבות, להטעות כלבי־גישוש, ואולי
באמת הסתתרו כאן, אולי עדיין מסתתרים, בשורת גמר־המלחמה לא הבקיעה לסבך הזה
שמחוץ לזמן, עדיין מסתתרים, צדים ארנבות במלכודות מוסוות, מלקטים אוכמניות
ופטל־בר ותות־יער אדום. עד כאן סיפר לאנדי, מכאן והלאה רק לליאון, תוך שהיה
מהלך אחריו בין חורבות הגיטו ורוב הזמן רק עוקב אחר ידו המצביעה ומקשיב
להסבריו. ברגע מסוים מצא לו פתחון־פה לספר: עדיין היה בתוך־תוכה של
