,Title,Translator,Lang,Author,Text
מים קרים, קול המים הנמזגים נמהל בקולות הסרט, מביאים אפרסקים, עוד שמיכות,
הצינה גוברת, פה ושם ראש צונח, לא שומעים נחירה.
כשהסרט נגמר הלכו אנדי ואוריה ללוות את אורחיהם אל חורשת־התמרים, אל
הבית־הקטן־על־גלגלים ולא נפרדו מיד וישבו ארבעתם על מדרגות הקרון, סמוכים
זה אל זה, מאיה בפתח, סיאם ואמסטרדם בחיקה, משה על המדרגה העליונה, במצודד,
גבו זקוף כמו תמיד, שעון אל מוט־המעקה, ואנדי ואוריה על המדרגה התחתונה,
רגליהם על האדמה. משה שתק כמעט כל הדרך לכאן, השמיע רק הברות קצרות, מין
שאלות לחלל שנשמעו כמו נו־אז־מה, ונענו מיד בצחוק מקוטע שלו עצמו, ועכשיו
אמר בהטעמה: הבהלה לזהב, והיה ברור שהוא מגלגל מלים אלה בראשו שעה ארוכה,
לעשות אותן פתיחה למשהו שהחליט להגיד הלילה. הרבה שנים היו אומרים: משה
שותק כמו אבן, אחר־כך ראו שזה לא בדיוק כך ותיקנו: משה זה ככה, אם החליט
לשתוק ישתוק שנים, ושום שידולים לא יועילו, ואם החליט לדבר – ידבר.
אתם הלא יודעים איך הבאתי את הגוי ההוא לחפש זהב בתעלות־הביוב, אמר משה
במין קול תובע. אוריה הימהם משהו, היה ברור לו שמשה פנה אל אנדי ואליו, לא
אל מאיה, ומתוך הפניה הזאת היה ברור לו גם שמאיה כלל לא שמעה על כל הדברים
האלה עד עכשיו, ואף זה שהתביעה בקולו של משה לא מבקשת אישור לכך שניהם
יודעים, אלא דבר־מה אחר, אבל לא רצה לחשוב על כך.
לפעמים אני כבר בעצמי לא זוכר איפה קרה מה ומתי בדיוק, אמר משה, לפעמים
אפילו אינני בטוח אם בכלל קרה, אבל יש כמה מקרים שאני זוכר בדיוק, וזה אחד
מהם, איך שכנעתי אותו לרדת אתי, וגם את צורתו אני זוכר, כמו היום, רק הזהב,
רק זה משך אותו, ולא כל הקשקושים האלה על ישו המושיע ועל מאריה הקדושה, או
אולי גם זה, מי יודע, השד יודע. זה היה גוי קטן, רזה, ממושקף, אני נשבע לכם
שהיה דומה ליהודי יותר ממני, ואילו הגרמנים היו תופשים אותנו, או נגיד
סחטנים פולנים, היו מורידים את המכנסיים קודם־כל לגוי הזה, למצוא שהוא
נימול.
אוריה כמעט לא ראה את פניו של משה, אבל היה ברור לו שהוא מחייך אותו חיוך
מתגרה שלו, המבליט את תכלית־האריוּת של פניו: אף סולד, מבט לא־מהוסס
ולא־מעונה, שפתיים קשות שאינן מתרפות, מאַציֶק מגזע המאַציֶקים.
הוא עבד במחלקת־הביוב של הרובע הסמוך לגיטו, לא מהנדס, סתם פועל. שֵם היה
לו דווקא מפוצץ, קסאַוֶורי, קסאוורי סוּחה. התרוצצנו אז כמו עכברים
מסוממים, ליאון ואני, ניסינו להשיג בכל מיני דרכים מטורפות את התוכנית של
תעלות־הביב של וארשה, זה מבוך שלם, עיר שלמה מתחת לאדמה, קשה שלא להסתבך
שם, לא אחד הסתבך ולא יצא כבר. רק דרך תעלות־הביוב עוד ניתן היה להיכנס
לשם, אולי גם לצאת, הגיטו בער, למעשה כבר נשרף, הגרמנים עשו עבודה שיטתית,
בית אחר בית, רחוב אחרי רחוב. אמרתי לגוי הזה, לקסאוורי: לפני המלחמה עבדתי
אצל יהודי אחד עשיר ואני יודע מקום־סתר שיש שם זהב, הרבה מטבעות, הרבה
טבעות, לא נחזור בידיים ריקות. חשבנו, ליאון ואני, שאולי כך נצליח להגיע אל
האחרונים שם. קסאוֶורי שוכנע לבסוף, גם קיבל מראש טבעת עם יהלום. זה היה
יום א' בצהריים, נשאר לי באוזניים צלצול הפעמונים של הכנסיות, בהתחלה,
כשירדנו, עוד שמענו את הפעמונים, אחר־כך רק את זרם השפכים. אחרי כשלוש שעות
הגענו למכסה־הביוב שברחוב סמוצָ’ה, אבל המכסה לא רצה להתרומם, נראה שהיה
קבור תחת מפולת. קסאוורי אמר שצריך לחזור מיד, שהגרמנים מזרימים גאז לתעלות
לחנוק את הבורחים, גם למנוע התפשטות מגיפות. נתתי לו עוד טבעת שלקחתי לדרך,
אמרתי לו שאני נשאר לחפש מכסה שאולי אצליח להרים אותו, שאתקשר אתו כשאחזור,
ושעוד נמצא ביחד את האוצר. ובאמת מצאתי אחר־כך מכסה שהתרומם, כבר היה חושך
בחוץ, עשן חונק עלה מן החורבות, ריח של בשר חרוך, מה, מה אמרת, מאיה?
מאיה לא אמרה כלום, היא רק שילחה מעליה את סיאם ואת אמסטרדם שבלי קול
ברחו־חמקו לתוך הקרון. אוריה הציץ באנדי שישבה כשפניה לאדמה, לא ראה אבל
ידע שהיא מעבירה בהיסח־הדעת אצבעות צובטות על־פני צווארה, באותה תנועה
שהיתה מעוררת בו דחיה. פתאום נזכר בביקור האחרון שערכו שניהם אצל ליאון, עם
פתיחת האגף החדש במוזיאון, ליאון היה מראה להם במין גאווה של בעל־בית
תעודות חדשות שהובאו מדנמרק ומהולנד, ודגם מיניאטורי של מחנה סוביבור
שנתוסף על דגם גיטו וארשה, ודגם מחנה טרבלינקה, אחר־כך הוליך אותם הלאה
ובחיוך מסתורי הסיט איזה בריח כבד, הזיז דלת, אמר: כאן יאוחסנו
המיקרופילמים במקרה של מלחמה, והדלת הזאת היא נגד גאז, היא נסגרת הרמטית,
וכאן בנינו מקלחות נגד גאז, ליאון היה מחייך ולא נראה כמי שדעתו נטרפה
עליו. לא היה לאוריה העוז לומר לו: ואתה לא נראה כמי שדעתו נטרפה עליו,
והרגיש כאילו חטא איזה חטא שלא ניתן להתוודות עליו, ניסה לומר את זה לאנדי
בדרכם חזרה, חשב שאינו מצליח, אבל אנדי אמרה: זה בדיוק הענין, אני מכירה את
זה היטב.
בכל הבונקרים שידענו עליהם, ליאון ואני, סיפר משה, לא מצאתי נפש חיה אחת,
ואז, כבר התחיל להאיר בחוץ… משה, כמעט כמו כל בודי בדותות־המתח, ואולי
פשוט נתן דעתו למעוף החרישי של עלֶה גדול, קצת יותר כהה מן הלילה, לא עלֶה
כי־אם עטלף שחלף סמוך מעל גג־הקרון. צרצר התחיל לנסר ממש בתוך האוזן,
ואוריה אמר לעצמו שמבין ארבעתם מאיה היא לא רק היחידה שאף פעם לא שמעה על
הדברים האלה, היא גם היחידה ששומעת אותם עכשיו בפועל ממש. שומעת סיפור
מהמם, אפשר לומר, באין מלה אחרת. וזה גם מה שמשה רצה. פשוט עד כדי כך, שמע
את עצמו אומר, ומחה: לא, לא פשוט עד כדי כך. פשוט זה לשתוק, חשב ואמר לעצמו
שאיש לא שם אותו לקבוע אם כך או כך, ורווח לו. יכול להיות, אמר משה,
שהגרמנים באמת הזרימו גאז לתעלות, ציקלון בי או ציקלון איקס, כבר היה להם
נסיון בביעור אנשים, והם באמת פחדו פחד־מוות ממגיפות… ופתאום דימה אוריה
להבין מה היתה התביעה בקולו של משה, קודם: שלא יפריעו את שמיעתה של מאיה,
ולרגע חשב שאנדי והוא מיותרים כאן, ומיד הבין שלא, שמשה הועיד להם איזה
תפקיד במשהו המתרחש בינו לבין מאיה, ושוב התעורר בו הרצון לגעת בכתפו של
משה, או בידו, מוזר אבל לא פעם כבר עלה בו אותו רצון לגעת במשה, ולא נגע,
והפעם זה היה כאילו רצון להעיר אותו משנתו. אוריה הניע ראשו, בחשיכה, ניע
קל של שלילה: משה לא ישֵן, חשב, לא הוא שישן, ולא ידע למה התכוון במחשבה
הזאת.
משה השתחל חזרה למטה, סגר מעליו את המכסה המסורג של הביוב, חשב שימצא מהר
מאוד את הדרך חזרה וידווח לליאון. מתחת לקשתות־האבן עמדה צחנה דחוסה,
הקירות היו דביקים ונטפו ליחה. מפעם לפעם חדר אור מבעד לאחד המכסים
המסורגים, אחר־כך היה חושך גמור, הרצפה לא היתה עוד יציבה והחושים התחילו
להיטשטש, קודם הראיה, כך נדמה לו למשה, אמנם היה לו פנס, אחר־כך המישוש
ואפילו הריח. הוא נעשה אדיש לקולה של הזרימה, שבתחילה פחד שתציף אותו.
לרגעים באו עליו התקפי־ראיה קצרים וחדים. ראה גופת בר־מינן חוסמת את התעלה
לרוחבה, ושני נרות של שבת בקצה התעלה, ומיד ידע שהנרות הם הזיה, שאם ייתפס
לזה יטבע במי־הביוב למרות שידע לשחות, שזאת מין משיכה אל תחתית התעלה,
להשתטח ולהסחף עם הזרם, ומחשבה מטורפת שהזרם הזה מוליך אל איזה נהר ואל
איזה ים ושבחוץ עכשיו אביב ושהמים לא יהיו קרים במיוחד.הנרות שקעו. גופת
הבר־מינן השיגה אותו, צפה הלאה…
היו שם חולדות? שאלה פתאום מאיה בקול נמוך וברור, זאת היתה השאלה היחידה
ששאלה.
חולדות בתעלות? לא. אולי היו, אני לא ראיתי, בגיטו היו, התרוצצו לאור היום
בין ההריסות, מחנות שלמים, גדולות כמו גמלים.
לא אמר: כמו חתולים, או: כמו פילים, אמר: כמו גמלים, ואוריה חשב: מחווה
למארחיו במדבר, ופלט צחקוק, אבל בו ברגע זה נשמע לו נכון, חולדות כמו
גמלים, חולדות עם דבשות, אם־כי גמל הוא בעל־חיים צמחוני, שָלֵו, ומשה הוסיף
לספר: בין ההריסות הן היו נוגסות בבשר המתים, בין ההריסות, כן, אמר, אבל
בתעלות ראה אולי פגר אחד או שניים שהיו צפים כשהבטן כלפי מעלה, וראה פטמות
של חולדה מתה, פטמות ורודות, ממש כמו פטמות של אשה, ומה, אתם בטח כבר שמעתם
ממני משהו על שתי האחיות, זופיה ויוזפינה, אמר משה, חושבים שבמצב כזה כאילו
שוכחים דברים כאלה, אבל הוא מוכן להתערב שחשב שם גם על השדיים של האחיות,
או נגיד רק של זופיה, שהיתה היפה בין השתיים, אחר־כך היה בטוח שהוא רואה
אור של פנס ושומע צעדים ושקסאוורי מתקרב אליו, מחזיק את הפנס גבוה מעל
הזרם, אבל האור כבה ומשה הבין שלא היה פנס ולא קסאוורי ומה שנשמע לו כצעדים
זה אולי דפיקות־הלב שלו, וגילה שהוא עומד, נשען בגבו אל הדופן העגולה של
התעלה, כמעט יושב, כאילו נחוץ לשבת כדי לחזור ולהדליק את הפנס שלו, אור
חושך אור חושך, אור אמיתי או הזיה, זה ממש שיגע אותו, מישש בכיס את
הבקבוקון של הציאנקאלי, הבקבוקון הזה נמצא אתו עד היום, רק את זה הביא משם,
וזכר את ליאון שמחכה לו בחוץ, כך נדברו, במסעדה שבפינת רחוב פרוֹסטה. הוא
ניתק את עצמו מן הקיר, ידע שאסור לו לשבת, בעצם רוב הזמן ידע בדיוק מה מותר
ומה אסור ומה צריך. כשהזרם היה גובר היתה גופת הבר־מינן מכה בזיזי האבנים
או בזווית של תעלה ניצבת, לא היה בטוח אם כל הזמן זאת אותה גופה או כבר
גופה אחרת. ידו היתה מחליקה על־פני ליחת־הקירות והוא ידע שלבסוף הן יכינו
לו אמבטיה, הבנות של בעלת־הבית שלו, זופיה ויוזפינה, גיגית של רחצה, עליו
רק להיזהר שלא יראו אותו עירום לגמרי, שלא יגלו. זופיה היתה מתהלכת בקרים
שלמים בחלוק חצי־פתוח, נותנת לשדיים המשגעים שלה להיראות כמעט עד לפטמות.
אדם לא יכול לדעת מה הציל אותו, ומשה מוכן בהחלט להגיד שגם המחשבה על שתי
האחיות שיכינו לו רחצה. הצחנה היתה חונקת יותר ויותר, חוש־הריח חזר אליו
והצמא התחיל להציק לו עד כדי כך שהיה מוכן לרדת על הברכיים ולשתות
ממי־הביוב, אבל ידע שזה הקץ, ואמר לעצמו ששפתיים בוערות בצמא עוד אפשר
לסבול, מה שאסור זה הזיות וגם לרדת על הברכיים אסור, די שהנעליים גוררות את
הצואה, לפחות שהמעיל לא יגרור, ושוב ראה אלומת־אור, דקה למעלה ורחבה למטה,
כמו נופלת מאיזו ארובה, וניסה לסלק את ההזיה בחזרה עקשנית על המחשבה שליאון
יחכה לו בשעה אחת־עשרה במסעדה שברחוב פרוֹסטה, אבל אלומת־האור היתה קיימת,
רק הולכת ונחלשת. משה זוכר שאז ניסה לרוץ בתוך השפכים, שאם האור הזה ייעלם
לא יהיה עוד טעם להמשיך ולחזור על זה שליאון מחכה לו. הצליח להדליק את הפנס
שלו, לכבות ולהדליק כמין איתות. לא ראה כלום חוץ מן האפיק שזרימתו היתה
עכשיו חזקה, ושהתנוצץ באיזה אור־קסמים עם כל הדלקת־פנס, ומשך כמו בכישוף
להיכנס לתוכו וזהו. אמר מין תפילה: שהאור הרחוק כבר לא יופיע, שלא תהיה עוד
סיבה שלא להיכנס לתוך הזרם, להשתטח וזהו. המים היו נקיים פתאום, ללא צבע,
ומשה צחק בקול או אולי רק גיחך לעצמו: לא ציאנקלי, אבל יש נתח־נקניק בכיס
העליון של המעיל. הציאנקלי היה מיועד לרגע שנתפסים, תחליף לעינויים, מוות
כמעט מיידי, לפי שעה הוא לא נתפס, אבל נקניק־סאלאמי זה לא בדיוק מה שטוב
לשפתיים בוערות, ובכל־זאת יש בו גם לחות. טוב שלא היו חולדות חיות בתעלות,
בוודאי היו נמשכות אל הנקניק ואולי אפילו מתנפלות לחטוף אותו מידיו. שיניו
נגסו בנקניק, אבל הצריבה בשפתיים, כנראה עוררה אותו לראות את עצמו: הי לך
בעל־חיים מורעב, והוא השליך את הנתח בחימה ושמע בהרגשה של נקמה את הטפיחה
הנמרחת של הנקניק השוקע בשפכים. ושוב האור המשטה, והיו אז רגעים שבאמת־באמת
רצה, הדגיש משה, אבל לא הדגשה יתירה אלא כאילו רק כמה שנחוץ, רצה שהאור
ייעלם, שכל זה כבר ייגמר, וחשב על המוות שרק הוא בטוח, לא יכזיב, המוות
מקבל כל אחד, אז שכבר יהיה כזה, במקום המוות שממילא אורב לו כל רגע בחוץ,
שכבר יהיה ככה, לבד, די, הפה יתמלא צואה, זה טוב מעינויים, חֶנק וזהו. אז
או רגע אחרי זה, או שעה אחרי זה, הסדר בכל מה שהוא מספר ממילא מבולבל, תמיד
יוצא מבולבל, פתאום שמע קולות: יידיש, לא היה לו שום ספק שזה יידיש, לא
יכול היה להבדיל בין המלים, ההד שיבש את המלים, אבל הן היו ביידיש. התחיל
לרוץ, הבחין שהקולות באים מימין, מהפתח של התעלה החוֹצה, התחיל לאותת בפנס,
דמויות שחורות התחילו לברוח מפניו בחבורה, צעק ביידיש: אני לא גרמני, אני
יהודי, אבל הדמויות לא שמעו לו, ברחו, נפלו, וקמו ונסחבו, כל הזמן שמרו
להיות בחבורה, ברגע מסוים היה צריך לשכנע את עצמו שזה לא הזיה, כי אם גם זה
הזיה אז באמת כבר הקץ, ואז העז סוף־סוף לחשוב שזה הם, כי מי עוד נותר חוץ
מהם. התחיל לרדוף אחריהם בשצף־קצף וכל הזמן זכר שהם חושבים אותו לגרמני, או
לפולני סחטן, ושהם עלולים לירות לעברו. ראה שהמרחק קטן ולפי ריצתם המסורבלת
הבחין שהם עייפים עד מוות, ודאי עייפים יותר ממנו, פתאום צחק וצעק, כי כך
התחשק לו: הפסדתם בתחרות! הם נעצרו לבסוף. גם לידיה היתה שם.
קולו של משה כבר היה יבש, כמעט עוין, כאילו כפו אותו להמשיך:
ההתיעצות היתה קצרה. הם היו כארבעים. היו בטוחים בכיוון, סביבות
אוגרוֹדוֹבה־פּרוֹסְטה, יחד עם ליאון קבענו בדיוק את המקום שמשם נשתדל
להוציא אותם, דרך מכסה־הביוב, לא בלילה, בלילה עוצר ושום משאית לא תתקרב
לאיזור הגיטו, אלא באור־יום, ועד אז עליהם לנהוג כך וכך. אותו יום לא השגנו
משאית, למרות שהקַשָר של המחתרת הפולנית הבטיח לנו לספק משאית. איך יחזיקו
מעמד בפנים עוד כך וכך שעות? קסאוֶורי הסכים לשלשל פתק דרך הסורגים של
מכסה־הביוב במקום ובזמן שנקבעו. ליאון לא שאל ואני לא סיפרתי לו שגם לידיה
שם. זה אולי מוזר אבל כך זה היה. בעצם זה מובן, הוא פחד לשאול. בערב הורד
למטה סיר עם מרק חם, אולי שתיים־שלוש כפות לאיש. למחרת, בערך בשעה עשר
בבוקר, כוּונה משאית עד פתח־הביוב. המשאית נשכרה להוביל רהיטים וברגע הנכון
הופנה אקדח אל הנהג: או הרבה כסף והסכמה או כדור בראש. הנהג בחר. הרימונו
את המכסה. האור נפל לתוך תעלת־הביוב. אחד אחד הם יצאו וזחלו למשאית,
ממצמצים בעיניים, שחורים מן הטינופת. עוברים־ושבים נעצרו למראה המשונה,
יצורים שחורים עולם מבטן האדמה. צריך היה למהר, ראיתי גרמנים במורד הרחוב,
מישהו מן העוברים־ושבים כבר ידאג להזעיק אותם. משאית אחת לא הספיקה, גם לא
כולם היו מרוכזים ליד אותו הפתח, לא היה שם מקום לכולם. אמרנו, אולי נצליח
לשחד נהג נוסף, היינו מוכרחים לזוז מיד. המכסה נסגר. כעשרים איש נשארו
בפנים. לא הצלחנו להשיג מיד משאית נוספת. הם לא החזיקו מעמד בפנים ואחרי
כמה שעות פרצו החוצה, ניסו להימלט לחורבה של בית אחד על גבול הגיטו. אשה
פולניה הלשינה עליהם. הגרמנים הרגו את כולם.
אוריה ניסה לעזור לו, לרמוז לו שיודעים:
ואז לידיה…
משה הפסיק אותו:
לא אז – קודם. רק יצאנו מן העיר והגענו לחורשה, ולא היתה משאית שניה, לידיה
רק ירדה בזחילה מן המשאית, כולה טינופת שנקרשה, אמרה לי: אני רוצה לירות
בך. אמרתי לה: בסדר, את תירי בי ואני בך וגמרנו את החשבון.
שתקו. מאיה לא זזה. אנדי ניסתה לומר:
הייתי רוצה להבין, אבל מיד השתתקה.
משה אמר:
אני רוצה להודות לכם.
לנו? אתה? על מה?
שסיפרתי קצת.



י
הפיתוי היה גדול: מאיה שכזאת, רק קומי ואמצי אותה לבת. אנדי מרגישה בכיווץ
הקל של שפתיה, כמין חיוך־גיחוך הסמוי כמדומה גם מעיניו של אוריה: אין חדש
תחת השמש ויש חדש תחת השמש, ומתבקש לאחוז יפה בצלעות־המרובע המתנודדות, שני
גברים בני גיל אחד כמעט, אשה אחת בת גילם כמעט, ונערה אחת העשויה להיות בתו
של כל אחד מן השלושה והיא אהובתו של אחד מהם. את הוריה נטשה מאיה הרחק,
נמאס עליה, אמרה, טוּסון־אריזונה, מעדיפה לחזור אפילו לחיפה־ישראל, לרחוב
הגפן ששם נולדה, מי לא נוטש את הוריו באריזונה, או ברחוב הגפן, ולמה בכלל
קוראים לזה: נוטש. אבא, נחמד דווקא, חזר לו הביתה מבית־הכנסת
בליל־ראש־השנה, או סתם ליל־שבת, תמיד היה נוסע לבית־הכנסת במכונית השחורה,
זה נראה חגיגי יותר, ונהנה לו מאמא, ודאי נהנה פחות מכפי שנהנה כל השנים
מרוזלין הופקינס, הקופאית השמנה של בית־הקולנוע, אמא אולי ידעה ואולי לא,
אבל חברותיה של מאיה בבית־הספר ידעו בדיוק, לילה אחד גם מאיה נוכחה לדעת
בדיוק, אבל גם בלי זה, מי אומר שהקשר ילדים־הורים זה כמו כביש דו־סטרי,
קודם נוסעים בכיוון אחד ואחר־כך חוזרים בכיוון נגדי, קודם אתם למעני
ואחר־כך אני למענכם, סוף־סוף הוכנסתי לעסק הזה בלי שישאלו אותי, אמא־אבא
החליטו, אני יודעת כמובן שזה לא כל־כך פשוט… פשוט זה לסרוג, אמרה אנדי,
ומאיה שאלה: באמת, בשבילך זה פשוט, לסרוג? ודאי, אמרה אנדי, יכולה לסרוג
באוטובוס, בסרט, גם לסרוג ולקרוא. אותי זה מתסכל, ענין הסריגה, אמרה מאיה,
הדבר היחיד שהצלחתי לסרוג, להתחיל וגם לגמור, זה רדיד קטן בגיל שמונה־עשר.
מאיה התחילה אכן לשוב לחיפה־ישראל כשהיא בת שמונה־עשרה, קצת יותר, אלא
שהתחילה לחזור דרך מאַלמו וקאלקוּטה ונקסוס ואמסטרדם, ויכול להיות שהיתה
חוזרת כך עד עצם היום הזה אלמלא אותה אנגינה ואותו טיול־ערב של משה
בפונדלפארק. הפיתוי והסחרחורת, אמרה אנדי לאוריה: איך זה שלא צועקים מרוב
תדהמה כל פעם שעומדים מול אחד, או מול אחת, שייחודם מוחשי כל־כך, ויודעים,
או חייבים לכאורה לדעת, שזה העומד מולך הוא אחד מתוך ארבעה מיליארד
בני־אדם, ולולא מה שקוראים יד־המקרה (לפנים קראו לזה יד־הגורל, אבל איך
יד־גורל יכולה להתמצא בתוך ארבעה מיליארדים, ובכל־זאת יש שגם היום קוראים
לה יד־הגורל) יכול היה גם שלא לעמוד מולך, ומאיה היתה יכולה שלא לפגוש
במשה, ומשה היה יכול להיחנק באותה תעלת־ביוב, או להתרסק מרימון שהושלך
בחיפה, או לנוע לבדו בנתיבות־המסחר עד זקנה ושיבה, עד התקף־לב או
תאונת־דרכים, ומאיה היתה יכולה למות מאנגינה שלא טופלה, או ממנת־יתר של
קוקאין או הרואין, או ללמד לשונות שמיות בסטייט־יוניברסיטי של אריזונה,
