,Title,Translator,Lang,Author,Text
לו לסרב שהילד יעלה לקומה למעלה, לא שאסור לסרב, זאת חובתו שלא לאסור עליו,
גם זכותו. הוא לא רואה את הילד, רק יודע, בלי לדעת מאין, שהילד כבר עשה את
השליחות שהוטלה עליו וכבר חזר. הוא לא מרגיש גאווה על כך שילדו מילא את
השליחות, הוא פשוט יודע שכך זה צריך להיות… אור חשוף בחדר, צרורות
חסרי־צורה דחוסים באחת הפינות, הוא שוכב על מיטת־חאקי מתקפלת, אומר לעצמו
בבירור שעכשיו הוא איננו חולם, שואל את עצמו איך היה הילד מתנהג בגיטו אילו
צריך היה לטפס ולקפוץ מעל לחומה, להעביר בתוך מעילו, בין בטנה לאריג, כמה
תפוחי־אדמה קפואים, רואה את המעיל האפור, הגדול מדי, לא רואים את
כפות־הידיים בגלל השרוולים הארוכים והרחבים… אין נשים בחלום, שום תחושה
של מין, הכל ריק, רק אותו פחד שרודפים אותו, הנה ייכנסו ויקחו, לא פחד
פרטי, פחד וכאב, אור חשוף, חדרים ריקים, לא אור שמש, הכל בלחש, האנשים כאן
לא חיוֹת, הם נתנו לו קפה ואחר־כך הרשו לו לקחת עלה אחד של חסה, הוא לא
התכוון לקחת יותר מעלה אחד, הם שלחו את הילד, את הילד שלו, כי זה היה נכון
לעשות כך, ילד קטן יצליח לחמוק, הם לא הטילו על הילד דברים שלא היו מוכנים
לעשות בעצמם, זה היה נכון ששלחו את הילד שלו.
אוריה התעורר מן החלום עם השיר “כל העולם כולו גשר צר מאוד”. ניסה לפזם
לעצמו את השיר, אבל זכר רק את המלים האלה, ההמשך נעלם ממנו, ידע במעומעם
שבהמשך יש משהו כמו שכל הענין כולו זה לא לפחד, ואמר לעצמו בבירור, וזה כבר
בהקיץ, אבל באיזה אופן שכאילו החזיר את האמירה לתוך החלום גופו, שבחלום הזה
יש משהו חשוב יותר מסמלים לפיענוח.
בשובו מחדר־המחשב מצא את אנדי ישֵנה, ראשה מכוסה בקצה הכר. אוריה כיבה את
מנורת־הלילה, שהה קצת, אחר־כך הלך לו לפינת־האוכל וישב במקומו המועדף. לרגע
חשב להעיר אותה, אבל הוסיף לשבת בחושך, חסר־תנועה וחסר־מנוחה. זכר את הכלל
שקבע להם יום אחד באבירות מלגלגת־למחצה: מעכשיו את המזמינה ואני סר
למשמעתך, ואת מחאתה הרפה, ואת התפנקותה. חזר לפזם לעצמו את השורה האחת של
“כל העולם כולו”, מגחך בהנאה ילדותית שאנדי לא שומעת והוא חופשי לחזור
ולפזם ולחזור ולשבש. אולי סוף־סוף הגיע הזמן למצוא מוצא מהתנצחויות
הרות־גורל כמו ההתנצחות החוזרת על כך האם הקושי שלו לחדול משיבוש, והקושי
שלה לשאת שיבוש, שייכים לאותו תחום עצמו שאין שליטה עליו, או לשני תחומים
שונים.



ו
קולה של צֶלינה בטלפון, בשעה מוקדמת מאוד, נשמע לא כתמול־שלשום, היא גם לא
שאלה מה שלום הילד, לא, היא לא רוצה בשום אופן שאנדי תבוא, אתמול היה חום
כזה בעיר, נורא, נורא, היא כבר דיברה עם בנו של הדוקטור פוקס, זה שהכירו
אותו בז’נבה, איזו שנה יפה זאת היתה, שנה אחת יפה, לא, אין צורך שאנדי
תבוא, יותר טוב שאוריה יבוא, רק אוריה, לעזור לה לנסוע מן הבית אל
בית־החולים, לא, לא צריך לעלות לדירה, היא בעצמה תוריד למטה את המזוודה,
זאת מזוודה קטנטונת, מה כבר יש לה לקחת לשם, ותחכה לאוריה ברחוב, לא, לא
צריך למהר, שרק יתקשר כשיגיע העירה, היא תחכה לו למטה, יש שם קצת צל.
גם אוריה הציע לאנדי שלא תצטרף אליו, מוטב שתישאר עם הילד, תספר לו שסבתא
חולה, שוכבת בבית־חולים, מוטב שיסע לבדו, הרי בכל זאת אין עוד מה לחדש,
מוטב להיענות לצֶלינה, יילך עכשיו לסדר מכונית ולהודיע שבעבודה יצטרכו
להסתדר היום בלעדיו. אוריה רואה את צֶלינה בנעליים אפורות מטולאות, לרגע
חושב שבעצם לא ראה מעודו איש בנעליים מטולאות לבד מצֶלינה, קרועות כן, אבל
לא מטולאות, ובשמלה כחולה־לבנה שהכחול בה דהה במקומות אחדים לידי אפור,
המדיפה תמיד אותו ריח של עובש וסבון, עומדת שם ולא נותנת לו לגעת
במזוודת־העור הישנה שלה כדי להכניס אותה לתא־המטען, לא מניחה לו לגעת
בזרועה כדי לעזור לה לעלות למכונית. מה היא אותה נוקשות של גופה אפילו
כששפתיה משתרבבות לנשיקה, גוף קטן שהופך פתאום לעץ יבש, זרועות מושטות
כענפים, לקבוע מרחק שלא יאפשר נגיעה. למען האמת, בדומה לכך זכר את צלינה
מתמיד, מאז שבא להציג את עצמו, חתן מיועד לחמותו המיועדת, באותו פנסיון
ממורק וצנוע עם שלט־העץ הכהה, חתך מעוגל של גזע־אורן: בוסאנטיֶיה, בסמוך
לכיכר מרוצפת אבני־גוויל של ז’נבה העתיקה. זה היה כך וכך אחרי הגיטו, כך
וכך אחרי הצד הארי, כך וכך אחרי אותו פתח מוסווה בדופן אחורית של ארון־קיר
שדרכו היו צלינה ואנדי זוחלות אל המחבוא כל פעם שנשמעו צעדים בחדר־המדרגות,
למזלן היו מדרגות־העץ שם ישנות וחורקות והאזהרה היתה נשמעת כשמישהו אך החל
לעלות בהן. אוריה, בדרכו אל הפנסיון, לא ניסה לדחות מעליו את מה ששמע על כל
זה מאַנדי ומליאוֹן, רק לדמות לו את שתיקתו אם צלינה תפתח לדבר בזה, ואת
הדברים שיאמר לה ושנוגעים לאַנדי. הוא אמר לאנדי שבהחלט רצוי לו לדבר עם
צלינה ביחידות, הפעם הזאת ביחידות, ואנדי הסכימה לא בלי היסוס. צלינה היתה
לבושה חלוק כחול, שמיד עם כניסתו נראה לו רחב וארוך מדי, ונעלי־בית מרופדות
פרווה. מה שהדהים אותו ביופיו זה מקלעת שׂערה הזהוב־כסוף (מעולם לא ראה
אותה בשיער שמוט, כפי שהיה רואה מדי בוקר את אמו) ודומה שכבר אז חשב על כך
שגם לאנדי יהיה שיער כזה. בשום אופן לא היה ברור לו מדוע צֶלינה מוסיפה
לנגב עוד ועוד את מאפרת־הזכוכית השקופה, כפפה פרחונית על ידה הימנית ומטלית
צהובה בידה השמאלית. הזכוכית, כבר יבשה כחרס, היתה משמיעה מין צוויחה
סרבנית ומתמשכת. רצה לבקש, כבר הכין לו את המלים, שתניח למאפרה, ולא ביקש.
החדר היה קטן מאוד, חלון, דלת, שתי מיטות צרות ביותר, מוצבות בפינה בצורת
ר', מין שולחן־צעצוע מגולף יתר־על־המידה, כיור לבן התנוצץ מתוך ארון שדלתו
פתוחה ומראָה מוצלת מעל לכיור. צֶלינה דיברה בשקט וקול שפשוף הזכוכית היה
ממלא את החדר כמו אזעקה. שוב רצה לבקש שתניח למאפרה ושוב לא העז. אם היא לא
תפסיק לשפשף את המאפרה היבשה במטלית היבשה יקרה כאן משהו.
צלינה אמרה וחזרה ואמרה שהיא מוכרחה להגיד לו את זה, שאנדי יצאה משם, מכל
מה שעבר עליהן, עם לב סדוק, לא, לא במובן הספרותי של המלים, ממש סדק בלב,
לא היא, צלינה, שקבעה את זה, הדוקטור פוקס קבע את זה אחרי שבדק את אנדי כמה
וכמה פעמים, הדוקטור פוקס הוא רופא גדול, מזל שגם הוא בא לז’נבה לחזור קצת
אל עצמו, אין הרבה רופאים כמוהו אפילו כאן, בשווייצריה, והוא ממש ידיד, עוד
מימי וינה, הוא אומר שלאנדי אסור להיות בשמש יותר מעשר דקות, שזה יכול
להיות אסון אם תהיה בשמש יותר מעשר דקות, ושאסור לה מלח, מלח זה רעל, זה
רעל לא רק בשבילה. לא מובן לה, לצלינה, מדוע מקלקלים עגבניות ומוסיפים מלח,
או אפילו למרק, מרק עם הרבה ירקות ובלי מלח… כששָמים הרבה ירקות יש לזה
הרי טעם גן־עדן… אתה מוכרח להישבע לי שלא תרשה לה להוסיף מלח, אתה מוכרח
לשכנע אותה…
עץ־התרזה שבחלון משך את מבטו של אוריה מין משיכה מרגיזה, עוד מעט יסנוור את
עיניו לחלוטין. ידע ידיעה הולכת ומתקהה בו כי בא הנה לומר שהוא עומד לשוב
אל ארץ שחונה ששם השמש מכה כמעט כל חודשי השנה, ושאנדי החליטה להצטרף אליו,
ושאין לו מה לעשות יותר אצל הירקוּת התופחת הזאת. יכול היה לדמות לעצמו איך
הירקוּת הזאת תופחת, רואים את זה ממש בעין, כל שניה. כמה גשמים וכמה שלגים
ספגה! אמר:
אנחנו עומדים לצאת לדרך בעוד ארבעה ימים, צריך עוד לסדר רק…
היה מוכן, ולמעשה ציפה לזה, שצלינה תמחה, שתשאל מדוע מוכרחים למהר כל־כך,
שתתעכב על כל פרט ופרט, ערך בראשו את תשובותיו על הדברים שהיא עשויה לומר:
זה שחבֵרה של אנדי, סטודנטית שווייצרית, בינינו לבין עצמנו לא כל־כך חברה,
מוכנה להשאיל את הדרכון שלה, נכון, זה יפה מאוד, אבל לומר את האמת זה לא
כל־כך מפתיע, אנדי בוודאי עזרה לה בבחינות או משהו כזה, וחוץ מזה היא
יודעת, השווייצרית הזאת, למי היא משאילה את הדרכון שלה, אבל מה פירוש שאנדי
תצטרך להרכיב משקפיים כדי להידמות לאותה סטודנטית, שבעיני צלינה, אגב, אין
כל דמיון בינה לבין אנדי, איפה האצילות והיופי, ומה זאת־אומרת זכוכיות
שקופות, כל אופטיקאי פה בשווייצריה יתפלא, ומי לא יודע מה זאת המשטרה
השווייצרית… ולהחזיר אחר־כך את הדרכון בדואר, כך סתם, זה מעשה לגמר לא
אחראי ואני מתפלאה עליך שאתה…
אוריה זע על מקומו, אפילו חייך, כל ענין רכישת הזכוכיות השקופות לא הדאיג
אותו, ידע בדיוק איך לבצע את זה, היה מוכן לאשר חלק מחששותיה של צלינה ועל
השאר להשיב בסבלנות, להסביר בפרוטרוט מתי נודע לו שכל מי שמחזיק בדרכון
פולני לא יוכל לקבל עכשיו אשרת־כניסה לצרפת, ושאזרחים שווייצריים כלל לא
זקוקים לאשרה כזאת, ושהוא מוכרח להגיע תוך שישה ימים לאוניה שמפליגה
ממארסיי. הפולנית, גירסא גינקותא, יצאה מפיו ללא תקלות, אנדי אולי היתה
משבחת אותו על כך, אבל צלינה כאילו לא שמה לב, לא הפסיקה אותו כמעט, לא
אמרה כלום, ורק אחרי שהשתתק שאלה, כמו מנסה להיזכר בדבר־מה:
אז אתם רוצים לצאת בעוד ארבעה ימים?
אוריה קם על רגליו, רצה לחבק אותה, להודות לה על שהיא קיימת, שהיא קיימת
כזאת, ששתיהן קיימות, היא הצילה את אנדי, היא ילדה אותה והיא שמרה עליה, גם
במשך שש שנים אלה, שכל מה שניסה לדעת עליהן חזר אל המשפט: אני לא הייתי שם;
הוא בא לגזול את אנדי ממנה, לקחת אותה אל הארץ שלו, ששם מתחוללת מלחמה כבר
שבעה ימים. לאנדי אסור להיות בשמש יותר מעשר דקות, לרגע התעמעם הכל בראשו,
לא יכול להבין את פירוש המלים “מתחוללת־מלחמה”, על־כל־פנים הכל נראה לו
פתאום מופרך מיסודו, סתם חוצפה מצדו, לקחת את אנדי לשם, אנדי בכתה בלילה,
אני באה אתךָ, אני באה אתךָ, אמא שמרה עלי יותר מדי, אני חיה כי שמרו עלי
יותר מדי, אתה מוכרח להבין, להבין מה? אתה מוכרח להבין שרק בגללה, או אולי
לא רק, אולי בגלל מה שאני… נכון, הייתי ילדה, ונכון שכל זה היה
בלתי־אפשרי מעיקרו, אולי אם אבוא אתךָ…
את מסכימה לזה?
מה זאת־אומרת שאני מסכימה לזה. רק עכשיו הוציאה מידה את המאפרה והמטלית
והניחה על שולחן־הצעצוע. אני לא אומרת כלום.
את מתנגדת לזה?
מה זאת־אומרת שאני מתנגדת לזה. אני לא אומרת כלום.
היתה שתיקה, לא עוד שפשוף מטלית יבשה במאפרה יבשה. עמד מעליה גבוה ממנה
בראש וצוואר. רצה לחבק אותה חיבוק חזק, לקרב אליו את התסרוקת הזאת, רצה
לחוש כנגד חזהו בחומו של הגוף הקטן הזה, חסר מגן ויגע כבר, שדוף כבר, אז
מה? היא ילדה את אנדי, היא לא אסרה עליו לקחת אותה ממנה, לקחת אותה אתו.
לרגע, על־אף התרזה האלימה שבחלון, ראה עצמו מגבו, לבוש בגדי־חאקי מאובקים,
חגור חגור מלא, נסחב בנעליים כבדות באיזה מישור נגבי שאין לו סוף ואין בו
צללים, והושיט את שתי ידיו לחבק אותה. צלינה נסוגה בבת־אחת, אוריה צעד צעד
גדול קדימה, אחז בכתפיה הצרות, ניסה בכל כוחו לקפל את זרועותיה במרפקים,
כמו שמקפלים כיסא מתקפל, אבל הזרועות לא התקפלו, הורדו נוקשות בצבת ידיו
כלפי מטה. כל כוחו לא הספיק לו להרים שוב את זרועותיה, לקפל אותן, להתיק
אותה מן הקיר ולחבק אותה כשזרועותיו סביב צווארה. צלינה אף לא הדפה אותו
ממנה, רק באיזו דרך נעלמת השתחררה מכל מגע וירדה לשבת על אחת המיטות
שמאחורי שולחן־הצעצוע, מאחורי המאפרה והמטלית, גופה סגור והיא יבשה וקשה
כמו אגוז.
ואותן זרועות, שלא עמד לו כוחו לקפל אותן במרפקיהן, לא נכנעו לו גם
בשעת־הפרידה בתחנת־הרכבת של זֶ’נבה, תחנת גבול לפני המעבר לצרפת. צלינה
ליוותה אותם אל המלחמה, שוב מלחמה, אמנם רחוקה ואחרת, את אנדי, את בתה
יחידתה. היא לא אמרה מלה על אותה מלחמה, אבל משהו בשתיקתה אמר לאוריה שברגע
זה אין החרדה מפני שמש ומלח מכסה ממנה חרדות אחרות. הוא ראה אותה מבעד
לדלת־הזכוכית הכבדה והיציבה של התחנה, שמשקופה היה צבוע בצבע ירוק מכוער,
שמן ומבריק, ראה את צלינה מנופפת מהר־מהר בידה הימנית, בכפפת־רשת לבנה.
הנוסעים דחקו עליהם, צלינה עמדה שם מנופפת ידה מגבם, היה עליהם להתקדם, בלי
לעורר חשדות, לעבר אשנבי־המכס, אל שני השוטרים, לאחד היו פנים עגולות של
ילד טוב, שליד אשנב־ הדרכונים.
וכאן קפץ על אוריה המעשה בכובע. חודשים אחדים לפני־כן, זה היה סוף הקיץ,
הלַאק־לֶמאַן היה הומה מפרשיות לבנות, העצים והפרחים כבר עמדו בבשלותם
הרפויה, העגומה קצת, של אוגוסט־ספטמבר, הירקוּת האלימה שמסביב לאגם כבר
אוּכלה כמדי שנה, הכל קורה כאן כמדי שנה, אמרה אנדי; ועכשיו, באביב הזה,
המֵריץ את אוריה חזרה אל מקומו במדבר, מדינה הוכרזה שם וקרבות פרצו, עכשיו
נראה לו הקיץ ההוא כמין אתנחתא נסוכת־שינה, כאילו דיברו אז זה עם זה מתוך
שינה; הם ישבו, זוג נאהבים, על ספסל קרוב לשפת־האגם, ממש טבוֹל רגליך
במימיו, שערה של אנדי, בשמש אחר־הצהריים, כבר לקראת דמדומים, הפיק מתוכו
אותו גוון שלשערה של צֶלינה (אם להתעלם מן השיבה שכבר זרקה בראשה של האם
ובלי לגרוע כהוא־זה מיוֹפיוֹ), שיער הניצת מתוכו; לבשה שמלה בפסי ירוק־לבן,
ירוק שנראה עמום וכבוי אף לעומת האפילה הירוקה־עמומה שהתחילה לרדת על העצים
שלאורך הטיילת, ובעיקר לעומת רחש־המים של המזרקה הקרובה, איפה שתזרוק מטבע
בז’נבה שם תפגע במזרקה, התלוצצו; היא הביטה במים בעיניים עצובות, לא־שקטות,
ואוריה חשב שהלא מוכרח היה להישאר בהן משהו מן השנים ההן, שהוא לא יכול
לומר עליהן כלום, לא רק מהשנים האלה, כבר ידע שלא רק מהשנים האלה, אם־כי,
עדיין, או באותה שעה, לא היה רגיל לשאול את עצמו כמה בכלל אפשר לדעת על
חיי־אדם על־פי המבט שבעיניו, המבט הוא ראי הנפש, אומרים, מה נפש, ומי באמת
יפענח מבט… אנדי אמרה אז: רק שני דברים אני רוצה, רק, חזרה על המלה
וגיחכה: אני רוצה ילד ואני רוצה קצת שקט, לא שקט כמו כאן, האגם הזה אני
כאילו כל הזמן לא מצליחה לראות אותו בכלל; אוריה אמר: הנֶגֶב זה מין מישור
גדול עולה ויורד עם גבעות נמוכות, כמעט אופקיות, עם צבע שקט של גמלים; אנדי
אמרה: לא נריב הרבה? אוריה אמר: אם נתחיל לריב תתחילי את לשיר, אני אוהב
כשאת מפזמת את השירים האלה, זאָל זיין אַז איך בוי אין דער לופט מיינע
שלעסער, כן, את זה, וגם פאַרוואָס איז מיין סטרוּנלע צעריסן, אם רק תתחילי
לפזם את זה אני מיד… רוח טובה של פיוס ירדה עליהם; היה לו כובע־קש
פלורנטיני, עם סרט סגול מבחוץ ורצועת־עור דקה ומיוזעת מבפנים, אוריה זכר את
החנות־הכוך בוונציה ששם קנה את הכובע ואף אמר כמה פעמים לאנדי: עוד ניסע
לנו יחד לוונציה. הכובע היה מונח ביניהם על ספסל־העץ החום, היציב, ובתוך
הכובע קליפות של שלושה תפוזים שקנו לפני שירדו לאגם, קליפות המוטבעות בתו
המוכר של Jaffa; הרוח הטובה הפכה לרוח שובבות והשיאה את אוריה להשאיר את
הכובע המרופט כבר למדי, על קליפותיו, בחשמלית שתוליך את אנדי, לקראת הלילה,
לפנסיון, בוסאנטייה, אל צלינה, ואותו חזרה אל האכסניה הזולה שבקצה העיר, שם
היה לן כל פעם שנקלע לז’נבה, ולאחרונה היה נקלע לז’נבה פעמים רבות והולכות;
לא חלף שבוע והגיעה אל אכסנייתו הודעה אדיבה מטעם משטרת־הרובע, בערך כך:
שמחים להודיע שנמסר לנו שאתה בעליו של הכובע שנשכח בחשמלית שמספרה כך וכך,
בקו כך וכך, ביום כך וכך; הכובע הנ""ל אובק ומחכה שתבוא לקחת אותו ממחסני
תחנת־המשטרה ברחוב זה וזה, בין שעה זו וזו; ומקץ חודש, כאשר הגיע לז’נבה
לביקור נוסף: הננו לחזור ולהודיעך שעליך לבוא אל מחסני תחנת־המשטרה ברחוב
זה וזה, וכולי, ולשלם עבור איחסון כובעך סך 6 פראנקים; ומקץ חודשיים כבר
שלושה־עשר פראנקים וכן דמי־איבוק נוסף וכן קנס־פיגורים, וכל זה כבר פי
שניים מן המחיר שילם עבור הכובע בוונציה; וכן הלאה וכן הלאה, חוב מצטבר
ותופח לקאנטון ז’נבה; פעם או פעמיים, כשהגיע לעיר, אף פרש את
שוברי־התשלומים לפני אנדי וקרע אותם לגזרים בו במקום, ורק בגלל תביעה
מפורשת מצדה לא פיזר אותם על־פני רצפת־החשמלית ולא דחף את הקרעים אל מתחת
לספסל, אלא הטיל אותם אחד־אחד לתוך פח־אשפה המיועד אך ורק לניירות.
אותו שוטר עגול־פנים ביקש מאוריה, ללא אדיבות, לצאת מן התור מיד לאחר שהגיש
את דרכונו לביקורת לפקיד שבאשנב, וזה עיין באיזו רשימה שהיתה תלויה שם לנגד
עיניו בפנים. הוליכו אותו לנקודת־משטרה בפינת אולם־ההמתנה שבתחנה. בתחילה
לא הבין על מה ולמה, אבל סמל־המשטרה דלה, בלי לחפש הרבה, הודעה בשתי
לשונות, צרפתית וגרמנית, והגיש לו אותה: עליו לשלם לקאנטון־ז’נבה סך
שלושים־ואחד פראנקים, וכן ליטול עמו את כובעו בטרם יעזוב את גבולות המדינה.
לא היה שום טעם להתעקש, ידע שרכבת־האקספרס זֶ’נבה־פאריס לא תחכה עד גמר
הבירור הזה, ראה את אנדי יוצאת אל הרציף, דוחפת לפניה את המזוודה הכבדה,
כבדה מדי לסטודנטית שווייצרית צנועה הנוסעת לבקר בפאריס, ידע שאסור לו
לצעוק אליה אל מעבר לסורגי־הרציף, כדי שלא לעורר חשד, שעליו לרוץ מיד אל
מחסני תחנת־המשטרה, כמצוּוֶה, מרחק שלושה־ארבעה רחובות מתחנת־הרכבת, לפדות
את הכובע הפלורנטיני ולשתוק. אם ירוץ אולי עוד יספיק לגיע למועד צאתה של
רכבת־האקספרס, סיכוי קלוש ביותר, כל התעודות וכל הכתובות בפאריס ובנמל
מארסיי נשארו בכיסו.
צלינה עדיין היתה ברחבה שלפני תחנת־הרכבת, מהלכת הלוך ושוב, בצעדים קטנים
ומהירים, לפני איזו אנדרטה של סוס ורוכבו, בוודאי איש־חיל שנלחם כאן לפני
מאות בשנים, אולי עוד ירה חצים או שפך מים רותחים או שמן רותח מן החומה, מי
עוד זוכר נגד מי או בעד מה. אורות־הניאון נדלקו בזה אחר זה, בחוץ
ובאולמי־התחנה, העטו זוהר קל על מעילה הבהיר של צלינה, הארוך מדי, ובעיקר
על כפפותיה הלבנות, וקרני־השמש האחרונות, שהבקיעו מבעד לסימטה צרה ומפולשת
למערב, הציתו את מקלעת־שערה, שמעולם כנראה לא כוסתה כובע או מטפחת. משהו
ניצת גם באוריה, מין יראה, מין כבוד. בעיקוף גדול חמק מן הרחבה שלא להיתקל
בצלינה, כי מה יגיד לה, שכך הוא שומר על אנדי כבר בתחילת הדרך, את בתה
