,Title,Translator,Lang,Author,Text
0,נקרא לו ליאון,,,יונת ואלכסנדר סנד,"
 
חלק ראשון: משהו עומד להתבהר
א
נקרא להם אַנדי ואוּריה.
אַנדי עמדה לשוב לארץ בתום שבועיים מתישים ורצופים נסיונות כושלים. לרגעים,
ובמיוחד כשהיתה אורזת את מזוודתה לקראת טיסה נוספת לפאריס או ללונדון
(מזוודת בד־ועור קלה, חומה־בהירה, לפני שנים חלמה על מזוודה כזאת), היתה
תוהה על כך שהדבר לא מעיק עליה ביותר. אמנם היה ברור מראש שהסיכויים קרובים
לאפס, ובכל־זאת הרי הסכימה לצאת אחרי שבאו והפצירו בה פעם ועוד פעם, מי אם
לא אַת שעברת את כל זה ותדעי להציג כראוי, והשפות שאת מדברת, וההופעה שלָך,
שיחדו אותי במחמאות, אמרה אנדי ונסעה לעניין רשתות־טלוויזיה זרות, תחילה
בקופנהאגן ואחר־כך בפאריס ובלונדון, בסרט תיעודי על גיטו וארשה, שבהחלט
נבדל מן הסרטים המוכרים לה שהופקו עד כה. עורכי הסרט לא שיבצו בו את
התמונות הידועות מימי מגיפת־הטיפוס, גם לא מן הימים האחרונים של מרד אפריל,
עשן בתים בוערים, אנשים קופצים מן הקומות העליונות ונורים תוך כדי מעופם,
להביורים מוסיפים אש. המרד לא הוצג, נמסר עליו רק בכמה משפטים יבשים,
אפורים, שהוקרנו על גבי מרקע ריק, בלי פס־קול. עיקרו של הסרט, שאורכו
ארבעים וחמש דקות, היה אוסף־צילומים של צלם אלמוני, ודאי ניספה לקראת הסוף
יחד עם כולם, שרצה לתעד כנראה את מה שמכנים פכים קטנים: כניסה לבונקר מתחת
להריסות, מוסווית בתושיה שאינה חסרה מידה של הומור; שתי נשים קולפות
תפוחי־אדמה קפואים (אנדי שאלה את עצמה, גם אחרי צפיה שניה או שלישית בסרט,
האומנם רואים שתפוחי־האדמה קפואים); שני נערים יחפים, חובשים
כובעי־גימנזיסטים, רתומים בחבלים לעגלת־סולמות, אולי אחת העגלות של פינקרט
להוצאת המתים אל מחוץ לשטח הגיטו; ילד זוחל דרך פרצה, רזה מאוד אבל בריא
למראה, מרים פניו ומחייך אל המצלמה, נהנה מחשיבותו; אדם לא צעיר, ערום עד
מתניו, מְפַסל מקרשי־ארון־דפוקים־יחד פסל של מאדונה־עם־ילד; הרבה צילומים
של הפסל הזה, מכל צדדיו, בעוד האור נופל רק מלמעלה, כנראה מאיזו
ארובת־אוויר של הבונקר. סוּפר לאנדי כי לאותם סרטי־צלולויד, שהוסתרו
והועברו אחר־כך לארץ על־ידי רוקח פולני שעמד בשעתו בקשר עם בית־החולים
היהודי בגיטו, היה מצורף דף־נייר, הדיוֹ שעליו דהתה כמעט לגמרי, אבל עדיין
ניתן לפענח שהצלולויד סופק לצלם על־ידי הגרמנים, כדי שיצלם ויסמן במספרים
את המתים ברחובות והוא הפקיע כמות מסוימת מהצלולויד לצילומיו שלו.
האיש שאַנדי היתה אמורה לפגוש בקופנהאגן לא חיכה לה במקום המיועד: נסע
באיזה ענין דחוף ולא־צפוי (כך הסבירו לה במשרדו). ממלאת־מקומו דיברה
בקרירות, כמעט בגסות מכוונת, כאילו לקחה על עצמה להזים את הציפיה המרגיזה
שהדֶנים יהיו תמיד טובים מזוּלתם. מאוחר יותר אמרו לאַנדי שזה היה סתם
חוסר־מזל, שזאת אשה־עם־בעיות־משלה שתפקידה בחברת־ההפקה שולי. אלא שהסבר זה
ניתן לה לאנדי באיחור, ובינתיים היא כבר נתפסה לאותה הרגשה, הצומחת בנקל,
של תקלה־גוררת־תקלה, ואם הוסיפה להתרוצץ בין הערים הרי היה זה בעיקר כדי לא
להפר את כללי־המשחק שקיבלה על עצמה.
בפאריס וגם בלונדון נהגו בה דווקא במעין זהירות. בגמר ההקרנה־ההדגמה, באחד
מאותם אולמות קטנים ומרופדים, הדומים כל־כך זה לזה עד שכל עוד אין פותחים
לדבר בשפת־המקום דרוש מאמץ כדי לזכור באיזו ארץ אתה נמצא, לא העלו מיד את
האורות המסנוורים, אלא המתינו זמן־מה בחושך, בשתיקה, כראוי לחומר שהוקרן.
אילו העלו מיד את כל האורות היתה אנדי אולי מוצאת את עצמה במקומה, אבל אותה
השתהות מכוונת, בת עשרים־שלושים שניות, הפכה את כללי־המשחק לנלעגים, את
תנועותיה למגושמות ואת דיבורה למעושה. תחבולות־העזר הידועות – הצתת סיגריה,
הגשת־אש זריזה ואדיבה במופגן, מזיגה מהורהרת של ויסקי או ברנדי – כל זה הקל
עליה אך מעט, ולעומת־זאת סייע בעליל למארחים, למארחות (משום־מה הרוב היו
נשים), לשים קץ לשתיקה הלא־נוחה ולומר את דברם. הם אמרו, הן אמרו, כי איכות
הצילומים ירודה ביותר, וכי איך ייתכן אחרת, הם הרי צולמו בנסיבות מיוחדות
מאוד, עיניהם הרואות, ונשמרו בתנאים־לא־תנאים עד שהגיעו לתעודתם, לאותו
מוזיאון בישראל. באמת איך הגיעו? אכן, בדרך נס. כן, כמובן, זה ברור, אלא
שפגמיו המרובים של הסרט הזה נובעים לא רק מאיכותו של הצילום, גם מדרך
העריכה, חייבים לומר את זה, הפגמים לא יניחו לסרט לעבור את המחסום,
המחסומים עכשיו גבוהים, ועוד זה שהוא בשחור־לבן, מי עוד עובד בימינו
בשחור־לבן. היה אחד שבחר דווקא בשחור־לבן כאשר ניגש לעבוד על נושא קרוב,
הצליחה אנדי להשמיע בשני המקומות, גם בלונדון וגם בפאריס, בשינויי־נוסח
קלים אבל באותו חיוך מאומץ עצמו. בלונדון היה עליה לפרש לאיזה במאי היא
מתכוונת, בפאריס ידעו מיד, כמו שציפתה, ובכך היתה רווחת־מה. נכון, אמרו לה
בפאריס, אבל הוא בחר לעמת את השחור־לבן עם צילומי־הווה בצבע, מי לא זוכר את
הפרחים שלאורך המסילה ההיא, אותו עימות הוא אשר… וחוץ מזה, כמה שכמותו יש
בעולם, לא רק בין במאים חובבים, כמו עורך־הסרט שראינו עכשיו, הלא־כן? אלא
אפילו בין אנשי־קולנוע ידועי־שם. לוּ צילומים אותנטיים אלה, והאותנטיות
שלהם ודאי שאינה מוטלת בספק, היו נופלים לידיו של במאי גדול, או לפחות במאי
מנוסה, שהיה משכיל לתת להם את המסגרת הנאותה, את המגע הנכון, כמו אַלֶן
רֶנֶה ל“לילה וערפל”, כי אז, אולי, היה מקום לשקול מחדש, אם־כי צריך להודות
שהנושא הזה כבר זכה לכיסוי רב, גם ברשתות אלה, אולי אפילו רב מדי, ואל
יתפרש הדבר שלא כהלכה, אלא פשוט, לפעמים עודף כוונות טובות גורם נזק…
אחרי אולפן זה ודברי־סיום אלה היתה ההליכה ברחובות פאריס כמין הנאה מבוהלת,
אולי כמו שיבתו של גָמול־מסמים אל הסם שהיה מכור לו, חשבה אנדי. שעות צעדה
לאורך הסינה, על גשר אחד חוצה לגדה השמאלית ועל שני שבה לגדה הימנית, וחוזר
חלילה. ברחוב ריבולי קנתה לה רדיד־משי כחול, דומה לזה שהיה כרוך לצווארה
כאשר אוריה ראה אותה לראשונה, מיד אחרי המלחמה, וקשרה אותו על צווארה למרות
שהאוויר מעל הנהר היה לח וחם, כמעט חונק, אחר־כך נכנסה למטרו, סתם־כך,
לנסוע ולקרוא את השמות של התחנות המוכרות, ועוד באותו יום נחתה בנמל־התעופה
של היתרו.
בלונדון, הנוכרית לה יותר מאשר פאריס, היה המעבר מאולפן־ההקרנה אל הרחובות
פשוט יותר, ושם, תוך כדי הנסיעה ברכבת התחתית, שיננה לעצמה שוב את הדברים
שנאמרו לה בפאריס על הצורך להוסיף לסרט שבאמתחתה מסגרת־בצבע של ההווה, צבע
והווה לעימות עם צילומיו של אותו צלם אלמוני שהילך בגיטו. האיש שישב מולה
ברכבת־התחתית נתן בה מבט תוהה מעל עתונו, ואנדי הבינה שהיא כנראה מחייכת
נכחה: פתאום עלה על דעתה שאותו פֶסֶל עשוי קרשי־ארון־דפוקים־יחד קיים,
שגילו אותו בשעת פינוי ההריסות והציבו באחת הכנסיות המשוקמות (בני וארשה לא
ישליכו פסל של מאדונה־עם־ילד), ושעליה לנסוע לשם בסופו של דבר.
ומיד חדלה לחייך, כי בבת־אחת עלה בה הגירוי המועד־לפורענות: אוריה חייב
לעזור לה, לנסוע אתה לווארשה, הוא חייב לרצות בנסיעה הזאת, לרצות בה באותו
האופן שהיא רוצה בה, מתוך אותה הרגשה, כי בלי זה אין עוד שום טעם. וכבר
התחילו היגיעה והפחד, הידיעה שתצטרך לעמוד מול איזה מבע מסויג, מסויג או
מוסח־דעת, או איזה סירוב שרירותי להכיר בתוקפם של דברים שהועלו ולא על־ידו,
או מול איזה כשל בהתנהגות המפר את קסם־ההרפתקה, גם אם הוא מוכן להתנסות בה,
או אפילו להיסחף בה. די אם יאמר, למשל: למה לא, אדרבה, סעי אם את רוצה, כבר
נמצא לזה איזה מימון, אני אין לי שום חשק לנסוע לווארשה. היא תצעק בקול,
באגרופים קמוצים: למה אדרבה, מה פירוש אם אני רוצה, ומי דיבר על חשק, מה
ענין חשק לכאן, והדברים יתגלגלו במסלולם המוכר, יגררו אחריהם דברים נוספים,
יתנפחו, ייערמו סביבם ויתפחו בתוכם, כל פעם מחדש אותו מרבץ אטום וזר,
לא־ייאמן, לא־מובן בעצמתו, כמו התקפי־טירוף שאינם ניתנים לשחזור במצב של
צלילות־דעת והם שוקעים ומצטברים, מעוררים תמהון וכלימה.
אוריה טילפן אליה אותו ערב. אַנדי אהבה את קולו בטלפון, נמוך ומשתהה, כמו
מצפה להפתעה או מבטיח הבטחה. הפעם גם היתה הפתעה, דבר־מה שיש לו למסור לה,
ודבר זה דחה לפחות לזמן־מה את השיחה ביניהם על אותו פסל של מאדונה־עם־ילד
ועל תכנית הנסיעה המוכרחת לווארשה. אנדי לא אמרה אלא משפט מהיר אחד על איזה
רעיון מיוחד־במינו שהתחיל לנקר בראשה והיא תספר לו עליו בשיחת־הטלפון הבאה,
או אולי כבר אחרי שובה לארץ.
אוריה אמר:
אתמול התקשר משה. יש לו הצעה. שתנוחי כמה ימים באיזו בקתה שהוא קנה שם, או
שכר, לא שאלתי בדיוק, שמעת משהו על זה? לא? לא חשוב, נתן לי כתובת מדויקת,
תרשמי לך. זה כפר קטן במחוז הֶרטפורד. המפתח נמצא אצל הוויקאר בכנסיה
שעל־יד. משה אומר שברגע ששמע על נסיעתך מיד חשב שזה בזבוז נורא לא לנצל בית
שעומד ריק. גם ביקש שתסתכלי אם מטפלים שם בכל, אם מטפלים בגינה ואם התקינו
מקלחת. זה כנראה בית בן כמה מאות שנים. ולמה באמת לא תטיילי קצת, תנוחי לך
לבד. הרי אוהבת לבד, לא? הוא מסר לי אפילו את זמני יציאת־הרכבות מלונדון.
יש רכבת־לילה נוחה מאוד, הוא אומר, את רושמת?
וכך שוטטה לבדה בכפר קטן שבמחוז הֶרטפורד, ובעיירה הסמוכה לכפר, ובאחת
השעות אחר־הצהריים נקלעה, עייפה מהליכה מרובה, אל המוזיאון של העיירה. היא
נכנסה בדלת האחורית, גם זו דלת־עץ כבדה ומגולפת פאונים ונימפות, נכנסה בה
בטעות ובלי שום כוונה, איש לא נקרה בדרכה, מציבה בזהירות את רגליה הכואבות
על רצפת־העץ החורקת, משיטה מבט מנומנם על־פני המוצגים, כך העידה לאחר־מכן,
לראָיה שלא היה בו במפגש הזה שום דבר מן המוכן־מראש, שלא נערכה לכלום, עד
שמבטה נפל על פסל־עץ בגודל טבעי בקירוב, מוצב על־גבי כן נמוך כמעט באמצע
החדר, גבו אליה. הרבה טרחה למסור מה קרה לה שם עם אותו פסל וידעה שהיא
נכשלת במאמציה, והדבר עורר בה כפעם בפעם תמיהה ועלבון, ולרגעים רצון לברר
לעצמה את סיבות הכשל: מפני שהתלהבות לגילוי משלך מעוררת הסתייגות בזולת,
שלא היה שותף לאותו גילוי ואיננו יכול להתלהב כמוךָ; מפני שהרושם היה גדול
כל־כך שהצורך לפרט אותו היה כרוך באכזבה מוכרחת, המעוררת בזולת
הסתייגות־על־הסתייגות; מפני שקרו לה שם ברגע ההוא דברים רבים ובמהירות
מרובה, כמעט מותר לומר בעת־ובעונה־אחת, והפכו את הענין למורכב ולגורר
מלות־הסבר רבות מדי. זה היה בערך כך: תחילה, בעוד היא רואה את הפסל מגבו,
נמשכה אל הצבע הכחול שנשאר אחוז בסדקי־העץ, ואל האופן שבו נתונה הדמות
הקטנה יותר, זאת של הילד, המעוצבת בשלימותה, על זרועה של דמות־האם היוצאת
מגוש־העץ ממותניה ומעלה; אז התקרבה וניגשה אל הפסל מצד פניהם של האֵם
והילד; המראה טילטל אותה, וכדי לקיים או לחזק אותה טלטלה, כביכול לתת לה
תוקף נוסף, חשבה מחשבה, לא חשבה אלא כאילו המציאה לה בו־ברגע, ובעצם לא
מחשבה אלא משהו הדומה למצבי־חלום, כשיודעים בעת־ובעונה־אחת שדבר מסוים לא
שייך לכאן ושהוא כאן בלי שום ספק, בקירוב כך: משה גילה את הפסל באחת
מנסיעותיו לווארשה, דאג שהפסל יועבר הנה, וזימן לה כאן הפתעה. מקץ רגע ארוך
התכופפה לקרוא את תווית־הנחושת שעל־הכן: מאדונה־עם־ילד, היה כתוב שם, שלהי
המאה האחת־עשרה, אמן אלמוני.
עמדה שם זמן רב. התעתוע, היקיצה ממנו, הגילוי הראשון, שעמד בעינו אחרי
ההתפכחות, שלא התבדה ולא פג אלא התעצם עם ההתבוננות, כל זה סיחרר עליה את
ראשה והוליך אותה אל בית־הדואר של העיירה, אל מכשיר־הטלפון, אותו פלא שלא
חדל להיות פלא גם אחרי שאלפי שיחות התנפצו בו לרסיסים. היתה זו כמובן חובה
למסור לאוריה תיכף־ומיד את הגילוי על כל היבטיו ופיתוליו, לבל ייעלמו בנבכי
הזכרון הבודד, יחד עם כל הלא־נאמר שכמוהו כלא־היה. והיתה זו כמובן חובתו של
אוריה להבין במהירות־הבזק ובמלוא ההיקף, בלי ערעור או פקפוק, שהנה כך:
מאדונה־עם־ילד, והילד פניו פני מבוגר; מדוע כך, שהילד לא ילד, על זה אוריה
ישמח לדבר, אוהב לעסוק בזה, תו של תקופה, חֶסֶר של תקופה, וכן הלאה, אבל מה
שנראה כלא־ידוע, מה שהיא לא ראתה בשום מקום אחר, ושהיה הגילוי שלה, הוא מה
שנוצר מן החֶסֶר הזה: ילד שפניו פני מבוגר הרי זו גזירה שנגזרה עליו להיכנס
מעצם יום־היוולדו לתוך מעגל הטירוף והטמטום שאנחנו גוזרים עליו מאז ומתמיד,
מטומטמים ומטורפים מדור־דור, אסון כל הזמנים, לא, לא כל הזמנים, זמנו של
אותו פסל מקרשי־ארון־דפוקים־יחד מן הבוּנקר נשאר מחוץ לכל הזמנים,
בעת־ובעונה־אחת הידיעה שהזמן ההוא הוא מחוץ, והידיעה המקיפה את כל הזמנים,
החרוטה בפניהם של המאדונה והילד־המבוגר שעל זרועה. אנדי לא הצליחה לערות את
כל זה לתוך האפרכסת, וכמובן וכמצפה די היה במלה אחת של אוריה, שלא מיד הגיב
שם בקצהו השני של החוט, במרחק כך וכך קילומטרים ובדקות ראשונות של שיחה
בין־יבשתית, די היה בצליל מסוים אחד בקולו, שונה ולו במקצת מזה שציפתה לו,
כדי להפוך את התלהבותה לקוצר־רוח ואת הרגשת הראיה הצרופה למשהו מזולזל
ומוטל בספק. אוריה אמר משהו על מאדונות בכלל, בנעימת־קול נדיבה, שהיה נוקט
כפעם בפעם כדי להבליע הסתייגות, והיא קראה מיד שאין לזה שום קשר עם
מאדונות־בכלל, שום קשר, איך אפשר לטעות כל־כך, וכבר נלכדו שניהם
בגלגלי־שיניים של מלים המוליכות בהכרח לטריקת דלתות ואפרכסות, הנה־הנה,
לגביה מלים כמו: לא־זה־הזמן, אפשר־להבין־את־זה־גם־כך, אל־תתחילי־מהתחלה,
ולגביו מלים כמו: איך־אפשר־שלא־להבין־מיד, הרי־זה־פשוט־היסק, תמיד, אף־פעם, כל, שוּם.
כמובן, לא ציפתה שיעלה על מטוס ראשון ויבוא, למרות שידעה בו ואהבה בו את
צד־ההפתעה, שבאופן זה או אחר דר בו בכפיפה אחת עם צד־הכובד, ובאופן זה או
אחר השיק לאותה התעקשות שרירותית שכל־כך שנאה בו. תאריך טיסתה חזרה לארץ חל
בעוד יומיים, והרי זה מחוץ לכל הגיון ומחוץ לכל אפשרות סבירה, זו העונה
הבוערת של קטיף־אפרסקים, ואיך פתאום יקום אוריה ויטוס אליה. ובכל־זאת כל
אותו לילה, בבקתה החשוכה של משה, מלאה אותה נהיָה עתיקה ונלעגת: אילו בא.
אילו בא היה משהו חשוב לעין־ערוך מתברר, משהו חשוב לעין־ערוך ניצל, היא
היתה מודה ללא־קושי בדברים רבים, מתחרטת וסולחת, ובוודאי שהיתה מוצאת עצמה
חייבת להודות בקשריה המפוקפקים עם מאדונות־בכלל. איך בכורעה ברך לפני
האיקונין, בכנסיית הכפר שם מצאו מקלט זמני היא ואמה, הגיטו השרוף בגבן, יש
שהיתה מתחזה לא רק בפני עיניים חשדניות, אלא גם בפני עצמה, שוקעת, כמו
בגירויי־מין נסתרים, בגירוי למצוא בתוכה את דבקותה המתוקה של נערה נוצריה
בטוהר הבתולה הקדושה; ואיך, אחרי שנים רבות, חופשיה ובוגרת, התחילה לכופף
ברכיה כלפי ההדום הקרוב אל האיקונין הביזנטי בכנסיית סֶן־ז’יליין־לה־פוֹור,
אותה אהבה בלי שום התחזות, או כמעט בלי שום התחזות, ואם לא כרעה על ברכיה
בפועל־ממש על אותו הדום של קטיפה אדומה ומרופטת הרי זה מפני… היתה נמשכת
להוסיף ולספר לאוריה, להוסיף ולבקש שישרך דרכו בסבלנות עם כל פיתולי
בחינותיה, ובחינותיה החוזרות, למשל כך: שאז, בכפר ההוא, היתה אמנם אותה
התחזות־בפני־עצמה, בין היתר, מין תחבולה להרגיש את זהותה־השאולה מבפנים, עד
כדי בטחון העשוי להרתיע חשדנים; ושאחר־כך, ובכלל, הרי אותה התחזות, או
התחפשות, או אותו משחק בחילוף־תפקידים, הוא אחד המשחקים הקדומים, סוג של
מפלט המזומן לו לאדם בכל מקרה ובכל זמן.
גם מצחצוח־חרבות זה נחלצו איכשהו. אוריה לא בא, גם האפרכסת לא נטרקה. אנדי
חזרה לתאר, כבר בארץ, אצל השולחן העגול שבפינת־האוכל, אל מול חלקות־המטע
ושדה־התירס ואופק הגבעות השטוחות, את פניה ואת זרועה של המאדונה (משה כלל
לא ידע על קיומו של פסל כזה במוזיאון שבעיירה הסמוכה לקלארנדון, אותו כפר
שם קנה לו בקתה זנוחה): הזרוע אינה חובקת ואינה מרחיקה, רק נושאת את הדמות
הקטנה שפניה פני־מבוגר, רק נושאת; הפנים צופים נכחם, חמורים, יודעים,
יודעים מה שהצופה אינו מצליח לדעת, לא למנוע ולא לדעת.
אף חזרו שניהם לערוך תכניות־מסע: יסעו לשם יחד בעונה המתה של המטע, יראו את
הפסל אותה ראיה עצמה, ובעזרתה יתחוור לשניהם משהו חשוב לעין־ערוך, ושבלעדיו
כבר לגמרי ובשום־פנים־ואופן אי־אפשר לחיות ואשר אלמלא נדחה תוך זלזול, או
אילו הובן בעוד־מועד, כי אז אולי אפשר היה לחיות אחרת. זה תמיד ככה, תמיד
משהו, ולא משנה מה, היה אוריה אומר בשעות של איבה, אם לא זה אז דבר אחר,
מלות־צופן כבר משומנות היטב למלכודת הריב, לפולחן־הריב, נוסחת־קיצור שמקורה
נשכח: אם לא זה אז זבוב על וילון, או אַמְבְרֶלָה. תגיד, תגיד כבר: זבוב,
אמברלה, אסתטיקה של חיי יום־יום, חובה לטייל באופניים, חובה להתעמל, לשיר
בלי לזייף, לרקוד, למסור בדיוק ובלי שיבוש, לשים את כף־הטיגון רק במגירה
הזאת, בשום פנים־ואופן לא בזאת, להודות בטעות, נכונות להודות, שינוי, ילד,
עוד ילד…
כאן היה אוּריה מפסיק אותה:
זה לא שייך. אַת יודעת שזה לא שייך.
איך אני יודעת? לא דיברת גם על זה כעל שגעון לדבר אחד?
אולי דיברתי. אינני זוכר. מה זה חשוב מה דיברתי. עכשיו אני חושב כך.
למה לך להתכחש למה שחשבת פעם? אולי צדקת אז? גם זה שגעון, אמנם מה שקוראים
נוהג־שבעולם, ובכל זאת שגעון. המסוכנים בשגעונות באים מנוהג־שבעולם.
הוא נתן בה אחד ממבטיו העשויים להכמיר את הלב אם הלב פנוי להיכמר, המשחרים
לטוב, ואמר משפט שהדהים אותה בפשטותו, העשוי לצקת פיוס בכל נימי־דמה, כמו
התחברות הגופות:
וכי מה היינו עושים בלי ילד?
אחר־כך היתה אנדי חוזרת ושואלת לְמה התכוונו באומרם: ילד. מה ביקשו, בנוסף,
כמובן, על מה שכל בעל־חיים מכוון אליו. לפעמים היתה מנסחת את השאלה כך: מה
המציאו, איזה סיבוכים ואיזה תירוצים, ילד שאפשר יהיה לפנות אל תמימותו,
