,Title,Translator,Lang,Author,Text
נתן היה עד לתופעה נדירה, לולא היה עיוור: הגבר המגודל בעל הקול הרועם,
ניגב באגרופו את דמעותיו.
– “עזוב את הזכרונות, טוֹנִי. מה שהיה היה ולא ישוב עוד. הגיעה שעת התה אצל
אַרמִין. בוא, ניגש אליהם”.
הם עלו במעלה רחוב סַאבַּאדִי. לוח סגלגל הכריז על שער הכניסה: “הרופא
הוטרינרי העירוני”. נֶלִי הכינה את העוגות והספלים, כי בשעה זו רגילים לבוא
האחים, שהתפנו מעבודתם. מיכאל יצא מחדרו, שבו התכונן לבחינות וחיבק את
אביו.
– “מה מתרחש כאן? – שאל נתן את בנו – קרה משהו? אני חש בשקט הזה, כאילו
משהו אינו כשורה”.
– “איני יודע בדיוק, אבא – ענה מיכאל – גם לי נראה הדבר מוזר ואני מודאג.
הדוור הביא מברק, הדוֹד אַרמִין לחש משהו לדודה נֶלִי ויצא מהבית בחפזון”.
נֶלִי התעלמה – שלא כדרכה – מבואם של הגיסים, יצאה לרחוב ועיניה תרות אחרי
בעלה. חזרה עם אַרמִין והתרגשות על פניהם.
חברתה של גִיזֶלָה שלחה טלגרמה מוִינָה – סיפר אַרמִין. – שתיהן היו בדרכן
לקַרלסְבַאד ואחותנו חשה ברע. התקף כיס המרה, כנראה. הן חוזרות לבודפשט.
פוֹלִי יצא כבר לתחנה ויסע באקספרס לבירה"".
לגמו את התה בלי אומר ולבם כבד.



 
עקרה ברוכת-ילדים
ד""ר פּול פִּילִיץ ירד כסהרורי ממדרגות בית-החולים הקטן. שעת הצהריים
התקרבה והוא לא עצם עין כל הלילה. אמש הביא את אחותו וראה את הניתוח
מתחילתו עד סופו. היא הגיעה במצב אנוש, חום גופה עלה וכאבי תופת תקפו אותה.
אבני כיס המרה ייסרוה. האמינה כי מי קַארלְסְבַּאד ירפאו אותה. מדי קיץ
נסעה לשם וחזרה כאילו יותר בריאה. זִיגמוּנד החנווני הכפרי לא חסך כסף כדי
שלא תסבול. הפעם נתברר, כי הכרח להרחיק את האבנים הטרדניות.
הדלקת המוגלתית גרמה נזקים בלתי-משוערים. זיהום התפשט בכל גופה. פוֹל נשאר
ליד מיטתה אחרי הניתוח וליווה אותה עד הסוף.
משפחות-משפחות טיילו בשׂדרה. בהתקרב שעת הצהרים החלו לנוע בכיווּן הגן
העירוני הגדול, כדי לסעוד את לבם באחת המסעדות הטובות בשולי הפארק. ודאי
חשבו שליל הילולה עבר על האיש השמנמן, הנמוך, המשׂרך דרכו בצעדי מתנדנדים
ובלתי-יציבים, אך הוא לא חש במבטים. הגיע לסוף הרחוב ופנה לשדרת אַנדרַאשִי
הרחבה. צליל עמוק של פעמונים הכריז על צהרי היום. חצה את הכביש והמשיך
במדרכה ממול, בצל ערמוני-הבר. הטיילת כוסתה במרבד לבן של עלי כותרת, אשר
נשרו מאשכולות התפרחת. גופו הכבד השאיר עקבות של פרחים מעוכים, שנרצחו שנית
לאחר מות הנשירה.
גִיזֶלָה העליזה והטובה נפטרה. דווקא היא, אמם של שישה. זִיגמוּנְד, בעלה
התמהוני, יבוא לבירה לאחר שלא הספיק להיפרד ממנה. לא ישאל עוד לעצתה, מה
לעשׂות עם הילדים… דווקא גִיזֶלָה הלכה לעולמה. אילו מת הוא, פוֹל, איש
לא היה בוכה אחריו… אולי לא בדיוק כך, כי יש אחים ויש חולים, היודעים
להעריך את שירותיו. גם ידידי-אמת יצטערו, כאשר יסתלק. אבל אין לו אשה ואין
ילדים. יקברו אותו ורופא אחר יבוא במקומו…
כל-אימת שבא לבודפשט, התארח הצל אִיגנַאץ, בן הדוֹד דניאל. אִיגנַאץ הוא
רופא מצויין, איש משׂכיל, אבל סנוב במקצת. אין זה פלא, שהוא מעריך את עצמו
כל כך. סוף-סוף הוסמך בסוֹרְבּוֹן של פריס, התמחה אצל טובי הפרופסורים
בוִינָה בחדרי יולדות ובקליניקה לריפוי עיניים. שואלים, מה בין שני תחומי
התמחויותיו? אִיגנַאץ משיב בחיוך: “רופא חייב לראות את הנולד!”
צלצל בדלת הדירה. המשרתת ליוותה אותו ישר אל חדר-האוכל, שם ישבה המשפחה,
מוכנה לארוחת הצהרים. הילדים תלו בו מבט סקרני-תוהה: מה קרה לדוֹד פוֹלִי?
מדוע הוא קודר כל כך? הרי הלצותיו טעמו תמיד אפילו מהממתקים שהביא, והפעם
היה זה דוֹד פוֹלִי שונה. אִיגנַאץ פינה לו כיסא לידו ושאל בחרדה לשלום
גִיזֶלָה. פוֹל הרכין ראשו כתשובה. בעלת-הבית התייפחה חרישית.
– ""המסכנה, הסתלקה כה צעירה! – דמעות חנקו את גרונה.
משרת הגיש את הארוחה. פניו הרצינו והשתדל להימנע מלהקים רעש בצעדיו. פוֹל
הביט בחלל הריק, ניסה לטעום מהמזון, אך לא הצליח לבלוע דבר. הילדים ניגשו
אליו בתום הסעודה. הבכור לחץ ידו ונשך שׂפתיו, כדי להתגבר על התרגשותו. גבר
בן עשׂר. השני גמגם משהו ופרץ בבכי רם, כאשר הדוֹד נשק למצחו. האומנת
ליוותה אותם לחדרם והמבוגרים עברו לסלון. לגמו קפה מספלי חרסינה קטנים
והאזינו לתקתוקו של שעון-קיר בארגז עץ גבוה. צלחת הנחושת של המטוטלת הקרינה
את השתקפות השמש כנקודת-אש זעירה, נעה בקשת על הטפטים. אִיגנַאץ הפר את
השתיקה המעיקה:
– “המבוגרים יתגברו. אבל מה יהיה על היתומים? איך יצליח אביהם לדאוג לשישה
הקטנים בכפר נידח?”
השאלה הטרידה גם את פּוֹל: מה יהיה על היתומים?
*
את גופתה של גיזלה הטמינו בקרבת קבר אביה מוֹרִיץ. המשפחה התאספה בתום הטקס
בבית האם הזקנה, שעמה גר ד""ר פוֹל הרווק.
– “ברוך דיין אמת – חזרה ואמרה הַאנִי – אבל במה חטא זִיגמוּנד? מה יעשׂו
הילדים בלי אם? אילו הייתי צעירה, הייתי לוקחת אותם אלי. אך זקנתי ועייפתי
מאוד”…
– “אל דאגה אמא – נשמע קולו השקט, דווּי הכאב של אַרמִין. – אנו נדאג להם.
אם זִיגמוּנְד יסכים, ניקח את הילדים אלינו. יש מקום די והותר בביתנו. אנו
גרים ברחוב שלך, כמה צעדים ממך ותראי אותם יום-יום. לנו לא נתן הגורל
ילדים, נעניק להם את כל אהבתנו ודבר לא יחסר להם”.
זִיגמוּנְד אַדלֶר ישב המום ומסוגר בעצמו. לא עיכל עדיין שאשתו אינה עוד:
– “מה אתם מדברים?! הילדים יבואו אתי לבּוֹדַאיק ונמשיך לחיות כמקודם”.
לפתע נזכר שאי-אפשר להמשיך כפי שהיה. גיזלה נפטרה והקטנים זקוקים לאהבת
אשה. הסתיר פניו בכפות ידיו, כתפיו רעדו, פוֹל חיבק אותו.
– “נחשוב כולנו ביחד ובהגיון – המלים החמות כאילו ליטפו אותו – אִילוֹנְקָה
ובְלַנקָה תחזורנה בסתיו אלינו להמשיך לימודיהן בתיכון. רצוי שהאחיות
הקטנות תישארנה אִתן. נֶלִי תאמץ אותן כאֵם עד אשר יגלידו פצעיהן. ואני
מציע שהבנים לַאסלוֹ ואַנטוֹן יגורו עמנו בבית זה. אדאג ללימודיהם וסבתא
תעניק להם את החום ואת האהבה הנשית”…
האלמן לא הרים את ראשו. כתפיו רעדו מעוצמת ההתרגשות. חש כגלמוד ומנוצח.
גיסיו האהובים שודדים ממנו את היקר מכול, את שׂרידי משפחתו, את ילדיו.
מדברים בהגיון וההגיון הקר צורב. הבנות והבנים זקוקים לבית-ספר ובבּוֹדַאיק
אין תיכון, אין אפילו בית-ספר עממי. גִיזֶלָה דאגה לכל צורכי הבית: למזון,
לחינוך הילדים, לבגדים. היא נתנה את ההוראות למבשלת ולאומנת. והוא שלט
בחנות, דאג לפרנסה. היא פינקה אותו. זִיגמוּנְד מבין בעסקים, אבל ענייני
משק הבית הם ממנו והלאה… כן, הוא זקוק בדחיפות לאשה חדשה, שתשתלט על
העניינים ותהיה אם לילדיו.
הוא נרתע מהמחשבה: היום קבר את אשתו וכבר חושב על אחרת תחתיה?! רגשי האשמה
שברו את הקליפה הדקה של שליטתו העצמית ופרץ בבכי, ביללות. ריחם על היתומים
ועל עצמו. ידע שלא ימרוד במוסכמות, לא ישׂא אשה עד תום שנת האבל… עבר את
גיל החמישים. מי תרצה להינשׂא לו, לאב של שישה ילדים בכפר נידח, עם חנות
מכולת קטנה? עולמו התמוטט. ראה בעיני רוחו את גיסיו הטובים כזאבים, הטורפים
את בשׂרו ודמו, את ילדיו.
*
אִילוֹנקָה אַדלֶר עמדה לסיים את השנה האחרונה ללימודיה בסמינר למורות.
הנערה השקטה והצייתנית הסתגלה בקלות לאווירת המנזר. צעדה בראש מורכן בשביל
בין הברושים. מַאטֶר צֶ’רְנִי, אם המנזר, התבוננה בה מחלון חדר המורים.
– “נערה נפלאה! – העירה לפַאטֶר אֶנגֶלהַארְט, מבלי להפנות ראשה אליו –
תהיה מורה מצויינת”.
– “נכון – אמר הנזיר. היה הגבר היחידי במנזר האחיות, כי רק גבר רשאי לנהל
את המיסה היומית – חבל שהיא יהודיה”…
– “כיצד תגיד דבר כזה? – התרעמה ראש המנזר – אל תיכשל בשׂנאת יהודים!”
– “חלילה, מַאטֶר צֶ’רנִי – הצטדק. – התכוונתי לומר כי לולא היתה יהודיה,
ודאי היתה מצטרפת למסדרך”.
האווירה המסתורית של המנזר, הפרוזדורים המהדהדים, הקשתות הגותיות של אולמות
הלימוד וריח הקטורה עוררו באִילוֹנקָה געגועים לשלווה, ולהשלמה עם הסבל.
היא הבינה כי התא המשפחתי התפורר. ההגיון אמר גם לה, כי אין דרך אחרת
והילדים צריכים לעבור לוספּרים. אבל מדוע הפקירו את אבא! נכון, הגיסים
רוצים לעזור לו. אבל הוא גאה, המתעקש לעמוד על רגליו. השפיע עליו חבר
נעורים, שימכור את החנות, יסע לבירה ויעבוד שם בבנק. מאז הרגישה אִילוֹנקָה
את יתמותה שבעתיים.
נֶלִי ובעלה עשׂו הכול כדי שהבנות תמצאנה בית חם. האֵם העקרה הקדישה את כל
אהבת לבה לבנות. אַרמִין לא חסך מרץ וזמן וישב אתן שעות ארוכות להדריכן
בשיעוריהן. אִילוֹנקָה ראתה הכול בעינים פקוחות: כולם רוצים בטובת בני
אַדלֶר ובטובת האב, ובכל-זאת קורה משהו נורא.
חלום מפחיד פקד אותה לעתים מזומנות. היא שטה בסירה עם הוריה באגם הקטן של
בּוֹדַאיק. סערה קמה לפתע, הסירה נוטה הצדה ואמא נופלת למים, אבא מזנק
להצילה והגלים הגדולים מרחיקים אותו במהירות. סירות קטנות באות מהחוף ובכל
אחת דוֹד אחר: הדוֹד אַרמִין, פוֹלִי, נתן וטוֹנִי… כל הסירות רודפות את
אבא. הדוֹדים קוראים לו, אך הוא רוצה להציל את אמא מבין הגלים… לשווא.
אבא שׂוחה-בורח אחוז פחד מפני רודפיו ונבלע במערבולת… אִילוֹנקָה התעוררה
בצעקה חנוקה אחרי החלום, כולה זיעה. שכבה פרקדן וחשבה. כיצד נאה לסיים את
החלום. הפתרון היחיד, אשר נראה לה, הוּא לקפוץ לאגם הסוער, להתאחד עם זכרה
של אמא ועם אבא, אשר נעלם מן האופק. לא רצתה להיאחז בסירות הדוֹדים הטובים,
אפילו קרים המים והרוח צולפת.
התלמידות היהודיות המועטות לא חוייבו להשתתף בשיעורי הדת הקתולית, אך
הנזירות ראו בעין יפה אם נשארו בכיתה והקשיבו. אִילוֹנקָה נשארה, כי רצתה
למצוא חן בעיני פַאטֶר אֶנגֶלהַארְט, מורה הדת ויועצה של אֵם המנזר. הנזיר
סיפר בקולו הערב על הנוצרי, שמת על הצלב כדי לכַפֵר על חטאי בני-תמותה.
– “עלינו לקבל את הייסורים ברוח נוצרית, בענווה, כאדוננו ישו המשיח. כי
ייסורינו באים מידי שמיים והם גמול מועט על חטאינו, שחטאנו ביודעין ובלו
יודעין נגד הזולת ונגד צווי אלוהים”.
אִילוֹנקָה ישבה בשורה אחרונה. צלב תלוי היה מנגד, מעל הלוח. דמותו של
הנוצרי, מגולפת בשנהב צהבהב, התפתלה בייסוריה על הצלב השחור. ראשו שמוט
הצדה, כתר קוצים זהובים פצע את מצחו, פניו מביעות סבל אין-סופי ושלווה
אלהית.
– “אנו אוהבים את הגואל – המשיך הכומר – כי במותו הושיע אותנו”.
בתום השיעור קרא לה:
– “אַדלֶר! אני רואה אותך בשיעורי, אם כּי אינך חייבת להשתתף. קראתי בתווי
פניך את האמונה ותהיתי, מדוע לא תבואי אלינו, אל אורה של האמת, האהבה
והרחמים? האם חשבת על כך?”
אִילוֹנקָה עמדה נדהמת נוכח השאלה הישירה, שממנה חששה כי תבוא באחד הימים.
– "" פַאטֶר אֶנגֶלהַארְט – השיבה תוך היסוס – חשבתי על כך פעמים רבות.
שלוות המנזר היא כמזור לפצעים, ומי מאתנו אינו פצוע? אבל החומות גבוהות
ומנתקות את העולם השליו שכאן מהעולם האמיתי הסובב, הסוער והגועש. כל
עולמי-שלי הוא שם, מעבר לחומות. כאן מלמדים את סיפורו של השומרוני הטוב.
בעולם האכזר מהעבר השני חסרים שומרונים טובים. אני מכירה שם אומללים רבים,
הזקוקים לעזרה ולרחמים"".
האב אֶנגֶלהַארְט הביט בה בצער. היא ראתה רק עכשיו, כי עיניו אפורות וקרות
כפלדה. הוא ליטף את פני הנערה. היא נרתעה. צמרמורת עברה בגופה למגע ידו
הלחה, כאילו נגעה בה לטאה. כבזק הבריקה במוחה המלה: גבר! גם הוא גבר ובגדי
הנזיר אינם אלא אחיזת עיניים. פחד אחז בה ויצאה בחפזון מהחצר.
– “מה הריצה? – פערה עיניה הגדולות אחותה בְּלַנְקָה, שחיכתה לה בשער המנזר
– אחותי השלווה ממהרת?”
– “כלום לא קרה. שׂוחחתי עם פַּאטֶר אֶנגֶלהַארְט ולא רציתי לעכב אותך, לכן
מיהרתי”.
– “דווקא היום אין לי זמן. אני רוצה להחליף בגדים, עד שיגיע אֶלמֵר” – אמרה
בלנקה.
– “באמת, בלַנקָה! לא חשבת שקצת מוקדם בגילך להתעסק עם בחורים?”
– ""למה? אולי הוא אינו לרוחך? – שאלה בשמץ של שחצנות – אסתגר כמוך? לא
ארקוד? לא אבלה? אמנם, אני תלמידה של נזירות, אבל איני מתכוונת להתנזר
מתענוגות החיים… ובכלל: מה דעתך על אֶלְמֵר?
– “אין מה לומר – הרהרה אִילוֹנקָה – משפחת אַלטשטֶטֶר היא משפחה מהוגנת,
אבל…”
– “אבל לא די מיוחסת? זאת רצית להגיד? – התפרצה אחותה – משום שאביו פונדקאי
בן פונדקאים, המשרת איכרים שיכורים?”
– “ראי בלַנקָה, בּני משפחת פִּילִיץ הם כולם אינטלקטואלים: רופאים,
עורכי-דין”…
– “ידעתי, שכך תחשבי! ומה היה סבא שלך? פרוון! ואשתו? בת פונדקאי. ואבא
שלנו? חנווני כפרי. עכשיו תגידי שלדוֹד אַרמִין שתי דיפלומות והוא למד
בכוחות עצמו… אני יודעת! ומה עשה אֶלמֵר? גמר תיכון, שירת בפרשים, למד
בכוחות עצמו רפואה וטרינרית. ראי שאין פסול באבא החנווני שלי ואין פסול
באבא הפונדקאי שלו!”
בלַנקָה השתתקה ונעצרה מללכת. סובבה אליה את פני אחותה בשתי ידיה. פקחה
לרווחה את עיניה השחורות מול אִילוֹנקָה, עד אשר שתיהן פרצו בצחוק. בדרך זו
היתה מסיימת מְריבות עמה מאז ומתמיד.
– “הגידי את האמת – ביקשה לפייסה – היד על הלב, מה דעתך עליו? ואל תספרי על
אבא שלו. מה דעתך עליו? נכון שהוא חתיך?”
– “נכון. גזרתו דקה, שערותיו בהירות, עיניו כחולות. בכל-זאת בקשי ממנו
שיקצץ משהו משׂפמו… כדי שלא ידגדג”. – אִילוֹנקָה חייכה בביישנות, אחותה
צחקה בקול רם.
*
הבית החדש של אַרמִין פִילִיץ, מול תחנת הרכבת, ברחוב הורדים, המה לקראת
החתונה הכפולה של שתי הבנות.
אֶלמֵר, בנו של קַארְל אַלטשטֶטֶר, בעל הפונדק, נמנה זה שנים עם באי הבית.
ידידות התפתחה בינו לבין אַרמִין בדרך הטבע, כמו בין שני יהודים בעלי אותו
מקצוע בעיר. בתחילה שׂיחק “הדוֹד אֶלמֵר” עם מַגְדָּה, הבת הקטנה, אבל
במהרה התברר, כי הסיבה העיקרית לביקוריו היא בלַנקָה היפה והחטובה. הוא
הוצב בשירות המדינה בכפר מרוחק. שם עבד והמתין לכלתו, שתסיים את לימודיה,
כאשר אֶלמֵר ביקש את ידה, לא הרגישה אִילוֹנקָה הבוגרת בנוח:
– “את תעזבי את הבית בשעה טובה ואני הבוגרת, בת עשׂרים ושלוש, אשאר”…
– “אין זה סוף העולם – חיבקה אותה אחותה – תמצאי את בן-זוגך. דעי שאין איש
מאשים אותך, שדחית את הזיווּגים, שהציעו לך עד עכשיו”.
– “חיכיתי לאביר חלומותי – העירה אִילוֹנקָה במרירות. – לאביר חלומותי,
שמעולם לא חלמתי עליו. לאמיתו-של-דבר, נוח להיות רווקה. לא חסר לי גבר. אבל
איזה מין בחורה נשארת בבית, כאשר אחותה הצעירה מובלת לחופה? ודאי מכוערת,
בלתי-נסבלת, משעממת. איך שלא יהיה, היא מקשה על הוריה. מה תגיד דוֹדה
נֶלִי, אם ישאלו אותה בחברה?”
– ""היא תאמר את האמת, שאת מתוקה ויפה ממני, טובת לב ובת-שׂיחה מרתקת, מורה
בחסד, אוהבת בני-אדם והכול אוהבים אותך. אני נוקשה לפעמים, אומרים עלי אולי
בצדק, שאפילו שתלטנית… איני מתחנפת ואיני רוצה לנחם אותך, אבל זו האמת.
– “אני חושבת בכל-זאת – אמרה אִילוֹנקָה אחרי הרהור-מה – שאתחתן עם לַאנְג
האלמן”.
– “את אוהבת אותו?”
– “אהבה? איני יודעת בדיוק מהי. אני מחבבת אותו. אדם נחמד, מחונן בהומור
טוב ובעל משׂרה מכובדת בשירות הדואר. העיקר, שבתו זקוקה לאהבת אם. מי כמוני
מבינה לגורלה”…
בלַנקָה הופתעה:
– “חשבי פעמיים, אִילוֹנקָה! אל תינשׂאי מתוך רחמים. אל תרחמי על האלמן ועל
היתומה ואל תתחשבי במה שתגיד דוֹדה נֶלִי לחברותיה. חשבי הפעם על עצמך, כי
מדובר בחייך!”
– “חשבתי על הכול, יקירתי, אני בטוחה בעצמי. אביא תועלת ולא אכביד על שום
איש”.
שני זוגות ישבו בראש שולחן סעודת הכלולות. המוזמנים הזינו את עיניהם בשתי
הכלות הזוהרות. איש לא הבחין מי מבין השתיים בוכה תוך אושר ומי מתוך עצב
וחרדה.
 
דמדומים אדומים
בתחילה השתתקו הפעמונים.
הפעמון הגדול הורד יחד עם שני הפעמונים הקטנים ממגדל הקתדרלה שבמצודה.
החבלים התנדנדו מיותמים. חלל ריק נשקף מהחלונות. גם מגדל כנסיית הנזירות
התרוקן. אפילו “פעמון נשמה” קטן לא נותר בעיר. ענבלו הדק לא ילַווה עוד
בצליל מתיפֵחַ את הנפטר בדרכו האחרונה. הסירו מחומות הגימנסיה את המְצילה
הקטנה, אשר הזכירה מדי בוקר לתלמידים רשלניים, כי קרבה ובאה שעת פתיחת שערי
ה“אַלְמַה מַאטֶר”.
אזרחי העיר ליווּ בעצב את קרונות המשׂא אל תחנת הרכבת. לשווא קושטו הסוסים
בסרטים צבעוניים, לשווא הונפו דגלים בתהלוכה. המסע עבר לפני ביתה של נֶלִי.
היא הצטרפה מתוך סקרנות לאנשים, המצטופפים ליד הפסים. רכבת משׂא ארוכה
המתינה על המסילה. פעמונים מכל הסוגים הונחו בקרונותיה הפתוחים. כלי נחושת
קטנים נערמו בקרונות הסגורים, תרומות התושבים: מכתשי מטבח, דוודים כבדים
ואפילו כפתורים.
ראש העיר ניצב על במה וספד לפעמונים.
– “כל עוד לא יבואו הרוצחים השפלים על עונשם, לא יצלצלו הפעמונים בעירנו –
דקלם בקול רועם – נשותינו לא תכתושנה קפה במכתשי נחושת, עד אשר יביאו
חיילינו האמיצים את הנצחון… לכן קרא מלכנו האהוב ועל כּן הקרבנו כל חפצי
ארד ונחושת למען יציקת קני תותח… הפעמונים קראו לתפילה ובגלגולם החדש
יביאו את השלום!”
תזמורת מכבי-האש פתחה בנגינת שיר לכת. “מַארְש רַאדֶצקִי” מתאים להזדמנויות
כאלה, כי הלחן העליז מעורר חיוך. אולם הפעם איש לא חייך. עובדי המסילה
שחררו את הבלמים, הקטר נשף בכבדות, זרועות הפלדה השחורות חרקו והניעו את
גלגלי הענק.
נֶלִי ניגבה דמעות מעיניה. התעצבה כל-אימת ששמעה נגינת כלי נשיפה. סלדה
מצלילי חצוצרות, רעדה מנקישת נעליים ממוסמרות של גדודי חיילים על אבני
הריצוף הדרכם לתחנה. נרעדה ממראֵהם של קרונות מקושטים, עמוסי בחורים,
הנוסעים לחזית ושירה בפיהם. הפרחים התקועים בכובעיהם הזכירו לה את הרומאים
העתיקים, שעיטרו בזרים את הבהמות בטרם העלון קורבן לאליליהם.
