,Title,Translator,Lang,Author,Text
0,בצל המצודה,,,חיים חרמש,"
לזכר אמי, שלימדתני אהבת אבות



 
הקלף
מי שלא ראה כיצד נולדים העננים הלבנים יבוא השכם בבוקר ביום קיץ שכזה להרי
הבּאקוֹן ויביט באדים, העולים לאט-לאט מבין צמרות יער הליבנה והאלון.
מתרוממים כפקעות של פוך לבן מקרעי ציפיות ירוקות של כרים נפוחים.
בבוקר שכזה של חודש אוגוסט ירד משה פּיליץ מהגבעה הקירחה וצעד מזרחה, מול
השמש. צללית המצודה של העיר וֶספּרֵים הצטיירה מנגד, על רקע השמיים
התכולים-בהירים, על חומותיה ומגדליה. עלה לקראתו בשביל רועה צאן מזדקן בראש
עדר כבשׂים. הרחלות נראו רזות יתר-על-המדה בלי פרוות הצמר שלהן. נגזזו לא
מזמן. נעצר ההונגרי בצד הדרך, נשען על מקלו והסיר כובעו השחור רחב התיתורה:
— “בוקר טוב, אדון פיליץ הצעיר. מה מעשׂיך בשעה כה מוקדמת בהר-ירושלים?”
ענה מה שענה על ביקור קבר אביו. שאלות טיפשיות צצו במוחו לפעמים בבקרים
בהירים כאלה, חידות שטרם הטרידו אותו, שנראו בעבר כמובנות מאליהן: מדוע
נקראת הגבעה, שעליה בית-הקברות היהודי, דווקא בשם הר-ירושלים? לא ידע.
אביו בא לוספּרים לפני כעשׂרים שנה ומשה אז ילד קטן. הם השתקעו בעמק
בּוּהִים, הוא עמק הבוֹהֶמִים-הַצֶ’כִים, שבו התיישבו היהודים, אשר באו
ברובם ממוֹרַאביה ושׂפת דיבורם צ’כית. הם התגוררו על גדות נחל שֵד, זה שמו
ההונגרי של הפלג הצלול והקר, העובר בדהירה לרגלי צוק המצודה. למלה “שֵד”
אין כל פירוש בשפה ההונגרית. אולי העניקו לו היהודים שם עברי? השֵד זורם
אמנם בעונה זו במהירות, אך מימיו מועטים. ראשיהן של אבני קרקעית מבצבצים על
פניו ויוצרים מערבולות קטנות. כמה סירות-נייר ורפסודות-קש השיט על גבו כאשר
היה ילד. הלא חלם על מרחקים, על נהרות רחבים ועל ים פתוח. לא ידע מעולם מה
גורלם של מי הפלג: המגיעים הם לים או נעלמים אי-שם בביצות? איך אפשר לקרוא
לפלג דליל שכזה “נחל שד”? לא ייאמן, כי הפלג יעשׂה מעשׂי שדים בעת הפשרת
השלגים ויעלה על גדותיו ברעש גדול, ישטוף אז רחובות, ירטיב את קירות הבתים
ויאיים על התושבים. ערוצו הצר והעקלקל עלול להיסתם בשברי ענפים ובאבני סחף.
יהודי העמק היו רצים אז בגשם השוטף, בסערה, כדי לפרֵק את מחסומיו ולהחזיר
את מימיו לאפיקם.
השד היה רק אחד ממכות עמק בוהים. המצודה מבִיטה מראש הצוק על יושבי הבקעה.
צופה עליהם מחלונות הארמון. עינו של בעל הקרקעות, אדון האזור, הבישוף. הוא
אשר הביא הֵנה את היהודים הראשונים, הוא אשר טיפח אותם ומגן עליהם תמורת מס
מגן. הבישוף ופמליתו גרים בארמון המהודר. הם מצדדים ביהודים, בייחוד
בסכסוכיהם עם האצולה ועם הבורגנים שבעיר. כך מבטיח לו הבישוף בעלי-ברית
נאמנים, המשמשים גם שוט בידו מול המעמדות השאפתנים. אם תתנגד גילדה כלשהי
לרצון הבישוף, יקבלו יהודים רשיון לעסק מתחרה. אם יסרב אציל כלשהו לשלם את
המגיע לכנסייה הקדושה, ימצא במהרה כי אין קונה ליבולי שׂדותיו. הצוק מגונן
על יהודי העמק ומאיים עליהם. מי-השופכין של העיר העילית זורמים במפל מצחין
לבקעה. התושבים חפרו תעלות להוביל את הזוהמה הזאת אל זרמי השד במקום שם
עברו כבר המים על-פני בתיהם. השתדלו לשמור על צחות המים לכביסת בגדיהם ליד
גשר העץ. מי הביוב פרצו לעתים מדפנות התעלה ועד סיום ביצוע התיקון צפו
שיירי מזון וצואה תחת הגשר. לאחרונה שוּפצו וחוזקו חומות המבצר. חצבו
הבנאים בסלע, פירקו קטעי קיר עתיקים וגרמו למפולות אבן ואדמה. רק בעזרת האל
לא נפגע איש, אבל לרכוש נגרם נזק כבד האסון עלול לפגוע בשוכני העמק בכל
רגע. לכן אוסרות האמהות על זאטוטיהן להתקרב אל רגלי הצוק, לא-כל-שכן לטפס
ולחדור אל המערות שבמורדותיו.
משה עבר בגשר העץ החורק. צעד ברחוב המאובק, נהנה ממראה העיר המעוררת. בלטו
משכנות היהודים בגגות הרעפים האדומים לעומת כיסוי הקש המשחיר של בתי
הגויים. משה גר עם אמו ואחיו במבנה קטן. אביו המנוח, ר' חננאל, זכה בדירה
זו מידי פרנסי הקהילה. בני פּיליץ היו צריכים לנטוש את העיר לאחר פטירת
האב. חדל ראש המשפחה לשרת בקודש, חייבים בני-ביתו לעזוב את בניין הקהילה
וממילא את וספּרים. כבודו הגדול של הרב חננאל ז""ל עמד לאלמנה וליתומים:
הפרנסים המשיכו ושילמו משׂכורת מלאה לאלמנה, כאילו עובדת הקהילה היא ולשכת
הבישוף התעלמה מהרמיה. מותו של הבישוף היה מסַכן את עצם קיומה של המשפחה.
לכן נעשׂו מאמצים מצד הפרנס אהרן וייס — סוחר תבואות מכובד — כדי לזַכות את
משה במעמד חוקי וקבוע. סוף-סוף, בתום שנים של שתדלנות, הוזמנו הפרנס ומשה
לארמון הבישוף אשר במרומי המצודה.
אהרן וייס לבש גלימת משי שחורה, נוצצת. כולו אומר כבוד, שיקול-דעת ועושר.
משה הצעיר נטה להשמנה. כּרסו בלטה מעט מעל רגליו הקצרות והמוצקות. עיניים
חומות, ערות ומרצדות הסתתרו בפניו הבשׂרניות. צווארון צח של כתונת פשתן
בצבץ מתחת למקטורנו החום. מסגרת לבנה זו הדגישה את אודם לחייו שופעות
הבריאות.
הם עברו בשוק הירקות, ההומה מרוב אדם באותה שעה. איכרים פרשׂו על הארץ
ערימות בצל, שום ופאפריקה אדומה-חריפה. נשים ישבו בין סלי ביצים ותרנגולות
קשורות רגליים. השניים פילסו דרכם ביניהם בנועם. בירכו את הכפריים ואת
הגברות העירוניות בניב הונגרי כפרי או עירוני — כל אחד לפי טעמו.
צריח דק כסיכה התרומם מעל שער המצודה, זכר לשלטון התורכי. בימים הרחוקים
ההם שימש המגדל את מואזין המסגד. עכשיו הוא נקרא “מגדל האש” על שום
שממרפסתו העגולה מזהירים צופי האש את אזרחי העיר בראותם עשן של שׂריפה.
עברו בשער החומה ועלו ברחוב הצר, המרוצף באבני בזלת מרובעות. חלפו על-פני
חזית ארמון הבישוף, כי טרם הגיע מועד הפגישה. חבורת נזירים צעדו בתהלוכה
לכיווּן הקתדרלה ונרות דולקים בידיהם. הצטרפו אליהם בדרכם פרחי-כהונה,
נערים בגלימות שחורות. חצר הגימנסיה שתקה בשממונה: חופשת הקיץ בעיצומה.
אהרן ומשה הגיעו לסוף הרחוב. הביטו מעבר החומה, החוסמת את הדרך, על העמק
המשׂתרע לרגליהם. בתי היהודים לאורך פיתולי הפלג הם כה חלשים, כה זעירים.
אילו גלש אחד הסלעים האדירים, היה מועך בניינים שלמים. גבעת
ה“קַאלבַארִיָה” התרוממה מעבר לבקעה בעלייה מתונה. בפסגתה — צלב גדול
ובשביל העולה אליו — עמודים כמספר התחנות בדרכו של ישו אל הצליבה — זכר
לדרך הייסורים אל הגולגלתא שבירושלים.
— “אנו במלכודת — הפטיר אהרן. — מצד זה מאיימת עלינו מפולת סלעים ומנגד
שׂנאת הנוצרים… בוא, נשוב לארמון, כי הגיעה השעה”.
הבישוף ישב על כס כהונתו. מחלצותיו הלבנות רקומות בחוטי זהב וכיפת משי לבנה
על ראשו. לידו — תרֵיסר עוזריו הבכירים, ה“קאנוֹנִיקִים”, ידעני משפט
הכנסייה. ישב לפניו, ליד שולחן נמוך, מזכירו וממלא-מקומו החילוני,
הפְרֶפֶקְט קִישפַאלוּדִי:
— “הוד מעלתו הבישוף, המבקש לראותך הוא אהרן וייס, פרנס היהודים בעירך”.
— “ומי הצעיר לידו?” — שאל הבישוף.
— “זהו משה פּיליץ, בנו של הרב חננאל המנוח, אדוני”.
— “מה בפיכם, יהודים?”
הפרנס אהרן שטח טענות ותלונות עדתו בנוגע לסבל שסובלים בגין השופכין
והמפולת. הוא ביקש מהבישוף רשות לעבור לדרומה של העיר, לקרבת שוק התבואות.
שם נמצאים מגרשים ריקים בשפע והיהודים לא יפריעו לאיש.
— “דנו כבר בסוגיה — ענה הבישוף. — מצאנו שהדבר אפשרי ואף רצוי לפיתוח
עירנו. נותרה שאלה יחידה: האם תשׂיגו את הסכמת בעלי המגרשים?”
— “כידוע לך, אדוני, המגרשים הם רכושה של משפחת הרוזנים לבית זִי’צי.
ביקרתי ברשותך בטירת הרוזן ואני שׂמח, כי הוא נאות להשׂכיר לנו חלקות אחדות
מאדמתו. הוא מוכן אפילו לבנות לנו בית-תפלה שם, אם תתן רשות לכך”.
— “הרשות ניתנת והישמרו לנפשותיכם!… ומה רצונו של בן הרב? הוא בא בודאי
בקשר לבקשתו לזְכוּת ישיבה וסחר…”
משה הניד ראש לאות הסכמה. הבישוף ציווה על הפרֶפֶקט לקום. קִישפאלוּדי גלגל
ופתח קלף וקרא את תוכנו:
— ""נענים אנו בזה לתחנוניו הנכנעים של היהודי משה בן חננאל, בנו של כבוד
הרב המנוח, אשר בא לעיר אֶפִיסקוֹפאלִית זו לפני עשׂרים שנה. אנו מעניקים
ליהודי משה בן חננאל רשות לבנות בית מגוריו ולעסוק בסחר בעיר זו, ששמה
וספּרים. רשאי יהיה לעסוק בעסקיו כל עוד יחיה בצניעות, ינהג בדרך-ארץ,
ביראת שמיים, וישמע בקול הוד מעלתו הבישוף, הבעלים של חבר-ארץ זה ובקול
פקידיו. והיה אם יתנהג בניגוד להוראותיהם, אזי יגורש בבושת פנים מן העיר,
כל רכושו יוחרם וישוב לבעלות אדון האדמות.
נחתם לעדות בחותם הבישוף בחתימת-ידו של הפרפקט בעיר וספּרים, ביום 31 לחודש
אוגוסט בשנת 1811"".
הטקס תם. משה קיבל לידו את הקלף והודה לבישוף. כהן הדת הרים את ידו בכוונה
לברכו בסימן הצלב, אך נרתע, כי נזכר שהמדובר ביהודי. לכן הושיט לו את אבן
האודם הגדולה שבטבעת הזהב על אצבע ימינו. משה אחז ביד המושטת, קד קידה, אך
לא נשק לאבן כדרך הנוצרים.
השניים ירדו בחפזון מהמצודה ומיהרו לביתו של הרב אריה פוּקס. יצא הרבי
לקראתם והזמינם פנימה. תלמידי ישיבתו הצטופפו בחדרו לאורך הקירות, בין
מדפים עמוסי ספרים.
— “הבישוף הסכים — נשם הפרנס לרווחה — נתן הסכמתו, שנעבור לאזור כיכר שוק
התבואות, אם הרוזן זיצ’י יאות יאות להשׂכיר לנו את מגרשיו. עלינו לסיים כעת
את העיסקה…”
— “אם ירצה השם — נאנח הרב — נתגבר גם על זאת… ומה אתך, משה? התוכל
להישאר עמנו?”
— “רק על תנאי, ר' אריה, על תנאי — השיב משה — מותר לי לבנות בית, מותר
לפתוח חנות, אם אנהג לפי רצונו של בעל המאה, שהוא בעל הדעה ובכל הסמכות…
כך כתוב בקלף”.
“האם יקשה עליך לנהוג ביושר, בענווה וביראת שמיים, כפי שנדרש ממך?” — התערב
הפרנס אהרן.
— “הבינו — קולו של משה רעד — לא מדובר בקלף בחוקים של אלוהים או של
בני-אדם. כאן דובר בכללים, שבישוף זה או אחר יקבע לפי רצונו. אם אני
ובני-ביתי לא נציית או שמא לא נהיה מסוגלים לציית, אזי יופקר פרי עמלנו
בידם, נצטרך לנדוד ולחפשׂ מולדת חדשה… שהותנו הותרה פה רק על תנאי”…
הרהר הרבי בדברי הצעיר ופנה אל תלמידיו, אך למעשׂה השיב למשה:
— “כאשר נתן הקדוש-ברוך-הוא את עיר קודשנו ירושלים בידי אספסיינוס הצורר
והגלה אותנו מאדמתנו, הוא רצה להשמיד את עמו הבוגדני. סובבוהו מלאכי השמיים
והתחננו לפניו: — ‘אל נא באפך! הרי בניך הם אף-על-פי שפשעו. תן להם סיכוי!
אל תגזול את תקוותם!’ נעתר אלוהים לבקשה ומאז חיים אנו על תנאי, כנדונים
למוות המיועדים לגרדום, אך בלבנו שביב תקווה לזכּות בחנינה”.
משה יצא מבית הרב מהורהר ותוהה: למה נטל ממנו הבורא את היכולת לשׂמוח בלב
שלם? הוא פנה אל ביתו ומחק מעל פניו את הקַדרוּת, כי רצה לשַׂמחַ את אמו
בבשׂורה הטובה.



*
ביום הראשון לחודש ספטמבר השכּים משה לקראת חיים חדשים. לא יהיה עוד משרתם
של אחרים, אלא יבנה בעצמו את עתידו, יבסס ויבטיח את בטחון משפחתו.
עננים כבדים האפילו בשמי הבוקר. השמיים הקודרים נגדו לחלוטין את מצב-רוחו
המרומם. בכל-זאת נאלץ להתחשב באותות הגשם. לכן נעל מגפיים גבוהים
קשוחי-עור, דחס בהם מכנסי צמר שחורים ולבש מעיל קצר בעל צווארון פרווה, חבש
כובע רחב-תיתורה, המסתיר את הכיפה הקטנה שעל ראשו, אחז במקל טיולים ויצא
לדרך.
שביל צר הוביל בין בתי עמק בּוּהִים לבין אפיק הפלג. הוא צעד מול כיווּן
הזרם, בעלייה. תרמיל הבד, התלוי על כתפו השׂמאלית, התחכך במותניו והפיץ ריח
ניחוח של אווז צלוי, צידה לדרך מתבשילי אמו. התכוון לתור את הכפרים במשך
יומיים או שלושה ולחפשׂ אחרי סחורה, המבוקשת בעיר. ודאי ימצא משהו: אולי
פרי, אולי עורות, מעשׂי קַדָרוּת או יין. יביא אותם לשוק, יפקוד פתחי בתים
של אצילים ובורגנים ויציע מרכולתו… עד אשר יצבור ממון ויבנה ביתו, יפתח
חנותו…
שורת הבתים היא דלילה יותר כּכל שמתרחקים מהעיר, המבנים נעשׂו דלים יותר,
רעועים יותר, כאילו עייפו במסעם עד הלום. החצרות גדלו. אסמים התרוממו
במרחבים שבין הבתים, כן גם גדרות לצאן וסככות לפרות. רוח פרצים קרירה נשבה
מולו מהבקעה הצרה והביאה על כנפיה רעש גלגל העץ של טחנת מים. זו היתה
הגדולה והאחרונה בין טחנות הקמח במעלה נחל השֵד. אבקת כסף של רסיסים ניתזה
לרגלי מבנה העץ, אשר רכב בשתלטנות על הזרם הגועש.
נעצר משה לרגע ונזכר כיצד העריץ בילדותו את סייחי הבישוף. אבא, מנוחתו עדן,
נזף בו: — אל תתנהג כמו גוי! לא נאה שילד יהודי יתבונן במלאכה פראית של
אילוף סייחים!"".
משה אהב עד שגעון את מראה המאבק בין הסוסון הצעיר אוהב החופש לבין רצונו
הנחוש של האדם להניח אוכף על גבו, להכניעו. זמנים חדשים באו: לא את הסוסים
בלבד רותם האדם לעגלתו, אלא גם את המים. מי הפלג מניעים את אבני הריחיים,
מספּקים כוח לבעל הטחנה, משרתים את בני-האדם, הצוברים ממון.
השבילים משולים לפלגים. הם נשפכים לדרכים. הדרך זורמת לה ונושׂאת על גבה
פרשים ומרכבות, עגלות משׂא ודואר. היא תתרחב כדרכי המלך הסלולות ותֵיעָצר
במאגר, ששמו עיר. המשעול הצר הסתיים והצטרף לדרך-עפר רחבה. אורנים גלשו
מהמורד הימני וביניהם צוקים לבנים. עצי אלון כיסו את ההר משׂמאל. בדרך —
אדמה שחורה ובה עקבות מטושטשים של חישוקי עגלות, אשר עברו כאן תמול-שלשום.
בלטו בעיני משה עקבותיו של סוס משתולל, שהסתובב וחזר כלעומת שבא. התבונן
בסימנם וקרא בהם, כפי שלמד בילדותו במגרש הסייחים: סוס צעיר, בלתי מפורזל,
התרחק בדהירה אל הבקעה.
ענן שחור כיסה לפתע את פיסת השמיים בין צמרות העצים. טיפות שמנות של גשם
נטפו וציפורי היער נאלמו דום. משה הגביה את פרוות צווארונו, פן תירטב.
התכנס בתוך עצמו והחיש את צעדיו.
יריה פילחה את מסך הגשם וההד החוזר הגביר את הרעש שבעתיים. הוא סטה מן הדרך
וניסה להסתתר מאחורי גזע של אורן, ללא הצלחה. גופו השמנמן נותר גלוי לעיני
הפרש, שדהר לקראתו. רזה היה הרוכב ופרוע-שׂיער. בימינו אקדח רחב-קנה מעלה
עשן ובשׂמאלו גרזן נחושת דק, קליל וחד כתער. מושכות הסוס תלויות בזיז האוכף
והוא מכוונו בדורבנות מגפיו.
— “אל תעיז לזוז — איים — לא תימלט מידי!”
השניים ניצבו עוינים וזרים כשני עולמות רחוקים. פני משה האדומים הביטו בזר
בשלווה מהולת חשדות. הפרש הרזה ניער את תלתליו הרטובים מעל עיניו הגדולות
והשקועות. לחייו השחירו מזיפי זקנו. בתנועה מהירה קרע את התרמיל מכתף
קורבנו ופתחו.
— “זה כל מה שיש לך? — שאל בקורטוב של בוז — חבל היה לבזבז עליך אבק
שׂריפה… איזה מין יהודי אתה?!”
עיני הפרש נפקחו לרווחה, מבטו ננעץ בצלי, שבצבץ מתוך מפית אדומה והוא נשם
את הריח לעומק ריאותיו.
— “איזה מין שודד אתה — התחצף משה — עיניך יוצאות מחוריהן ובכל-זאת אינך
תוקע שיניים בעוף…”
— “אמת. שודד אני — הזדקף האיש — אבל איני נבל צבוע. לא איש כמוני יגזול את
צידתו של ההולך ביער. דע מול מי אתה עומד: שמי שׁוֹבְּרִי יוֹשְקוֹ…”
הצעיר קפא במקומו אחוז פחד. מעשׂיות אין ספור סופרו על הארכי-ליסטים
שׁוֹבְּרִי. דמותו הצטיירה כאגדה. אמהות הפחידו את ילדיהן בהזכרת שמו, ומשה
חשב לעתים, כי אינו קיים, אלא שייך לעולמם של הדרקונים ורוחות הרפאים.
שׁוֹבְּרִי סימל את הפשע בעיני העשירים וייצג את הנקם-ושילם בדמיון
האביונים.
— “ואם אכבד אותך בפת לחם ונתח אווז, התקבל אותם מידי?” — שאל משה.
— “בוא!” — ציווה השודד ורחב לפניו בצלע ההר התלול.
הטיפוס הִקשָה על היהודי. בקושי רב צעד בעקבות הסוס. אילו רצה, היה יכול
להתחמק, אך סקרנותו דרבנה אותו להגיע לפיסגה. שוֹבְּרִי קשר את סוסו אל אחד
הגזעים.
— “כאן ביתי. היכנס!” — הזיז הצידה ענף מוריק של שיח.
מערה חשוכה פערה את פיה. הקיש אבן צור בפלדה והצית אש בזרדים יבשים. להבות
המדורה הרקידו צללים על קירות מפוייחים, כאילו אלפי נחשים מתפתלים ומנסים
לברוח מפני האור המתגבר. ארגז עץ גס שימש שולחן ולידו חביות אחדות למושב.
— “שב — ציווה על אורחו — שב ונאכל!”
פרשׂ משה את המטפחת האדומה על השולחן ובמרכזה נתגלה האווז הצלוי, הריחני,
בכל תפארתו. גם לחם שחור הוציא מהתרמיל והניחו על-יד הצלי. השודד התמקם
בנחת נוכח הסעודה ושפשף ידיים מיובלות. שלף סכין ארוכה וחד ממגפו. הרים
אותה בתנועה אטית, כעורך טקס נורא של עובדי אלילים, וקירב את הלהב אל פני
משה:
— “זו סכין הנקמה שלי. השמעת עליה? — הצעיר הנהן בראשו לאות הסכמה. — שמעת
ואינך רועד? אינך מזיז עפעף?”
— “אילו פחדתי — השיב בשלווה ומצמץ בעינים קטנות ושובבות — אילו רעדתי,
הייתי מנסה לברוח…”
— “כולם רועדים מפני — קולו של שׁוֹבְּרִי רעם, אך נחלש לפתע, כמו נשברה
כנף הנץ במעופו — לכן בודד אני פה בהרים”.
השניים שקעו בתאוות האכילה. הליסטים קרע בפראות את גפי העוף מגופו וטיפות
שומן ניגרו מאצבעותיו. היהודי השתדל לשמור על נימוסי שולחן והתבונן באיש
הרזה בפליאה מהולה ברחמים.
— “אתה מפורסם — הפר את השתיקה בתום הסעודה — חוטא בעיני החוק, גיבור בפי
העם ואגדה לכּול. רבים מהיושבים למטה בכפרים מקנאים בך, באומץ לבך ובכוחך”.
שוברי חילץ את פקק הצפחת שבידו. לגם יין מכלי העץ המגולף והושיטו לאורח:
— “לקינוח. האווז רוצה לשׂחות”…
צחוקו הדהד בין כותלי המערה. נכנס היין היבש החריף — יוצא סוד — הרהר משה
והחזיר את המשקה לבעליו. ההוא לגם לגימה ארוכה ומבטו המעורפל גילה דברים
מופלאים מעבר לעשן המדורה שעה ארוכה ישבו בדממה. לפתע החלו לבקוע המלים
מפיו בזרם הולך וגובר, כאילו רצו לצאת מזמן מעומק נשמתו. החוויות הצטופפו
בקרבו כלַבּה בּלב הר געש וחיכו בלחץ ובלהט להזדמנות לפרוץ.
— “שמעת בודאי שקרים על-אודותי. אתה הראשון בין קורבנותי זה חודשים, שלא
פגעתי בו, כי איני פוגע באביונים כמוני. ומלבד זאת יש לי חולשה כלפי יהודים
עניים…”
לפתע אורוּ פניו. הקמטים החליקו מעט וחיוך דק וביישני הופיע בזווית פיו.
