,Title,Translator,Lang,Author,Text
שאינו נראה בחשכה, אלא הזיקים והרשף. כאילו חגיגה של זיקוקין די נור…”
– “רומנטי מאוד – פלט שלוֹטמַן. – חבל שלא הייתי אתכם”.
– “שוטטנו בין משׂרפות הסיד – המשיך מַרקוּס בהתלהבות – ולפתע שמענו שירה.
קרבנו למבנה והנה פועל זקן הוּצב שם לשמור על האש בלילה. ליווה בחלילו את
קולה הצלול של נערה יפהפיה, אולי בתו, אולי נכדתו. פניה האדימו לאור להבות
התנור, צמותיה זהרו כשיבולים בשלות. שרה להנאתה על יער על איילות ועל
ציפורי-שיר, הפורחות באוויר”.
– “מה שמה? – התעניין יֶגֶר. – מה סיפרה לכם?”
– “לא שאלנו אותה, אפילו לא התקרבנו. הסתתרנו בין השיחים והאזַנו לזמר.
חששנו שהחזיון יימוֹג, אם נתגלה”.
– “איך זה – הרהר שטוּרְם – שיהודי רגיש כל כך ליופי? לי היה נדמה שדתכם
מחייבת קפדנות אכזרית. הֶגֶל לימד, כּי אמונתכם כאילו הוטלה עליכם מבחוץ
ואתם משועבדים לאל אחד, מלאכותי, זר לטבע אנוש”.
– “אילו היה דוִד עמנו – ציין מַרקוּס – היה חוזר על הדברים שאמר לי שם,
ביער קוּפֶנִיק. הבטנו בזיקים החיים, המתנוצצים בשמיים כהים והאזנו לשירה
האלוהית. אז הוא פנה אלי וציטט את הֶגֶל: ‘מהות היהדות היא הבנת
ההתבוננות’. עלינו, על היהודים, לראות ולשמוע את הנברא ביד אלוהים, כי כל
היקום הוא יחידה אחת, גוף ונשמה, חומר ורוח. המוצא את סוד ההרמוניה בין
מרכיביו יקרב את הגאולה”.
– “יפה דרשת, ידידי הצעיר – הנהן שטוּרְם. – תלמיד נאמן אתה לדוִד פִילִיץ.
תקפתי בהֶגֶל ואתה עומד בפרץ ותורת הֶגֶל נשקך”.
– “ברִידֶנדוֹרְף זללנו פירות – המשיך מַרקוּס וקרץ בעיניו לשְלוֹטמַן השמן
– נהנינו ממראֵהם של מבנים עתיקים… וממראֵהן של שתי בנות צעירות…”
– “אל תגיד – קנטר יֶגֶר – שדוִד שׂם עין לבת! לא כך הכרתיו!”
– “צדקת – חייך מַרקוּס. – אבל דוִד אינו בוחל ביופי הנשי ואפשר לומר
שאפילו נהנה ממראֵהן של יפהפיות, אם כי לא יותר מזה”.
– “הוא כנזיר קתולי – הפטיר שטוּרְם – אינו כמונו, תלמידי לוּתֶר, שאין
מתנזרים מאשה”.
*
מַרקוּס שקע בלימודים במשך החורף. האביב של 1846 הסעיר את רוחו. ברח בבוקר
חמים וזוהר מהכרך לגני שֵינהַאוּזֶן, טבל בניחוח המשכּר של הפרחים וכתב
לחברו:
דוִד יקירי,
לא הייתי מסוגל לכתוב לך זמן רב. אלוהים עדי, שלא היתה לי סבלנות. הדיבוק
נכנס בי ואין בכוחי לגרשו. רוחי סוערת ואילו יכולתי, הייתי קורע עולם
ומלואו לגזרים. אני כועס ורותח. לולא התביישתי, הייתי פורץ בבכי ואילו
הזלתי דמעות, הן היו אדומות, כי לבי זב דם מרוב רחמים לגורל האנושות
האומללה.
אולי תחייך: למה מתאבל בחור צעיר על תבל כולה? ייתכן שטיפשי מצדי ואין
בכך תועלת, אבל איני משתחרר מהתחושה הנוראה, שהחברה האנושית הולכת
לאבדון. העולם אינו משתחרר ממשפטיו הקדומים ונמק בכלוב, שבנה לעצמו במו
ידיו. החברה נוחה מדי ורקובה מכדי לנפץ את אזיקיה. בשעת חסד מאירה התבונה
מטרות נשׂגבות ואנו מגבילים בכל-זאת את עצמנו באלפי איסורי שמרנות
ומסורת. מודעים למשׂימה והופכים אותה לבלתי-אפשרית.
כולי רעד בעת כתיבת שורות אלה. מחשבות רותחות-מבעבעות בתוכי, כלַבָּה
במעמקי הר געש. אתה חסר לי מאוד, ידידי! בוא, שוב אלינו לברלין! אני זקוק
לחבר, שיהיה עם מי לחלק את סבלי. למי אפנה כאן? ליֶגֶר המזוקן? ‘כל מפקפק
וחסר אמונה – אמר לי – ימצא נחמה ומזור בתנ""ך’. שלוֹטְמַן השמן? ‘חפשׂ
סעודת מלכים, – זו עצתו – כי היא מקור החיים הטובים. מטעמים וריקודים
נותנים כוח להתגבר על המרה השחורה’. אולי שטוּרְם הנוצרי יהיה עוזרי?
מוטב שאעמוד מול פסל שיש אילם ואתחמם בחום רוחו של האמן היוצר. האמנות
בלבד מסוגלת להלהיב אותי כיום. מלבדה, שעמום ואדישות סובבים אותי מכל
צד… רוחך הסוערת חסרה לי מאוד.
התרצה לשמוע במה אני עוסק? רציתי להתמסר ללימוד העברית, אבל דשדוש במלים
יבשות מרחיק אותי מהבנת האדם, תכלית חייו ומטרת קיומו. אני מחפשׂ את האמת
הכוללת ולא אחת מתייאש. מהפכנים בוגדנים מייאשים אותי, למשל זה אשר כתב:
‘לב רקוב ושׂכל רפה למהפכנים, הם מאמינים בנסים ומטיפים לרעיון, שאינו
ניתן להגשמה’… או אחר, שהגדיר את המהפכה הצרפתית כאפיזודה עצובה
בתולדות האנושות ותו לא.
חיפשׂתי את שלוות נפשי בספרות היפה. קראתי ב’רשימותיו של בּוֹז',
הומוריסט אנגלי חדש ומבריק, המשׂרטט ביד אמונה רגעים מחיי היום-יום.
חיפשׂתי משהו רציני מאותו מחבר עצמו ומצאתי את ‘סיפורי חג המולד’. מסתבר
ששמו האמיתי צַ’ארלְס דִיקֶנס. הספר יפה לזקנים ולילדים. מתאים לקריאה
בערבי חורף לחיזוק לבם של בנים ובנות, החוששים מרוחות רפאים ומנשמות
המתים… אולי זקוקים בני-תמותה לרוחות נקמנים, כדי לעוררם מתרדמתם.
ספר אחר, שממנו נהניתי באמת, עסק בתיאור מצב היהודים בארצות השונות.
צורתו רומן – יצירת מופת, המעידה על חכמת המחבר וידיעותיו הרבות בדרכי
העולם. כמדומני, הסופר הוא יהודי אנגלי, בלתי מוּכּר בינתיים, שמו
ד’יזרַאֶלי. יצירתו ‘קוֹנִינְגסְבִּי או הדור החדש’ ראתה אור בלונדון
לפני שלוש שנים בלבד. חיפשׂתי משהו אחר מפרי עטו ומצאתי את ספרו האחרון
‘טַאנְקרֶד או מסע צלב חדש’. קצה נפשו של הגיבור בריקנות ויצא לחפשׂ את
שורשי החיים (כמוך כמוני). איפה? בנופי הבשׂורה האלוהית, בסיני ובארץ
ישראל… אתה חייב לקרוא בספרים אלה! איני מסוגל כעת להתמיד בלימוד מקצוע
אחד. אני אדלג מנושׂא לנושׂא, מבלשנות לפילוסופיה, מספרות לגמרא. אספר לך
יותר, כאשר תשוב אלינו לאחר שתשׁבע על שולחנם של גדולי תורת הנסתר.
דרוש בשלום אביך ר' יואב הדיין ונצל זמנך לתועלתך.
שלך,
מַרקוּס
את קורות השנים הסוערות תיאר לידידו דוִד מגלותו בלונדון:
בברלין התלבטתי: האם אהיה מסוגל לשרת כרב, כפי שרציתי בתחילה? האם עלי
ללַמד או לדרוש דרָשות? להורות דעת או לצווֹת דרכי אמונה והתנהגות? פעמים
רבות נרתעתי בדרכי ובסוף הגעתי למסקנה: זנחתי את התלמוד ואת הפוסקים
והתמסרתי לבלשנות המזרח. הוסמכתי על בסיס מחקרי על-אודות תרגום ערבי
לעיקרי האמונה של הרמב""ם. בציונים מצויינים הוסמכתי ללמד בתיכון. ודאי
הייתי זוכה במשׂרה טובה, לולא היתה פרוּסִיָה כל כך נוצרית ואני כל כך
יהודי. אבל לא אני ולא פרוּסִיָה איננו ניתנים לשינוי מהותי. על כן חשבתי
על פרנסה עצמאית כלשהי… ואז בא אביב העמים של 1848. איפה אני ואיפה
הלימודים? ברחתי מהעבר האפור ויצאתי לאור הלוהט של ההוֹוה. זרקתי את
כתבי-היד המאובקים והחלפתי אותם בעִתונות התוססת.
האמן לי, כי פעלתי כמיטב יכולתי. כתבתי מאמרים בעתונות היומית, התרעתי,
הלהבתי… עד אשר נחשבתי בקיץ 1848 כּ… רֵיאַקצִיוֹנֶר. התדע מדוע?
התנגדתי להשתלטות הרחוב על עסקי המדינה. תקפתי בסאטירה ובסערה, כי המאבק
הרעיוני חייב להתנהל בבית-הנבחרים. גורל המדינה יוכרע בין צירי העם
הנבחרים ולא בצעקות ומהומות ההמון משולהב ברחוב. צדקתי: הרחוב שׂיחק את
השלטון לידי המלוכה. אחרי אוקטובר העצוב של וִינָה באה אותה הפיכה עצמה
לברלין שלי בנובמבר. נציגי העם גורשו בכידוני רובים מהיכל הדמוקראטיה.
קולות המרי נדַמו ואני התעוררתי לפעולה המחודשת. פרסמתי מאמרים נגד
הכניעה והתוצאה לפניך: אילצו אותי לברוח ללונדון הערפילית.
שׂמחתי לקרוא שביקרת בפַּאדוֹבָה, נהנית מזיו שמשה של לוֹמבַּרדִיָה
ובעיקר מפגישתך עם לוּצַאטוֹ. על מה שׂוחחתם? מה תכניותיך לעתיד?
שׂיחק מזלי וזכיתי לעבודה מכובדת וּמשׂכּורת צנועה. אני מזכירו של ד""ר
אַדלֶר, רבה הראשי של בריטניה. הוא שמרן, אך אינו מכריח את בני קהילתו
להחמיר. מאחד את בעלי ההשקפות השונות בסבלנות ובסובלנות. הפקיד בידי את
חינוך ילדיו ובכל-זאת נהנה אני מחופש מוחלט בהשקפותי.
לבסוף אני מודה לך על השיר ששלחת לי. כשרונותיך הפוֹאטיים מעוררים בי
כבוד וקנאה. הזכרת לי את ימי נעורינו, את הנוף ואת הלבטים בגני
שֵינהַאוּזֶן…
*
מַרקוּס מיהר לביתו, גדוש חוויות. הרגיש צורך לשפוך לבו במכתב לידיד נפשו,
דוד.
לונדון, אוגוסט 1850
יקירי, ימים רבים דחיתי תשובתי לך ולא מחוסר נאמנות. הרהרתי רבות בלבטיך,
אך אני בעצמי הייתי מדוכא ולא האמנתי שאוכל לעזור לך. על כן חיכיתי עד
אשר אוכל לכתוב משהו מעודד על-אודותי.
סוף-סוף אני נושם לרווחה במטרופולין זה, אחרי שנים של לחם צר ומים לחץ.
הוזמנתי אל ראש וראשון לאילי ההון בממלכת בריטניה, אל לַאיוֹנֶל לבית
רוֹטשִילְד. עלי ללמד את בניו ולהדריכם במדעי היהדות. ודאי תתפלא, כיצד
אני המהפכן מסוגל לשרת משרתם של מלכים. תקוותי שטרם איבדת את חוש הביקורת
ועדיין לא נכנעת להכללות רדודות. אמת: לַאיוֹנֶל הוא עשיר, אך עושרו אינו
מונע ממנו תרבות, הגינות והזדהות עם עמו הנרדף. כאשר דיבר אתי על עיסוקי
בביתו, הבחנתי אצלו הבנה עמוקה וחכמה. אמרתי בגלוי מי אני ומהן השקפותי.
הוא חייך: ‘ידעתי עליך הכול ואני מכבד את יושרך. גילית את עברך ואת
דעותיך למרות הסכנה, כביכול, שלא תזכה במשׂרה, איני מעוניין שעבד נרצע
יחנך את ילדי’… עליך לדעת, כי לַאיוֹנֶל הפגין גאווה יהודית קבל עולם.
נבחר לפרלמנט כציר הסיטי ולא הורשה לתפוס מקומו בבית-הנבחרים, כי
סירב להישבע אמונים בנוסח הנוצרי המקובל. אשתקד נבחר שנית וגם הפעם לא
נשבע. רוֹטשילד דורש את שינוי נוסח השבועה בחוק, כדי שגם יהודי ירא שמיים
יוכל לייצג את בוחריו בבית-המחוקקים.
אני עצמי סבלתי קשה לאחרונה ועד היום לא השתחררתי ממצב-רוח ירוד. לך אוכל
לגלות הכול, אין אני צריך להתבייש לפניך בגלל חולשותי. מוטב שתכיר אותי
גם במצב זה. נחם אותי בצר לי, נזוף בי אם מגיע לי ועודד אותי בנפול רוחי.
חיצי קוּפִידון פגעו בלבי ולא נשׂאו מור משכּר, אלא רעל. שמע קורות אהבתי
האומללה וכתוב לי דעתך.
ידוע לך שהתייחסתי בשוויון-נפש למין החלש עד כדי כך שרבים ראו בי נער,
אשר טרם התבגר. עזבתי את ברלין וכאן בלונדון הכרתי בת למשפחה יהודית.
הצעירה עוררה את הערצתי, בעיני נראתה כהתגשמות השלמות, אינטליגנטית,
אמיצה, עדינת נפש. ידעת שאני ביקורתי בגישתי לכול, גם לבני-אדם. הפעם קהו
חושי, לא שלטתי בעצמי, נשלטתי על-ידי רגשותי. חוויה חדשה של אושר בלבלה
אותי.
הורי הנערה ביקשוני להדריכה בספרות. במרוצת השיעורים הובהר שהקליפה
הנוצצת ונימוסיה הטעו אותי. תחת הציפוי לא נמצא תוכן. חסרו לה עומק
המחשבה, השקפה בסיסית ואמיתות הרגש. בינוניות מחרידה באיצטלת היופי הנשי.
עד היום איני מבין כיצד נכשלתי. איני מבין איך ייתכן שהיא המשיכה לרחף
לנגד עיני כדמות נערצת, גם לאחר שגיליתי את טעותי המרה, התרגשתי כל-אימת
שפגשתי בה. מאבק אכזר התיש את כוחותי: מאבק בין הרגש וההגיון. קרב זה,
ככל קרב, השאיר אחריו אדמה חרוכה ופצעים עמוקים, הזבים דם עד היום.
הסתרתי את רגשותי לפניה, אולם הסתבר (דווקא בעת שכבר החלטתי לנטוֹש
אותה), שאהבתה התעוררה כלפי. מצפוני מייסר אותי על האכזבה, שגרמתי לה.
האמן לי, דוד, איני רוצה לפגוע בה, אך לא אהרוס את עתידי.
הוקל עלי שחילקתי עמך את המעמסה. אתה, המכיר היטב נפשו של אדם, עוצה לי:
האין עלי להינתק ממנה?
תיארת במכתבך את הבעיה שלך בצבעים עזים. לדעתי, אין היא כה חמורה, כפי
שנראית בעיניך, גבר בעל רצון כמוך מסוגל לממש שאיפותיו, תהיינה אשר
תהיינה. עשׂה כפי שתמיד הצעת לי: תחליט ותרכּז כל מרצך למען יישׂום
החלטתך.
עזבת את ברלין, את הכרך התוסס ונסעת לברֶסלַאוּ. סעדת לבך על שולחנם של
מקובלים. התעמקת בתורת הנסתר, אך גם רזי ספר הזוהר לא הביאו לך שלווה
ורגיעה. מי כמוני יבין לרוחך הסוערת והמתלבטת. אמרתי להיות רב, כמוך,
ונרתעתי. אני שומר את חירותי הרוחנית מכל משמר ואשמור אותה עד יומי
האחרון. אכן, אני מבין להתלבטויותיך.
שאלת, מה דעתי על רצונך ללמוד רפואה. ‘איך אוכל – שאלת במכתבך – לשוב
ולחבוש ספסל לימודים בגיל שלושים?’ עונג מפוקפק בגילך הוא לשבת מול
מורים, המדגישים מטבע הדברים את עליונותָם. אך אם תרצה, אני משוכנע שתהיה
רופא מעולה. אבל אנא, שקוֹל מחדש בטרם תחליט, שמא ישובו פקפוקיך וייפתחו
מחדש הפצעים הישנים.
האם נחושה התנגדותך לכול? או שמא רק לפסיקות הפוסקים המקצועיים אינך
מסכים? אם אתה מאמין בעומק לבך בישות האלוהית, במעמד הר סיני ובחמישה
חומשי תורה – די בכך שתהיה רב. תורת משה היא קרקע פוריה, הכה בה שורשים,
תפריח פרחי נחמה ותאסוף צאן מרעיתך בצל צמרת חכמתך. יהודים כה רבים
זקוקים למורה-דרך כמוך!
אם בכל-זאת תגיע למסקנה אחרת, היה רופא. אסוף פרוטותיך, סע לפַאדוֹבָה
ולמד מֶדִיצִינָה. המרפא אדם הוא מציל לא את גופו בלבד אלא גם את נפשו.
אני בטוח שתהיה רופא מעולה בשירות האל ובשירות האדם הסובל.
ידידך לנצח
מַרקוּס

 
שתי חופות
לא מכרו יין באותו יום קיץ בשנת 1853 בבית-המרזח של פליישמן בפַאלוֹטָה.
בכל-זאת נתמלאה המסבאה מפה לפה. הפונדקאי הזמין את שכניו, ידידיו ולקוחותיו
לכלולות בתו הַאנִי עם בחיר לבה מוֹרִיץ פִּילִיץ הפרוון.
מי שלא מצא מקום באולם הצטודד בכיכר השוק. משרתים ומלצריות מזגו מהיינות
הטובים ביותר, שנאגרו אי-פעם במרתפי האב המאושר. יינות ממורדות הר
הבַאדַצ’וֹן, אשׁר שם הבשילו ענבי זהב בשמש הלוהטת. הגפנים העמיקו שורש
בקרקע של לבּה כבויה וינקו טיפות בדולח, המחלחלות מקרקעית האגם. כוכבי
השמיים נדלקו מעל בעת השקיעה. אלפי נרות דלקו בחלונות הבתים סביב הכיכר.
השכנים האירו את חדריהם, הפונים אל בית פליישמן, סימן להשתתפותם בשמחת האב
הקשיש.
דוִד פליישמַן האלמן עייף ממעמד החופה ומאורחים, התבודד בבוא הערב למנוחה
קצרה עם אבי החתן, הדיין יואב. גם מחותנו הזדקק למנוחה. מחלת הקצרת התגברה
בחום הלח של תחילת הקיץ והקשתה על נשימתו. בכל-זאת התאמץ והמשיך בשׂיחה:
– “אשרַי שזכיתי בשׂמחת כלולות לעת זיקנה. מי כמוך יודע, ר' דוִד, כי לזקן
כמוני טוב לדעת, כי הבן מצא שידוך טוב. הַאנִי שלנו כה יפה, כה בריאה! ודאי
תתברך בבנים רבים”.
– “שׂמחתך שׂמחתי, ר' יואב – פליישמן ליטף את זקנו הלבן. – אבל למה תֹאמר
כך, כאילו מוֹרִיץ הוא הראשון מבניך, שנשׂא אשה? אם איני טועה, בכורך נשׂוי
ואף בן נולד לו”.
– “איך אסביר לך? דניאל הוא בני הבכור ובנו הוא נכדי הראשון. אמת ויציב. אך
איני בטוח, שהם מרגישים כך. זהו סיפור עצוב על בחור חריף, כשרוני, ממש
עילוי, אשר יצא לתרבות רעה, אולי גם באשמתי. אמו נפטרה בעודו קטן ולא
השׂכלתי להביאו לידי הבנה עם אשתי השנייה, עליה השלום. נבחר בסופו-של-דבר
לרב בעיר סֶגֶד, אוי ואבוי לרב שכזה! מעין ‘רַבִּינֶר’, חצי יהודי, חצי
גוי. לא הסתדר אפילו עם היהודים המופקרים שם. עזב או גורש מן העיר. איני
יודע בדיוק… לא מספרים לי, מרחמים עלי… אולי מוטב כּך. לשווא ניסיתי
להשפיע עליו שיתרחק מסכנות הפוליטיקה. לא הצלחתי. דניאל שלי גדל ושנים לאחר
שעזב את ביתי הסתבך עם קוֹשוּט, עזר לו עד הסוף המר. המרד התמוטט, הוא ברח
עם האשה ועם הילד ומסתתר עד היום הזה…”
– “אבל מהאחרים שׂבעת נחת. לא כן?” – ניחם אותו ר' דוִד.
– “יש לי עוד שניים מלבד מוֹרִיץ הטוב, החרוץ והנאמן. הם מבריקים, שני
הדוקטורים”.
– “כיצד קרה, ר' יואב, שאף אחד מבניך אינו ממשיך בדרך אבותיו? הם בני יואב
הדיין, נכדי הרב חננאל עליו השלום ואין ביניהם אפילו רב אחד!”
– “מלבד מוֹרִיץ רצו כולם ללמוד ולהיות רבנים. דניאל אפילו הוסמך
בפרַאנקפוּרט. בעקבותיו הלך דוִד ויצק מים על-ידם של גדולי תורה וכן עשׂה
הצעיר בהם, בֶּנוֹ. אבל שניהם שינו דעתם משום מה ונעשׂו רופאים. אני יכול
רק לנחש את הסיבה: שמעו רבות על אבות-אבותינו, ששמותיהם מופיעים בקלף מגילת
היוחסין שבביתנו. סביב כל ענף וכל עלה נרקמו אגדות אין-ספור. שניים מהם היו
רופאים מפורסמים בארץ ספרד בימים הרחוקים ההם”.
– “מי היו השניים, ר' יואב?” – “אחד שֵשֶת בן יצחק איש בַּרצֶלוֹנָה, תלמיד
חכם ואיש אשכולות, עלה לגדולה בחצר המלך אַלפוֹנְסוֹ כרופאו ואיש-אמונו.
נשלח בשליחות אדונו אל מלך מרוקו, כיוון שדיבר בשׂפת ערב. בבקיאותו בלשונות
יוון ורומי תרגם ספרים רבים עבור המלך. סוּפר על ד”ר שֵשֶת, כּי השליט חש
פעם כאב בלבו, ובסבלו כי רב, התחנן לרופאו שיקל עליו בכל מחיר. תרופותיו
ומרקחותיו של שֵשֶת לא הועילו, ‘דון אַלפוֹנְסוֹ אמר למלכו: – לא מצאתי פגם
בגופך. דומני שמצפונך מייסר אותך עד כדי סיכון חייך. הלא עוול נעשׂה
בממלכתך. אתה יודע על כך, מחריש ולכן סובל’. נדהם המלך והודה, כי נערה
יהודיה נחטפה לטירתו של אחד מאביריו. הוא ציווה מיד לשחררה ולהחזירה לחיק
משפחתה. אַלפוֹנְסוֹ העניש את החוטא כדין, הבריא וחי באושר שנים רבות…
נינו של אותו ר' שֵשֶת, שמואל איש טַארַאגו­ֹטה, שירת כרופא בחצר המלך
פֶּדְרוֹ. אולי האגדות הביאו את בֶּנוֹ ואת דוִד מהישיבה אל אולמות
האוניברסיטה… נו, די בסיפורים! בוא, ר' דוִד, נתבונן בזוג הצעיר""…
שני הקשישים עברו לחדר רחב-ידיים, מלא חוגגים. גלגל-עץ ענקי תלוי ממרכזה של
התקרה ועליו נרות דולקים סביב-סביב. ריח עשן, יין וזיעה עמד בחלל. תזמורת
צוענים ניגנה בקצב מסחרר. הכנר הראשון משך קשתו בכוח ובעצבנות. בלוריתו
כיסתה את עיניו השחורות. פניו האדומות של נגן הקלרנית, צועני נמוך ושמנמן,
התנפחו ברוב מאמץ. איש הקונטראבאס רזה, גבוה, ידיו נעו באיטיות. דמויות
מוזרות, בלתי-מציאותיות, כאילו קמו לתחיה מאגדות-עם. נגינתם הסוערת ספוגה
בקורטוב של עצב. המנגינות המתוקות נמהלו בטיפת מרירוּת, מרירותו של הנווד,
המתגעגע לחיי יציבות מתוקים.
מוֹרִיץ החתן לחש משהו לאוזני הכנר, שהחל לנגן צַ’ארְדַאש. האורחים נסוגו
לאורך הקירות. החתן רקד עם הַאנִי היפה את ריקוד הכלה. כבד ונמוך רקע
ברגליו לקצב המוסיקה והעלה אבק מרצפת העץ. היא קלה ורוחפת, נגעה-לא-נגעה
