,Title,Translator,Lang,Author,Text
מדינה יהודית שאינה קיימת כלל, משחרור קוֹמַארְנוֹ בידי ההונגרים, ההולכים
ומתחזקים בזירה הבינלאומית?”
– “לתנועות המהפכניות הגיון משלהן – ניסה מִיקִי להגן על עמדתו – ההונגרים
אולי ישתלטו על קוֹמַארְנוֹ בעזרת היטלר. אבל לי ברור כשמש, כּי לא יחלצוּ
את לֵיאוֹ מצרותיו ולא את שאר היהודים… צדקת שאין עדיין מדינה יהודית
בפלשׂתינה, אבל היא תקום אם היהודים ירצו לבנות אותה. אולי לא בדור שלנו,
אך אי-פעם תהיה למציאות ותשחרר אותנו מתלות בעמים אחרים. אתם מדברים בשם
המציאות וצוחקים לי, לרודף חלומות. בסדר! המציאות היא, שאבא סוגר את דלת
התא, פן ישמעו את שׂיחתנו. המציאות היא, שהמשפחה מפוזרת על-פני כל היבשות:
אחות של אבא בדרום-אפריקה, דוֹד לַאסלוֹ מחפשׂ נפט במקסיקו, מַגדָה מהגרת
לברזיל, פִּילִיץ אחד באנגליה, שני בארגנטינה… זוהי המציאות של משפחה
אוהבת ומלוכדת. תודה! אני רוצה להאמין בחלום שלי, כי הוא יפה יותר”.
הרכבת נבלמה בטלטול עז בתחנה הקטנה של מַארְצַאלִי. הבלמים חרקו, פגושי
הקרונות הצטלצלו ואדים עייפים פרצו מדוּד הקטר.
*
הטבחית הגישה ארוחת ערב במרפסת רחבת-ידיים. אֶלִיזַבֶט השכיבה את בנה. ערב
קריר ירד וגירש אותם אל תוך הדירה. התכנסו בחדר עבודתו של אֶלמֵר והשׂיחה
נסובה על הדור הצעיר.
– “מתי תתחיל להתכונן לבחינתך במשפט הרומי? – שאלה בלַנְקָה את ג’וֹרְג'. –
הזמן חולף ואסור לך להיכשל”.
– “עלי להלחין קודם יצירה ולאחר-מכן לכתוב פַּארטִיטוּרָה לתזמורת קמרית –
ענה הבן המבוגר באי-נחת מופגנת – המשפט הרומי לא יברח”.
– “שכחת את ההסכם שלנו – הביט בו אביו. – הסכמנו שתלמד ניצוח וקומפוזיציה
בבודפשט ותמורת זאת תגמור חוק לימודיך במשפטים. ייתכן שאתה עושׂה חיל
בענייני המוסיקה, אבל נכשלת בדיני רומי”.
– “כי אני אוהב את המוסיקה, אבא – ג’וֹרְג' סיפר בקול עמוק ומתנגן –
המנגינות פורחות מהראש, לכן אני חייב לרשום אותן מיד. ספר החוקים הרומי
קיים אלפי שנים, הוא יחכה לי”.
המתח גבר והחבילה עמדה להתפרק.
– “בואי, אֶוָה, לחדר שלי – הציע מִיקִי – אראה לך את הספרים החדשים”…
בית נמוך עמד בקצה הגינה, לרוחבו של המגרש ובו מוסך מרכבות, אורווה ושלושה
חדרים בודדים. החדר הקיצוני שימש מקלט למִיקִי. ריהוטו – מיטת נחושת
מבריקה, שולחן פשוט, כיסאות וארון ספרים. אֶוָה ומִיקִי התבודדו לעתים
קרובות בחדר זה לשׂיחות ארוכות אל תוך הלילה. ההבדל בגיל ניכר ביניהם: היא
למדה כלכלה באוניברסיטה והוא סיים עתה את השישית בתיכון. בכל-זאת מצאו תמיד
נושׂאים לשׂיחה.
– “הגידי – שאל הבחור – את מרוצה מהלימודים? את מעוניינת באמת בכלכלה?”
– “לא, משעמם לי – השיבה בחיוך מר. – אבל מה אעשׂה? אין לי עניין מיוחד
בשום מקצוע. ג’וֹרְג' נלחם על המוסיקה שלו. אותי שכחו המוּזוֹת. אבא הציע
כלכלה, אמא הסכימה, נתקבּלתי לפקולטה. אז מה יש עוד לעשׂות? להיכנע… נראה
אותך בעוד שנתיים! מה תעשׂה אחרי הבגרות?”
מיקי התאנח:
– “הייתי רוצה להיות רופא וטרינרי, כמו אבא או הדוֹד אַרמִין. אבל זה לא
ילך”.
– “לא ניסית בכלל וכבר מוותר?”
– “חשבתי לעזור לחיות, שאינן מסוגלות להסביר מה כואב להן ואינן יכולות לבקש
עזרה”.
– “נפש רומנטית! – צחקה אֶוָה – אתה מת לבוסס בזבל, להתגלגל בעגלה בלילות
חורף לחווֹת נידחות. כל זאת מתוך רחמנות לתרנגולות בטרם צולים אותן. אמור
לי, המהפכן, למה תוותר מראש?”
– “אבא והדוֹד אַרמִין עורכים לי שטיפת-מוח. הם ממליצים שאהיה רופא, כי
חייו של וטרינר קשים וגם לא כל כך מכובדים. בכל-זאת הייתי עומד על דעתי,
אבל כבר מזמן אין אף יהודי אחד בפקולטה. חוק ‘נוּמֶרוּס קְלַאוּזוּס’ היה
מאפשר, אבל הסטודנטים הגזענים הציקו והרביצו, עד אשר היהודי האחרון עזב
לפני שנים. חוק לחוד ומציאות לחוד”.
– “אם כן, מה תעשׂה? תהיה רופא?”
– “אני רוצה לעבוד בחקלאות, לחיות עם חברי לתנועה ולהגר לפלשׂתינה. אני
אומר זאת השכם והערב, אבל הורי מתעלמים מדברי”.
– “ובכן, תהיה רופא או לאו? ענה!”
– “לא. אולם אם אבא יתעקש, אגיש בקשה להתקבל. ידחו אותי ואז אהיה חופשי
לעשׂות כרצוני, מבלי לפגוע בו. מה דעתך? האם גם הורינו נאלצו לעשות דברים
שלא רצו? האם גם הם דוכאו בידי אבותיהם?”
– “ודאי – פני אֶוָה ביטאו עצב – והם לא למדו לקח. הנכנעים היו למכניעים.
הנה אמא. היא אינה אוהבת את אבא, אבל נישׂאה לו, כי התביישה להישאר בתולה
זקנה. אבא אינו אדם רע, אבל שונה מאמא בהרבה. היתה מתאימה לו בת-זוג עליזה,
בעלת מרץ. אמא היא שקטה מדי ונכנעת. היא נולדה להיות קורבן. הוא משתולל
לפעמים. הכניעה המתמדת שלה משגעת אותו. היא כולה אהבה נוצרית. הוא חריף,
תוסס, כל-כולו יהודי, יהודי מוזר. לקח אותי לבית-הכנסת. הרעש, החילוניות
שבקדושה עוררו בי בחילה. תיארתי לי שבית האלוהים הוא שקט, מעורר כבוד. אבל
מצאתי תוהו-ובוהו, צעקות ויללות. גברים דנים בעסקים, נשים מאופרות מפטפטות.
החזן ממלמל טקסט בלתי-מובן במהירות מסחררת בשׂפה בלתי-מובנת ומתה. אלוהים
בעצמו שכח כבר עברית”…
– “צר לי עליך אֶוָה – מִיקִי הנמיך קולו – כי אינך מבינה מה זה להיות
יהודי”.
– “וכיצד אבין? – כעסה – לפני שנתיים או שלוש ליוויתי את אבא לאחרונה אל
בית-הכנסת בערב יום הכיפורים. התעטף בטלית כרוצה לכפר על כל חטאיו. שבנו
הביתה, התרגז על אמא בגלל שטות, אפילו איני זוכרת למה. השתולל, צרח, העליב
אותה. היא בכתה, כפי שלא ראיתי אותה בוכה מעולם. כל המרירות שאגרתי פרצה
מתוכי. רציתי לנקום בו ובצדקנותו המזוייפת. אספתי מזון ומשקה, הסתגרתי
בחדרי, אכלתי ושתיתי ביום הכיפורים. כתבתי, כתבתי וכתבתי”.
– “מה כתבת?” – שאל מִיקִי, ספק נדהם, ספק משועשע.
– “איני זוכרת, עד כדי כך רגזתי. אולי מכתבים לאלוהים שאיננו או מסה על
הצביעות. היה אתי בקבוק יין, גמרתי לשתות עד לטיפה האחרונה. השתכרתי בפעם
הראשונה בחיי ונרדמתי”.
– “איך סובלת דוֹדה אִילוֹנְקָה מצב שכזה? איך אפשר כך לחיות?” – השתומם
הנער.
– “הרי אמרתי. היא אימצה לעצמה את הכניעה הנוצרית”.
– “את מאמינה – פקפק מִיקִי – שהיא מוצאת סיפוק בסגפנות?”
אֶוָה קרצה בעיניה וחיוך קל הופיע על שׂפתותיה:
– “נדמה לי שיש לה רומן סודי עם מנהל בית-הספר, שבו היא מלמדת. איני בטוחה
אם זה ‘על אמת’ או אַפלטונִי. יהיה אשר יהיה, אני מאחלת לה בכל לבי שתיהנה
טיפה מהחיים המחורבנים האלה.”
– “אני חושב – אמר מִיקִי – כי דור הורינו הוא אבוד”.
– “מה זאת אומרת? איני יורדת לסוף דעתך – עיניה נפקחו לרווחה. – מה פירוש
שהם אבודים?”
– “הם שׂרידים של עולם שוקע. מאמינים בדברים, שמזמן חדלו להתקיים. איפה
העולם היפה שלהם? שמעת, כיצד מזכירים את ימי פרַנְץ יוֹזֶף? מכנים את
תקופתו ‘זמני השלום היפים’. נוסטלגיה עקרה. התרפקות על העבר, הנראה יפה
מבעד ערפל השנים. חולמים על ליברליזם, על שפע ובינתיים הכול מידלדל סביבם,
הכול נעשה אכזרי יותר”
– “אבל הצעירים יותר – שיסעה אֶוָה את דבריו – הסופרים והאמנים חושבים
אחרת”.
– “הבטלנים, הממלאים את בתי-הקפה? עטופי עשן סיגריות מתווכחים עד אור
הבוקר, מנותקים מהמציאות, חולמים בהקיץ, חלשלושים ומבולבלים. הם כואבים את
כאב העולם, אך אינם מסוגלים לעשׂות מאוּמה. בטלנים ואימפוטנטים”.
– “נניח שהניתוח שלך נכון – אמרה בשמץ של זלזול, בסדר! אם כּן, מה תעשׂה?
תסתלק מהעולם הזה, כי אינו מוצא חן בעיניך?”
מיקי השתלהב. עיניו בערו, פניו הסמיקו. לא חש כלל בנעימת הלעג שבדבריה.
– “איש אינו מסוגל להתמודד לבדו עם הסערה הממַשמשת ובאה. הרגשה מוזרה
השתלטה עלי: משהו נורא עומד להתרחש. מעין תחושה חיָתית, כפי שצפרדע חשה
בגשם המתקרב”.
– “…והיא מקרקרת” – צחקה אֶוָה.
– “נכון – הרצין – אני מקרקר וזועק. צוחקים לי, אומרים שאני רואה שחורות,
כי סיוטים רודפים אותי”.
– אתה מגזים באמת – אמרה בקול פייסני. – ממה אתה חרד כל כך?""
– “משגע אותי שאינכם רואים מה מתרחש סביבנו. נוח לכם לדחוף ראשכם בחול,
כמעשׂה בת-היענה, ולא לראות דבר. כל הנשמות האבודות מחפשׂות פתרון. נערים
בלי עתיד ורעבים בלי הוֹוה מגששים באפלה, מושיטים יד איש לרעהו. תנועות
מתגבּשות במחתרת. חפרפרות נוגסות בפקעות ואתם מריחים את הפרחים”.
– “דַבּר ברורות! – רגזה – מה תעשׂה?”
– “הסערות שתבואנה חזקות מהפרט. האינדיבידואליסט יישחק. לכן מתארגנים
הצעירים, מחפשׂים מסגרות ומנהיגים. יש הנשבע על סטאלין, אחרים מעריצים את
מוּסוליני ואת היטלר. מי שרוצה לחיות חייב להצטרף למחנה כלשהו. חייבים
להשתייך”…
– “אז מה? אהיה קומוניסטית? או נאצית?”
– “אנחנו חלשים וחייבים להשתייך למישהו – מִיקִי המשיך, כאילו אינו שומע את
דבריה. – פעם, כילד, רציתי בכל לבי להשתייך להונגרים. רציתי להיות חייל,
קצין. יותר מאוחר האמנתי, כי מקומי עם הפרולטריון. כיום אני יודע, כי אין
לי שותפים כאן. אנו נושׂאים על גבנו מטען כבד של צרות. נוכל לפרוק אותן רק
בארץ-ישראל”.
– “איך תעמוד בשינוי? – הביטה בו בצער – עולם זר, שׂפה בלתי-מובנת, אקלים
קשה, תנאים פרימיטיביים… איך תתגבר?”
– “לא אהיה לבדי, אֶוָה! – זיו של אושר האיר את פניו – רבים כמוני רוצים
לבנות עולם חדש, שבו אין הבדלים ומחיצות”.
– “אוּטוֹפִּיָה! חלומות! – גערה בו – אין ארץ כזאת, אין חברה כזאת!”
– “יש ניצנים. – מיקי השתלהב – דיברתי עם אחד, שבא משם, מהקיבוץ… את
יודעת, מה יפה במהפכה הזאת? יוצרים דבר חדש, מבלי להרוס. לא נכריח אחרים
להשתנות לפי טעמנו. אנו בעצמנו נשתנה. לא נבנה על הריסות, אלא על קרקע
בתולה”.



 
בחזרה לבּוֹדַאיק
המדורה דעכה במחנה הקיץ. גחלים לוחשות האדימו והחשיכו לחלופין. עיניו של
יצחק יקדו. דיבר בקול עצוּר, שלא להעיר את הישנים באוהלים:
– “נפרק את המחנה, אסע הביתה, אגיד שלום להורי ואצטרף לפלוגת הכשרה בעיר”.
– “לא נראית לי הכשרה עירונית – פקפק מִיקִי – סיימת סמינר מורים ותעבוד
עבודה שחורה. לשם מה? הייתי מבין, אילו יצאתם לעבודה בשׂדה. ארץ-ישראל
זקוקה לחקלאים. מה לנו בעיר?”
– “אין עבודות חורף בחקלאות. האם נתפזר וכל אחד מאתנו ישב בביתו עד האביב?
– יצחק שכנע במבטו החודר ובקולו העמוק. – בפלוגה העירונית נלמד עברית,
נעבוד עבודה גופנית ונטעם חיי קומונה. אתה, מה תעשׂה?”
מִיקִי נאנח:
– “איני יודע. הייתי רוצה להצטרף אליכם. בסופו-של-דבר אגיע לארץ, לקיבוץ.
אבל בינתיים קשה לפגוע באבא ובאמא. הם רוצים בכל מאודם שאהיה רופא. אני
מכריז שאהיה חקלאי בארץ-ישׂראל והם בשלהם: ‘קודם תהיה דוקטור. כל רופא
מסוגל לזרוע תפוחי-אדמה, אבל איכר אינו יודע לרפא’. דורשים שאסיים לימודי
ורק לאחר-מכן אבחר דרך חיים ככל שארצה”.
– “הם רוצים. הם דורשים… אבל מה תעשׂה אתה?”
– “הגשתי בקשה להתקבל בפקולטה – מִיקִי השפיל מבט וחיטט בעזרת ענף יבש באפר
המדורה. – בלאו הכי לא אתקבל ואז אהיה חופשי מכל התחייבות”.
– “איזו התחייבות? כי הם חינכו אותך? הם קיימו אותך? – יצחק צחק במרירת –
את החום ואת האהבה, שקיבלת מהוריך, תשיב לילדיך. הילדים הולכים בדרכם ולא
בעקבות אבא ואמא”.
– “אתה מדבר על ילדים. לך יש חבֵרה ולי אין אפילו חבר קרוב. ידיד-אמת אין
לי, רק התנועה: חברים רבים, ולא רֵע אחד. – נזכר בחבֶרתו בהירת השׂער של
יצחק – מדוע לא הבאת את יוֹלִי שלך למחנה?”
– “חלתה בדלקת ריאות ויש לה חום גבוה. המסכנה הפסידה חוויה – הרים ראשו
והסתכל באגם הגדול לרגלי הגבעה. הירח המלא צייר שביל כסוף על-פני הגלים. –
יוֹלִי לא זכתה לראות את הבַאלַאטוֹן… אבל נדבר עליך. מה תעשׂה אם תתקבל
בכל-זאת לאוניברסיטה? האם תעזוב את התנועה?”
– “לא אבגוד, אמצא מוצא. אבל תבין: איני מסגל לפגוע בהורי!”
יצחק קם. מִיקִי נשאר בישיבה מזרחית ולא הרים ראש, כאשר חברו פנה אליו:

“אני מרחם עליך, כי תבזבז את נעוריך. לכל דור חיים משלו. מדוע לא תגיד
לזקן שלך, שהוא כבר חי את חייו ואתה תחיה את חייך? מדוע אין לך אומץ?”

מִיקִי שכב שעה ארוכה באוהלו ועיניו פקוחות. דברי יצחק הצטלצלו באזניו:
“… אין לך אומץ! אין לך אומץ!”
השכם בבוקר העירו אותו בבהלה: “שוטרים שואלים עליך!”
הוא נחפז לאוהל המפקדה, שהוקם בפסגת הגבעה, בין שני תרנים. על אחד התנוסס
דגל הונגרי ועל השני דגל ציוני תכלת-לבן. קצין במדים הירוקים של הז’נדרמריה
המתין לו.
– “בוא, ניכנס לאוהל!” – ציווה על הצעיר.
תיקים נערמו על השולחן המאולתר מלוחות עץ: חשבונות, רשימת משתתפי המחנה,
תכניות של פעולות.
– “במה אוכל לעזור לך, אדוני המפקח?” – שאל.
– “הראה את רשיון המחנה! – הורה בתוקף. – ראש הכפר טוען, כי רימית אותו.
איפה הרשיון?”
הבחור הגיש לו גליון מודפס במכונת כתיבה ועליו שתי חותמות סגולות: של מועצת
הכפר שבתחומו קם המחנה ושל מפקד הז’נדרמריה במקום. הקצין התבונן, השתומם
וקרא ברוגז לסמל:
– “זו חתימת ידך. אתה בעצמך חתמת על הרשיון הזה. אז למה תקשקש, כי הם פה
ללא רשות?”
– “אבל – גמגם הסֵרגֵ’נט – אישרתי מחנה לצופים הונגרים ולא ליהודים!”
– “רמאים! – רעם קולו של המפקח – איך העזתם לכתוב שהמחנה שייך להסתדרות
צופי הונגריה?”
– “אדוני! – גם מִיקִי הרים קול – אל תעליב אותי! כתבתי בפירוש ה.צ.ה.,
ראשי-תיבות של הסתדרות ציוני הונגריה. עובדה, שציינתי את מספר רשיון שׂר
הפנים לפעולת ארגוננו”.
– “ואני חשבתי – הודה הסמל – שאלה ראשי-תיבות של הסתדרות צופי הונגריה
והמספר הוא מספרו של השבט”…
– “אם כך – הקצין קם ללכת – הייתם הפעם בסדר. אבל היזהר, אדוני הצעיר.
היזהר להבא, כי שׂמנו עין עליך!”
מיקי נוכח במהרה. כי הקצין דיבר אמת.
הוא נתקבל לאוניברסיטה, למרות ציפיותיו, והגיע לעיר פַּץ'. חיפש חדר
להשׂכיר ולפנות ערב מצא מקום מתאים אצל מורה בדימוס. בבוקר דפק בעל-הבית
בדלת ובידו מכתב: – “הדוור הביא לך. מעניין, כיצד ידעו את כתובתך?”
על המעטפה צויינו רק שמו ושם העיר, שיש בה כשישים אלף תושבים. צמרמורת אחזה
בו.
–“כל הכבוד לשירתי הדואר!” – הודה בחיוך מאולץ וסגר את הדלת.
בדק את המעטפה בקפדנות. גזר אותה סביב-סביב, הדליק פנס והביט דרך גב המעטפה
בכיווּן האור. ברור: המכתב נפתח. כתמי צל גילו את הדבק הגס, שבו סגרו שנית
את המעטפה. חבר תמהוני שלח שורות ברכה של מה-בכך מהתנועה בבודפשט. אין ספק:
המשטרה בעקבותיו.
באותו יום עצמו החל משׂחק החתול והעכבר בין הבולשת לבינו.
*
משטרת הבירה הזדקקה כנראה להישג כלשהו. שוטרים פשטו על פלוגות ההכשרה
בבודפשט. הדירות ודייריהן נרשמו כחוק במרשם התושבים. עתון מפלגת השלטון כתב
בכל-זאת באותיות קידוש לבנה:
– “קשר ציוני נתגלה. מטרתו להקים מדינה יהודית קומוניסטית בלב הונגריה..
תאי המחתרת הופתעו”…
בתדהמה קרא את שמה של יוֹלי בין העצורים. הסתגר בחדרו, התרכז ושקל בדעתו מה
לעשׂות. ודאי הוקפאה הפעילות הציונית. הכול יתרחקו ממועדוני התנועה
ועורכי-דין יטפלו בשחרור העצורים. ישב לשולחנו ורשם על מעטפה באותיות
גדולות ובולטות את כתובות המוֹען והנמען. היה זה מכתב אל מזכיר ההסתדרות
הציונית בבירה:
אדוני הנכבד,
בהתרגשות קראתי בעתון את ההאשמות הנפשעות נגד הציונות בכלל ונגד החלוצים
במיוחד. אני משתומם, כיצד אין השלטונות מבינים, כי עקרונות תנועתנו
נוגדים את האידיאלים הקומוניסטיים. הרי אנו מחפשים פתרון לבעית היהודים
ומתנגדים להתבוללות האדומה. הציונות היא המחסום היחיד בימים אלה בפני
התפשטות המהפכנות האדומה בקרב הנוער היהודי המיואש בארץ הזאת.
אנא, הבהירו את האמת לאנשי הרשות, ירפּו-נא מהחלוצים הישרים ובל יפריעו
לעבודתנו! אני מבטיחך, שאמשיך בעבודה הציונית להצלת הנוער מציפורני
הייאוש""…
התוצאה לא איחרה לבוא. צעיר יהודי, שנעצר לחקירה בגל המעצרים, שבה בעקבות
האירועים בבירה, סיפר לו:
– “הבלשים שאלו על קשרי עם חוגים שׂמאלניים. רצו לדעת אם אני מכיר ציונים.
השבתי שאתה בין ידידי. הבלש נראה מאוכזב ואמר שאתה בסדר, כי אתה ציוני
נאציונליסט”.
מִיקִי המשיך לפעול בתנועה, לאחר ששוכנע כי לא יסכן את הבאים במגע עמו.
באין מועדון ניצל את חדר האוכל של הסטודנטים להתכנסויות. שם כתב מכתביו אל
חברי התאים, המתארגנים באזור. כדרכו תקתק איגרות באחד מימי האביב במֶנְזָה
בשעות אחר-הצהריים, בשעת סִיֶיסטָה של האזרחים ההגונים. צעיר זר, רזה
ומשׂופם פתח את הדלת.
– “שלום! – בירך בעברית, כדרך חבר תנועה, והמשיך בהונגרית. – התרשה לי
להיכנס? לאיזו תנועה אתה שייך?”
– “איך ידעת – הופתע מִיקִי – שאני ציוני?”
– “הכותב בעת שכל אדם נורמלי נם הוא או משוגע או ציוני”…
הזרות נמוגה בצחוקם.
– “שמי אריה – הרזה הניח מזוודה קטנטנה על הרצפה והתיישב על-ידו. – אני חבר
‘הנוער הציוני’ ואני בדרכי לארץ-ישׂראל”.
– “סתם ככה? – השתומם מִיקִי – עם מזוודה פיצפונת אחת?”
– “איני יודע עדיין איך, אבל אני מאמין שאצליח – וגולל את סיפורו. – עמדו
לגייס אותי לצבא ברומניה. לא רציתי לבזבז את זמני החלטתי לעלות. חציתי
בלילה את הגבול להונגריה, הסתתרתי בבודפשט מפני העין הרעה של הבולשת.
הרווחתי כמה פרוטות לכרטיס, שהספיק עד כאן. התעזור לי להגיע ליוגוסלאביה?”
– “קודם תלון אצלי, תאכל אתי ונשיג כסף מהציונים המועטים, שעמנו פה. אבל
איך תעבור את הגבול? הרי אין לך אפילו דרכון”.
– “אעבור בלי דרכון. גם יהושע בן נון חצה את הירדן ללא דרכון בידו – צחק. –
אמצא לי דרך כלשהי”.
מִיקִי הסתיר את אורחו מעיני בעל-הבית, לבל יסתבכו בצרות. חניכי התנועה
הוקסמו מביקורו של חבר ממרחקים. שמעו בצמאון את סיפוריו ואספו כל פרוטה
