,Title,Translator,Lang,Author,Text
0,ישראל בעמים,,,דוד בן־גוריון,"

וּמִי כְּעַמְךָ יִשְׂרָאֵל גוֹי אֶחָד בָּאָרֶץ?

(דברי הימים א' יז, 21)

כִּי תֹאמַר בִּלְבָבְךָ: רַבִּים הַגוֹיִם הָאֵלֶה מִמֶנִי — — לֹא תִירָא מֵהֶם.

(דברים ז', 17—18)
לא רבים מבין אלה שחגגו בארבעה עשר במאי 1948 הכרזת המדינה — ואלה היו כמעט כל יהודי העולם — הרהרוּ אותה שעה
על הבעיות החמוּרות הכרוכות בהכרזת העצמאות, ועל הקשיים העצומים הצפויים
למדינה הצעירה. אך בעוד צהלת ההמונים נשמעה ברחובות — בקעוּ ברחבי הארץ
רעמי התותחים והפצצות המטוסים של צבאות האויבים שפלשו באותו לילה לארץ. עם
תום המלחמה, כעבור שמונה חדשים, לא חוסלו הדאגות החמוּרות של המדינה הרכה,
אלא נתעוררוּ מחדש: המלחמה נגמרה, אבל השלום לא בא עד היום הזה. החלה
״יציאת־מצרים״ מכל הגלויות המרודות באירופה, באסיה ובאפריקה. מאות אלפי
עולים חסרי כל נהרו לישראל המשוחררת, ובמשך שלוש שנים הוכפל מספר האוכלוסין
של המדינה הצעירה, וצמחו קשיים עצומים בקליטה, בשיכון, במיזוג הגלויות,
בהנחת היסודות לחיי מדינה מתוקנים, ורבים ראו, לתמהונם, כי המדינה לא באה
להקל על חייהם, אלא להפך: היא מטילה עליהם מעמסות נוספות, ולאט לאט החלו
להבין האחריות הכבדה הכרוכה בעצמאוּת היהוּדית והעול הגדול שנטל על עצמו
העם שנשתחרר.
להיות עם אחראי לגורלו, זהו אידיאל יקר שציפה לו העם
היהודי בכיסופין משיחיים במשך עשרות יובלות, אבל זהו גם אידיאל שעולה ביוקר
רב, במאמץ מתמיד ובקרבנות מֵחים. אין מדינה נוצרת על־ידי הכרזה בלבד, היא
מוקמת יום יום מחדש בעמל בלתי פוסק, בעבודה של שנים או גם של דורות. עם
שאינו מוכשר ומוכן לשאת באחריוּת הכבדה של עמידה ברשות עצמו, לא יקיים
העצמאוּת גם לאחר שהשיגה. דבר זה חל על כל מדינה, הוא חל ביתר שאת על מדינת
ישראל. תנאי קיומה של מדינת ישראל, משימותיה הפנימיות והחיצוניות, מעמדה
בעולם, בטחונה ויחסיה עם שכניה נכרכו מראש בקשיים שאין דומה להם בארץ
אחרת.
מעטות המדינות שבטחונן ניתן כמעט מאליו, על־ידי גורמים
גיאוגרפיים. בין המדינות המעטות האלה היתה זמן רב אנגליה: מצבה כאי נפרד
מאירופה הכביד באופן יוצא מן הכלל על כל אויב, ולמעשה לא ידעה אנגליה פלישה
וכיבוּש זר זה כאלף שנים, אבל גם חוסן בטחונה של אנגליה לא היה לנצח עם
הופעת מטוס הקרב כאחד ממכשירי המלחמה העיקריים, גם בטרם היות פצצה אטומית,
אפשר היה לפגוע בערי אנגליה כבכל הערים ביבשת אירופה, כאשר נעשה הדבר
במלחמת העולם השניה, והים כשהוא לבדו אינו מגן עוד על איי בריטניה.
ארצות־הברית של אמריקה היו בטוחות כמעט מיום היוָסדן מכל
התקפת אויב. שני אוקינוסים שמרו עליהן במזרח ובמערב; ושכניה מדרום ומצפון
היו חלשים לעומתן, ולא היה כל חשש להתגרות צבאית מצדם. בימינו אלה נתערער
אף בטחונה המוחלט של אמריקה; יפן לא חששה במלחמת העולם האחרונה להתקיף הצי
האמריקני בנמל הפנינים, ושוב אין אמריקה בטוּחה מהתקפת פצצה אטומית יותר
מכל ארץ אחרת.
מדינת ישראל לא נתברכה מעולם לא בימי בית ראשון ולא בימי
בית שני, בתנאים מעין אלה, ששמרו על בטחונן של אנגליה ואמריקה מאות בשנים.
ישראל היה תמיד עם קטן, והיו לו שכנים קטנים וגדולים, חלשים וחזקים,
והשכנים החזקים עלוּ בכל פעם על ישראל בגדלם, בכוחם, בעשרם ובחסנם הצבאי;
מעמדה גיאוגרפי של ארץ ישראל, על צומת שלוש יבשות, חלק אמנם חשיבוּת רבה
לארץ ועשה אותה במובן ידוע לארץ תלפיות, אבל מבחינת הבטחון לא הוסיף על
כושר התגוננותה אלא להפך, גרע ממנו באופן ממשי וניכר. גבולות ישראל לא היו
קבועים ויציבים, והלכוּ ונשתנו בלי הרף, החל מימי השופטים וגמור בימי
בר־כוכבא, וגם בימי ההתרחבוּת וההתפשטוּת הרבה ביותר, לא היה בגבולות ישראל
כשהם לעצמם כל מבטח לקיומה של המדינה. מצבה של מדינת ישראל המחודשת בימינו
אלה לא הוטב לעומת עברה הקדום.
המעמד הגיאוגרפי הפיסי של הארץ כמעט לא נשתנה, אם כי
בסביבתה הגיאופוליטית חלו שינוּיים גדולים וחיוּניים. התנ״ך נשאר עד היום
אוצר בלום לידיעת הארץ ותולדותיה — המדיניות, החברתיות, התרבוּתיות,
הצבאיות והבינלאומיות; ובמידה שהבנת המצב בימינו זקוקה לאור העבר (והיא
זקוקה לו במידה רבה), אין כספרי התנ״ך המסוגלים לזרוע אור על כמה בעיות של
חיינוּ ומקורותיהן הכמוסים ביותר, ולא תיתכן השכלה מדינית וצבאית ישראלית
מניחה הדעת בלי ידיעה מעמיקה בתנ״ך. אולם אין לחפש בעבר מורה־דרך מזומן
להווה.
הגיאוגרפיה משתנה רק מעט או כמעט לא לגמרי, אבל ההיסטוריה
מתחדשת בלי הרף, ואין סיטואציה היסטורית דומה לחברתה; הנסיון ההיסטורי, חקר
המצבים והתמורות בעבר, הוא עזר חשוב והכרחי בהתמצאותנו בתנאים החדשים, אבל
הנסיון עלול ליהפך לרועץ ולסכנה חמורה אם הולכים אחריו כסומא בארובה ודנים
גזירה־שוה מיכנית מהעבר, ואין מבחינים בחליפות ובתמורות המתמידות, ואין
רואים בבהירות המציאות החדשה שבה יש לפעול; יש הכרח לעמוד על היחוּד שבכל
סיטואציה היסטורית, ויש להסיק מכל מעמד מיוחד המסקנות ההולמות אותו ורק
אותו.
לא הרי כיבוש יהושע בן־נון, או שיבת ציון בימי זרובבל, עזרא ונחמיה, כהרי תקומת ישראל בימינו.
כיבוש יהושע בן־נון בא בזמן שעמי ארץ־ישראל ושכנותיה היו
שרויים באנַרכיה פנימית, ומאות שנים נאבקו היהודים עם שכניהם, עד שנכונה
מלכוּת ישראל המאוחדת תחת שאוּל ודוד, וגם זו לא האריכה ימים, ונתפלגה אחרי
מותו של שלמה המלך; ועל קיום שני הפלגים איימו כל הזמן ארם מצפון ואדום
ומואב מדרום, ויותר מכולן מצרים ובבל. ההתחרות המתמדת בין שתי האימפריות
האלה, זו שבדרום וזו שבמזרח, עזרה לא במעט במשך תקוּפה די ארוכה לקיום
עצמאוּת ישראל. המאבק הפנימי בין ה״אורינטציות״ על מצרים, אשור ובבל מילא
חללה של ההיסטוריה המדינית בימי מלכי יהודה וישראל, עד שסוף סוף גבר הכובש
מן ארם־נהרים, וישראל ויהודה נפלו בזו אחד זו. מצרים, אשר רבים ביהודה סמכו
עליה שתצילם מן הכובשים האשורים והבבלים, נתגלתה באמת כ״משענת הקנה
הרצוץ… אשר יסמך איש עליו ובא בכפו ונקבה כן פרעה מלך מצרים לכל הבוטחים
עליו״ (מלכים ב׳ יח, 21). בימי הבית השני, לא היינו עצמאיים וריבוניים אלא
תקוּפה קצרה של החשמונאים הראשונים עד מות אלכסנדר ינאי המלך ואשתו
שלומציון. במאתים השנים הראשונות אחרי השיבה מבבל היתה ארץ־ישראל אחת מ״שבע
ועשרים ומאה מדינה״ של מלכי פרס, וניהנתה רק מאבטונומיה דתית פנימית. גם
בימי אלכסנדר מוקדון ויורשיו הראשונים היתה הארץ כפופה לאימפריה1
ההלניסטית החדשה. בעקבות מלחמתם של המקבים נשתחררה יהודה, למעשה, רק בימי שמעון החשמונאי.
״בשנת שבעים ומאה הוסר עול הגויים מישראל, ויחל עם ישראל
לכתוב בספרים ובשטרות בשנה אחת לשמעון הכהן הגדול ושר הצבא ונשיא היהוּדים""
(ספר מקבים א', פרק יג, 42—41). שנת 170 למנין שטרות היא שנת 142 לפסה״נ.
רק אז הושלמה חירוּתה המדינית של יהודה, ונתקיימה בסך הכל במשך שלושה דורות
של החשמונאים הראשונים — כשבעים שנה: בימי שמעון החשמונאי, בנו יוחנן, שקרא
לעצמו גם בשם יוחנן הורקנוס, נכדו יהודה אריסטובולוס הראשון שהחזיר תואר
המלך לישראל, אחיו אלכסנדר ינאי ואשתו שלומציון המלכה. אחרי מות המלכה
הגדולה פרצה מלחמת אחים בין שני בניה, ואתה בא הכיבוּש הרומי ששם קץ, הרבה
שנים לפני חורבן בית שני, לעצמאוּת המדינית של ישראל.
תקוּפת החשמונאים עמדה בתחילתה בצלו של העולם ההלניסטי,
ובסופה תחת שלטונה של רומא. 133 שנה לפני חורבן בית שני, נכנס פומפיוס
הרומי בראש צבאותיו לירושלים, ומאז שלטה רומי למעשה ביהודה. מריבות פנימיות
החישוּ קצה של חירות העם היהודי בימי בית שני.
הצד השוה שבין שתי התקוּפות הקדומות בישראל היה — שמרכז הכובד של העולם, שבו פעל העם היהודי, היה באזור הים התיכון; מצרים, בבל, פרס, יוָן ורומא. סין והודו,
שני מרכזי תרבות ותיקים ורבי־ערך בעולם העתיק, וגם בימינו, היו רחוקים
ומרוחקים מישראל ושכניה; מרכזי התרבות הגדולים
שהשפיעו על עמי הים התיכון ושכניהם היו במשך אלפי שנה מצרים, בבל (אשור),
פרס, יוָן ורומא. כל אלה השפיעו במישרים ובעקיפין על העם היהודי, ועם כולן
עמדה ישראל במאבק מתמיד, צבאי או תרבותי. הצד השוה
השני — היות ישראל מוקפת עמים שונים, שהניגודים ביניהם לא פסקו עד שרומא
הכניעה את רובם, וישראל יכלה זמן רב לנצל הניגודים האלה לשם בטחונה,
ולהתחבר פעם עם צד אחד ופעם עם צד שני. כך עשו דויד
ושלמה והמלכים המאוחרים, וכך ניסו לעשות החשמונאים, עד שהברית עם הרומאים
נהפכה למלכודת של כיבוּש זר.
בשתי התקופות הקדומות באו היהודים לארץ מהמזרח, וכמעט שלא
ניתן להם לגשת לים. מגעם העיקרי היה עם העמים ששכנו סביבם ביבשה מדרום,
מצפון וממזרח. עד תקופת רומא לא היה לישראל כמעט כל מגע עם עמי המערב ואיי
הים, ועמים אלה, מחוץ ליוָן, גם לא היו חשובים אז בתולדות העמים.
מאז חורבן בית שני נפוץ ישראל בכל קצוי תבל, וכמעט שאין
למצוא ארץ אחת בעולם שאין בה פזורי ישראל. שיבת ישראל לארצו בימינו החלה
בארצות המערב באירופה, בתוך עמי התרבות הגדולים של ההיסטוריה החדשה. מרכז
העולם הועתק בינתיים מים התיכון לגדות האטלנטיק. בראשית שיבת־ציון בימינו
נמצא רוב היהודים באירופה, ובעיקר בחלקה המזרחי, בקרב העמים הסלבים
והגרמנים, ומיעוטם בקרב העמים הלטינים והצפוניים.
בקרב רובה של יהדות זו נשתמרה מורשת התרבות היהודית מימי
קדם, התרבות המושתתת על ספרי התנ״ך, ולתוכה נספגה גם התרבוּת המערבית
החדשה, המיוסדת על כיבושי המדע המודרני ונחלתו התרבותית של העולם
היוָני־הרומי.
חזון שיבת־ציון חי בקרב כל קיבוצי היהדות המפוזרת, ומזמן
לזמן נדלק ניצוץ משיחי ונעשוּ נסיונות להגשים החזון, עתים בדרך הטבע,
על־ידי עליה לארץ ובנין ישובים, עתים שלא בדרך הטבע, בכוח הנס והאמונה
המיסטית. דוגמאות בולטות לשני הדרכים הוא פעלם של
שני אישים גדולים ביהדוּת הספרדית: דון יוסף הנשיא הדוכס מנכסוס, ושבתי צבי
מאיזמיר.
אם כי הנסיונות משני הסוגים גם יחד נסתיימוּ בכשלון, אין
לקפח זכותם ההיסטורית ואין לשלול חלקם בתקומת ישראל בזמננו. הם הם ששמרו על
גחלת התקוה בלב העם היהוּדי, ובלי התמדה של תקוה זו לא היה קורה מה שקרה
בימינו.
מתקופת בר־כוכבא ואבדנה האחרון של עצמאות ישראל ועד הקמת
המדינה היהוּדית בימינו עברו 1813 שנה; רובו של הזמן הזה היו היהודים
מנותקים בגופם מהמולדת ופזורים בנכר בין הגויים. ואין בכל תולדות המין
האנושי מקרה דומה שעם המנותק מארצו קרוב לאלפּיִם שנה — יחזור אליה ויחדש
בה קוממיותו הממלכתית. אלמלא נשא העם היהודי בכל נדודיו חזון התקומה וקיים
בלבו ובנפשו הקשר עם ארץ מכורתו, על אף הניתוק הפיסי, לא היה בא אותו דבד
יחיד במינו שבא בימינו. והדבר לא בא — כל זמן שהחזון נתפרנס מתוחלת
פסיבית בלבד.
רצון הביצוּע האקטיבי נתעורר עם ראשית העליה החלוצית
לפני שבעים וחמש שנים, שהניחה היסוד להתישבוּת חקלאית; בעליה זו נסתמן
המפנה המהפכני ברוח העם, המפנה מתוחלת פסיבית וציפיה מיסטית לגאולה בעתיד
ערפלי, למעשה אקטיבי ומאמץ ממושך לפלס בדרך הטבע נתיב לגאולה לאלתר.
מאות בשנים נכנע העם היהודי לגורלו, לגורל עם מפוזר התלוי
בחסד זרים וכמעט שנכרתה האמונה מלב העם בכוחו ויכלתו. בעליה החלוּצית
באה לידי גילוי התעוררוּת האמונה ביכלתו היוצרת ובכוחו של האדם היהוּדי להשתלט על גורלו ולשנות גורל עמו.
התלקחות זו של האמונה בכוח וברצון היהודי לאחד מאות שנות
גלות ונכר היא אחד הפלאים הגדולים בהיסטוריה המופלאת של העם
היהוּדי.
אמונה מחודשת זו בכוח האדם והעם היהודי וביכלתו היוצרת
והלוחמת ינקה משלושה מקורות: מהשפעתו המחודשת של התנ״ך, מהמהפכות
הלאומיות והחברתיות באירופה, מהמגע היוצר עם אדמת המולדת.
ההשכלה במאה התשע־עשרה השיבה לנוער היהודי את התנ״ך בזהרו
הקדום. מַשַׁק כנפי נעוריה של האומה בקע מחדש בלב הנוער העברי צמא האור
והישע, ואהבת־ציון מרעננת הכתה גלים ועוררה מאוַיים נרדמים. המולדת
העתיקה נתגלתה לבנים החורגים בארצות נכר בבל קסמיה; לעיני
רוחם של הסופרים והמשכילים העברים נגלו כאילו מחדש מראות קדומים רוויי
בשורה: נדודי שבטי ישראל במדבר, חבלי התאחזותם בארץ היעודה, נפתוליהם עם
שכניהם ועם עצמם, עלילות הגבורה של שופטיהם ומלכיהם, הופעתה הכבירה של
הנבואה העברית הנושאת משאיה הגדולים והנצחיים על גוי ואדם, המבשרת חזון
אחרית הימים, והספוגה להט אמונה ביעוד הגדול של העם היהודי.
לבם של טובי הנוער היהודי נצמד מחדש למכורת האומה, ונתעורר הרצון לחדש ימינו כקדם.
המהפכות הלאומיות והחברתיות באירופה הדביקו טובי העם
היהודי בהכרת ערך האדם והעם הלוחם על שחרוּרו, הדגימו עלילות גבורה של
נדכאים ומשועבדים, הציתו בלבבות אש המרד ותוחלת התקומה, גילו כוחם וערכם של
העובדים ואנשי האדמה וסימנו דרך חדשה לגאולה הנכספת: שיבה לעבודה
ולאדמה במולדת.
החלה העליה החלוצית — מבשריה ומגלמיה של האמונה בכוח
וברצון היוצר של האדם והעם היהודי. יהודים נועזים ובוטחים בעצמם נצמדוּ
מחדש בקרקע המולדת, וכפרים עבריים הוקמוּ על אדמת ביצות וחולות וטרשים
עזובים ושוממים; לשון הנביאים שנדמה ושותקה כאילו לנצח, נשמעה מחדש בשדמות
יהודה והגליל מפי עוללים ויונקים, ובתולדות העם והארץ נפתחה תקוּפה חדשה,
תקוּפה של יהודים המעצבים גורל חייהם וגורל אומתם בעצם כוחם בעבודתם,
ביגיעם הגופני והרוחני, והם גם עושים במלאכה וגם מחזיקים בשלח, ומשיבים
מלחמה שערה כשהם נתקפים על־ידי אויב.
זרע המדינה נזרע ביסוד פתח־תקוה, ראשון־לציון, זכרון־יעקב,
ראש־פינה, גדרה והישובים שבאו אחריהם. והמיסדים הראשונים טעמו טעם התלאות
הקשות הבאות על בוני מדינה ראשונים: מלחמה קשה בפגעי הטבע, בפראי המדבר,
בשכנים עוינים, בקדחת ממארת, בחוסר מים, במחסור ובמצוק ובסכנות בלתי פוסקות
לחיים ולרכוש.
אַדני העצמאות העברית הוטבעוּ בכפרים ובערים העבריים שנבנו על־ידי חלוצי שיבת ציון השלישית. אולם עד קום
המדינה היו המיסדים הראשונים פטורים מהאחריות העליונה הכרוכה בעצמאות
ממלכתית. היה קיים שלטון זר, והשלטון היה טוב ורע בסירוגין, ידיד ועוין,
אבל עליו, על השלטון הזר, היתה האחריות העליונה לנעשה בארץ. בימי השלטון
התורכי לא היתה ארץ־ישראל יחידה מדינית בפני עצמה, ולא היתה גם מוקפת
מדינות עצמאיות. ארץ־ישראל בתקוּפת התורכים היתה רק אחד החבלים של הקיסרות
העותומנית, שכללה בתוכה כל ארצות ערב, והערבים והיהודים היו נתונים לשלטון
העליון של התורכים.
ובימי השלטון הבריטי היו גבולות הארץ — מוגנים על־ידי הצבא
הבריטי. הישוב העברי אמנם התארגן כמדינה בתוך מדינה, אבל האבטונומיה
היהודית הצטמצמה בענינים פנימיים בלבד. בטחון הארץ והגנתה היו בידי ממשלת
המנדט; ואם כי אנגליה שלטה בארץ מטעם חבר הלאומים, הרי מבחינה כלכלית
וכספית היתה הארץ חלק של הקיסרות הבריטית, והשקעת ההון הסמויה של אנגליה —
החזקת צבא גדול בארץ — שימשה מקור לא אכזב למשק היהודי המתרחב. מידות העליה
והגידול של הישוב היוּ תלויים במדיניוּת השלטון המנדטורי. עם תום המנדט
והקמת המדינה — עברו כל ה״מכשלות״ הללו לישראל העצמאית.
ביום 14 במאי 1948 קיבל על עצמו עם ישראל הצעיר, חסר
הנסיון הממלכתי, האחריות המלאה לבטחונה ולקידומה ולבנינה, של המדינה החדשה,
לגורל פזורי ישראל שאינם רוצים ואינם יכולים להישאר בגולה, לעיצוב היחסים
של עם ישראל עם העולם הסובב אותו מקרוב ומרחוק, ולא עוד אלא שעל מדינת
ישראל הוטלה האחריות לכבודם ולמעמדם, ובמידה רבה גם לשמירת יומם
וזכויותיהם, של כל היהודים בעולם.
מעולם לא נפלה על מדינה חדשה וקטנה אחריות כה כבדה וגדולה בתנאים כה חמורים וקשים.
תנאים חמוּרים וקשים אלה אינם מקריים וזמניים, אלא נעוצים
במעמדה הגיאוגרפי של הארץ ובמקומה בהיסטוריה האנושית; בנסיבות התקוּפה
ההיסטורית שבה קמה המדינה; במצבו של העם היהודי ובקורותיו בימינו; בסביבת
העמים שבתוכם מדינת ישראל חיה ופועלת; ולבסוף במשימות המיוחדות שהוטלו על
מדינה זו, המשימות המשמשות בבת אחת גם זכוּת וגם תנאי לקיומה.
בשלושה דברים ארצנו נפלית: במבנה פניה, במעמדה הגיאוגרפי ובתולדותיה. המבנה הפנימי של מולדתנוּ אין דומה לו
בכל כדור הארץ. לאורך הארץ מצפון לדרום, מהרי הלבנון והחרמון ועד ים־סוף,
משתרע בקע עמוק בשם בקעת הירדן והערבה, ומרכזו הוא ים־המלח, כארבע מאות מטר
מתחת לפני הים, וזהו המקום העמוק ביותר על־פני כדור־הארץ. בקעה עמוקה זו,
הגבעות וההרים אשר משני עבריה וחוף ים התיכון לאורך הגבול המערבי הקנו לארץ
קטנה זו שפע של אקלימים, נופים וסגולות שאין למצוא בשום ארץ אחרת בשטח כה
מצומצם. ולא לחינם דרש אחד מחכמינו: ״תבל זו, שהיא מתובלת בכל. שכל
הארצות יש בזו מה שאין בזו, אבל ארץ־ישראל אינה חסרה כלום״.
עמדתה של הארץ בצומת שלוש יבשות: אסיה, אירופה ואפריקה,
הפכה ארץ קטנה זו לארץ מעבר ולשדה־מערכה לכל כובשי תבל. מזמן שהאדם נפוץ
בעולם והחל נודד מארץ לארץ — היתה ארצנו תחנה חשוּבה ובסיס איסטרטגי לכל
הכובשים הקדומים והחדשים, שבאו מצפונה של אפריקה או מלב אסיה המערבית
והמרכזית או מארצות אירופה. לארצנו פלשו כובשים מדרום ומצפון, ממזרח
וממערב, מכל הגזעים האנושיים ובכל התקוּפות ההיסטוריות, מימי קדם ועד ימינו
אלה, החל בעילם ומצרים ואשור בראשית התרבוּת האנושית ועד נפוליון ואלנבי
בתקוּפה החדשה. ואם כי בינתיים נתגלוּ יבשות חדשות וגדולות, ומרכז הכובד של
המדיניות והתרבוּת האנושית הועתק לאזורים אחדים — אין איש יכול להגיד
