,Title,Translator,Lang,Author,Text
עצמאית, תחת שלטון המנדט הבריטי, אשר בה ניתן להקים ״בית לאומי לעם
היהודי״, כפי שהובטח בהצהרת בלפור. עם אישור המנדט על־ידי מועצת חבר
הלאומים ביולי 1922 נחלקה הארץ למעשה ולהלכה לשתים: המערב נשאר כשטח ״הבית
הלאומי״, והמזרח, מעבר לירדן, נמסר (תחת שלטון המנדט) לאמיר עבדאללה, בנו
של חוסיין ממֶכּה.
1813 שנה אחרי תבוסת בר־כוכבא נתחדשה מדינת ישראל בחלק
המערבי של הארץ. בשטחה אין מדינה זו קטנה מהמדינה העברית ברוב ימי
הבית הראשון או השני, וחומר בעיית הבטחון במדינת
ישראל אינו נעוץ בגבולותיה השונים מגבולות ישראל בתקופות הקדומות, אלא
בשינויים רבי־המשמעות שנתחוללו סביב ארצנו כחמש מאות שנים אחרי בר־כוכבא.
במאה השביעית לספירת הנוצרים נתחוללה בסביבות הארץ מהפכה רוחנית, אשר שינתה
פני המזרח התיכון, מרכז אסיה וכל ארצות צפון אפריקה; ומהפכה זו מחמירה
עכשיו ובעתיד בעיית־הבטחון של מדינת ישראל כאשר לא היתה מעולם, לא בימי בית
ראשון ולא בימי בית שני.
מהפכה זו התחוללה בערבות הנרחבות והמדבריות של חצי־האי
ערב. במדבר ענקי זה נדדו במשך אלפי שנים שבטים ערבים פרימיטיביים, שהעולם
הרחב כמעט לא ידע כלום אודותם, וקולם לא נשמע על במת ההיסטוריה האנושית עד
המאה השביעית לספה״נ. שבטים אלה לא היו אפילו מאוחדים כאומה אחת, ולא היו
נתונים לשלטון אחד. הופעתו של מוחמד ברבע הראשון של המאה השביעית הפכה סדרי
בראשית. נביא האיסלם ליכד השבטים המפורדים והפך אותם לאומה מאוחדת, נתן להם
אמונה חדשה והפיח בהם רוח גבורה ומאוַיי כיבוש. אחרי מות הנביא בשנת 632
יצאו יורשי מוחמד מחצי־האי ערב למסע כיבוש בעולם והקימו בזמן קצר אימפריה
ערבית עצומה. יסוּד אימפריה גדולה על־ידי עמים כובשים אינו דבר חדש
בהיסטוריה. קדמוּ לערבים ביסוּד קיסרוּיות ענקיות הפרסים, היוָנים, הרומאים
והמונגולים. הכובשים הערבים לא הסתפקוּ בשלטון אלא הטילו על עמים רבים דתם
החדשה. גם בזה לא היה חידוש. קדמו להם הבודהיסטים באסיה המזרחית והנוצרים
באסיה המערבית ובקיסרות רומא. אולם הערבים ביצעוּ מהפכה שלפניהם ולאחריהם
לא היתה כמותה: הם עקרו לשונם של העמים המרובים אשר כבשו באסיה ובאפריקה
והנחילו להם לשונם הערבית. לא כל העמים שקיבלו דת האיסלם קיבלו גם לשון
נביא האיסלם. הפרסים, התורכים והמונגולים וכן עמי הודו ואינדונסיה שנתאסלמו
שמרו על לשונם הלאומית, אולם שפת הנביא כבשה כל העמים במזרח התיכון,
בארץ־ישראל, בלבנון, בסוריה, בארם נהריִם ובכל ארצות צפון אפריקה ממצרים
ועד מרוקו, וערבית היא כיום לשונם המדוברת של כל העמים מדרום תורכיה לאורך
חוף הים התיכון המזרחי והדרומי עד האוקינוס האטלנטי, המונים כשבעים מיליון
נפש. עמים אלה אין ביניהם כל שותפות של דם וגזע ועבר היסטורי, אבל שותפות
הדת והלשון הופכת אותם ליחידה תרבותית ועלולה להפוך אותם לגוּף מדיני
מאוחד.
שטח עצום זה, שבו שולטת הלשון הערבית ודת האיסלם, חלקו
במזרח התיכון, ובו שוכנות שש מדינות עצמאיות: לבנון, סוריה, עבר־הירדן,
עיראק, סעודיה ותימן. השטח הרצוף שהמדינות האלה תופסות הוא 1,356,000 מיל
מרובע, ומספר תושביו הוא קרוב ל־20 מיליון. בהשוואה למדינת ישראל שטחו גדול
פי 170, אוכלוסיו פי 13, לפי ישוב ישראל בראשית 1952 או פי 28 בזמן יסוּד
המדינה.
חלקו השני של שטח ענקי זה הוא צפון אפריקה, והוא מקיף
ארצות אלה: מצרים, סודאן, לוב, טוניס, אלג׳יריה ומארוקו. השטח של הארצות
האלה הוא 3,064,123 ממ״ר ומספר אוכלוסיהן הוא 45.5 מיליון. רק שתים מארצות
אלה הן עצמאיות — מצרים ולוב; סודאן כפופה בפועל לאנגליה. להלכה יש בה
שלטון משותף של מצרים ואנגליה, והיא משמשת סלע מחלוקת בין שני ה״שותפים״.
לוב הוכרזה רק לפני שנה עצמאית; טוניס ואלג׳יר כפופות עדיין לצרפת, אבל הן
מתמרדות; מרוקו כפופה ברובה לצרפת ומקצתה לספרד. אך גם פה יש התמרדות תקיפה
נגד השלטון הזר.
אם נצרף מצרים לבדה (בלי סודאן) לארצות הערביות במזרח
התיכון — יתקבל שטח של 1,719,000 מיל מרובע (פי 215 משטחה של מדינת ישראל).
וישוב של קרוב ל־40 מיליון, פי 57 מאשר במדינת ישראל בשעת יסוּדה, או פי 27
מאשר בישראל בתחילת 1952.
בארגון האומות המאוחדות יושבות עכשיו שש מדינות ערביות:
סוריה, לבנון, עיראק, סעודיה, תימן, מצרים. ואם כי הן מחולקות בתוכן בכמה
ענינים חיוניים ובלתי חיוניים, הרי הן מהוות כלפי חוץ גוש אחד מלוכד, וששת
הקולות שלהן הן מטבע עובר לסוחר, בכל המובנים.
מדינת ישראל לפנים לא היתה מעולם מוקפת מכל עבריה גוש אחיד
מסוג זה; גוש זה עלול לגדול בעתיד; יש להניח שגם טוניס, אלג׳יר ומרוקו
יעמדו ברשות עצמן במוקדם או במאוחר, ויהיו חברות בארגון האו״ם.
המדינות הנוצריות בעולם אינן מהוות לגבי שום דבר גוף
מאוחד, אבל אין הדבר כך לגבי המדינות המוסלמיות; כאן רגש האחדוּת הדתית
עדיין חזק למדי, אם כי לא בכל המדינות במידה שוה. תורכיה, למשל, רואה עצמה
כחברה וכשותפת לארצות אירופה המערבית, אבל רוב מדינות האיסלם משתפות פעולה
בכמה שטחים מדיניים. הארצות המוסלמיות הבלתי ערביות הראשיות הן: פקיסטן,
פרס, אפגניסטן, אינדונסיה (מבלי להביא בחשבון את תורכיה), התופסות שטח של
יותר מ־1,800,000 מיל מרובע ומספר תושביהן למעלה מ־185,000,000 נפש. מדינות
אלה משתפות פעוּלה עם ״החבר הערבי״ באו״ם ותומכות בו בכל ענין שאינו חיוני
לגבי עצמן. שיתוף פעולה זה כולל, לרוב, היחס לישראל.
זוהי היקפה של הבעיה הבטחונית והמדינית שארצות ערב מציגות למדינת ישראל הצעירה.



מצבה של המדינה כלפי שכנותיה ושאר המדינות בעולם אינו ממצה קשייה המיוחדים של ישראל.
כל מדינה מורכבת מארץ ומעם. ואף מדינת ישראל כך, אלא שאין
מדינה זו זהה עם הארץ ואין היא זהה עם העם. כבר צויין שבשעת יסוּד המדינה
ישבו בארץ רק כשישה אחוזים מהעם היהודי, שנשתייר אחרי הרצח הנאצי. כאן יש
להוסיף, שמדינת ישראל נתיסדה רק בחלקה של ארץ־ישראל, וגם מי שמפקפק בקיום
גבולות ״היסטוריים״, קבועים וקפואים ונתונים מבראשית, אינו יכול להטיל ספק
באנומליה של גבולות המדינה. אך בגבולות אלה, — וישראל התחייבה בחוזי שביתת
הנשק עם שכנותיה לשמור על גבולות אלה כל עוד לא תותקף שוב, וישראל עומדת בהתחייבוּיותיה — אין המדינה והארץ זהות. בהיוָסד
המדינה היו רק כשבעה אחוּזים של אדמת המדינה מעוּבדים, חצי השטח הזה
על־ידי יהודים, וחציו על־ידי ערבים. המלחמה הורישה לישראל שממה חדשה שנעשתה
בידי אדם — נוסף על השממה הנושנה שנעשתה בידי שמים. יותר ממחציתה של
ארץ־ישראל המערבית — המחצית הדרומית, היתה ריקה ושוממה גם בימי המנדט
הבריטי ומאות ואלפי שנים לפני כך, אבל המלחמה הֵשמה והחריבה מאות ישׁובים
בכל רחבי הארץ, ובקום המדינה — היו קיימים רק
הישובים היהודיים שנוסדו בשבעים השנים האחרונות, ומספר לא רב של ישובים לא
יהודיים. המדינה הצעירה נחלה בעצם ארץ חרבה ונשַׁמה, שיש לבנותה כמעט מחדש,
בלא שיהיו בידי המדינה האמצעים הדרושים לכך, לא האמצעים הכספיים ולא
האמצעים הטכניים (חומר, מכשירים, כלים ומכונות) ולא כוח־האדם. כל
שלושת אלה היו צריכים לבוא מן החוץ. ומובן מאליו שאינם יכולים לבוא
ביום אחד או בשנה אחת ואפילו לא בדור אחד. פירוש הדבר, שהכוחות שמהם
תיבנה המדינה — העם, המשק, התרבות והבטחון — אינם נתונים בתוך תחומי המדינה
אלא נמצאים בחוץ, ותלויים במסגרות הלאומיות והבינלאומיות של ה״חוץ״
הזה.
מכל הדברים שבהם תלויה קיומה, בנינה, בטחונה ועתידה של
המדינה אשר, כאמור, יש להשיגם אך ורק בחוץ — החשוב והחיוני בכולם הוא כמובן
העם. איש לא העלה על דעתו כי שש מאות אלף יהודים יקימו מדינה, יבנו
אותה וישמרו על שלומה ובטחונה. מדינת ישראל הוקמה למען יהודי הגולה, אשר
ישובו. זכות קיומה ותנאי קיומה של מדינת ישראל היא קיבוץ גלויות, כלומר,
עליית העם. העליה הניחה יסוד למדינה והקימה אותה — ורק מהעליה עתידה המדינה
להיבנות, ורק בכוחה היא עשויה להתגבר על כל קשייה. אבל העליה עצמה נתונה
בקשיים, שאין להתגבר עליהם בלי מאמצים נואשים.
עד שנת 1914 היה כל יהודי חפשי לעזוב ארץ מגוריו. בכל ימי
גלותו ובכל ארצות גלותו היה העם היהודי תלוי בחסדי זרים; לא בכל הארצות ולא
בכל התקופות היה מעמד היהודים שוה. יש שרוַח להם וזכויותיהם נתקיימו, ויש
שנדכאו והופלו לרעה. הזכות היחידה שהיתה שמורה ליהודים בכל הזמנים ובכל
הארצות היתה הברירה לצאת מארץ מגוריהם. בתקופת קום המדינה נגזלה אף זכות זו
מיהודים בכמה ארצות.
כבר צוין גורל היהדות הרוסית שנוּתקה בחוזק יד מכל קשר עם
שאר חלקי העם היהודי ומקשריה עם הארץ. למעשה הוטל הסגר חמוּר על יהודי
רוסיה. כיבושי ברית המועצות במלחמת העולם השניה ולאחריה הרחיבו שטח ההסגר.
יהדות ליטא, לטביה, גליציה המזרחית, בסרביה ואחר כך הונגריה אף היא נותקה
ונכלאה. ניטל חופש היציאה גם מיהודי פולין, רומניה, צ׳כוסלובקיה, בולגריה,
אם כי מדינות אלה, גם לאחר ריתוּקן למשטר הסובייטי, הרשו עליית יהודים
לארץ, אף לאחר שאסרו בדרך כלל יציאת תושביהן מארצן.
אבל זה אינו השינוי היחיד שחל בתנאי העליה היהודית לארץ.
בימי המנדט הביאה מעליה לארץ לא רק כוח־אדם, אלא גם
האמצעים הכספיים והכשרונות הטכניים והמדעיים הדרושים לבנין הארץ. בארצות
שמהן באה העליה היו ליהודים גם אפשרויות של חינוך והשכלה, יהודיים וכלליים,
וגם יכולת חמרית וכספית. זרם העולים היה מלוּוה בזרם הון וכושר מקצועי
ואינטלקטוּאלי. העולים היו מוּכשרים לבנות הריסות הארץ באונם, בהונם
ובידיעותיהם הטכניות והמקצועיות. רק במידה מוּעטה נזקקה העליה בימים ההם
לעזרה כספית מצד העם בכללו. מלחמת העולם השניה והתמורות המדיניות
והסוציאליות שבאו בעקבותיה הפכו קערת העליה על פיה.
בארצות מזרח־אירופה הכפופות לברית המועצות, גם באלה שהרשו
ליהודים לעלות, ״הולאם״ הרכוש היהודי והוחרם יחד עם הרכוש של כל התושבים,
והעליה מארצות אלה היא בהכרח עליה מחוּסרת אמצעים.
לאחר השמדת שני שלישי יהדות אירופה וההסגר שהושם על יהדות
ברית המועצות וכמה מהארצות הכפופות לה, נעשו ארצות האיסלם למרכזי העליה
הראשיים. ארצות אלו מצטיינות בשתיים: בעוני חמרי ובעוני רוחני. ורוּבם של
העולים מגלויות ערב הם גם מחוּסרי אמצעים חמריים וגם משוללי חינוך, יהודי
ואנושי.
לכך יש להוסיף העוּבדה הכללית, שמחוץ לארצות מעטות, הוקפאה
תנועת ההון גם בארצות החירות הדימוקרטית, והאמצעים הכספיים הדרושים למימוּן
העליה ובנין המדינה יש להשיג כמעט בארץ אחת בלבד: בארצות־הברית של אמריקה.
בארץ זו נמצא הקיבוץ היהודי הגדול ביותר בימינו, גדול במספר, עצום ביכולת
כספית, מקצועית ומדעית, ורב־השפעה בתחום המדיני. קיבוץ זה אינו רואה עצמו
מועמד לעליה; אם כי בקרב טובי הנוער שבתוכו, ולוּ רק בחוג מצומצם, פועם
רצון חלוצי.
מבחינת אפשרויות העליה של אנשים, הון וכושר מקצועי אפשר לחלק ארצות הגולה לחמישה סוגים:
1. ברית המועצות שאסרה על יציאת היהודים וגם הלאימה
רכושם בתוך הלאמת רכוש כללית. בארץ זו יושב רוּבה הגדול של שארית יהדות
אירופה — כשני מיליון איש. מארץ זו לא תיתכן בשעה זו לא עליית אנשים ולא
עליית הון.
2. ארצות שמשטרן החברתי דומה למשטר הסובייטי, אבל הן
מרשות מידה מסוימת של עליה, והן הונגריה, רומניה, פולין, צ׳כיה, בולגריה.
מספר היהודים בארצות אלה הגיע בשעת יסוּד המדינה ל־729,000. מהם עלו עד
תחילת 1952 214,026 יהודים. מארצות אלה יִתּכן זרם עולים אבל לא יִתּכן
זרם הון, כי ההון היהודי שוב אינו קיים שם.
3. ארצות האיסלם: עיראק, סוריה, לבנון, תימן, מצרים,
טריפולי, מרוקו, טוניס, תורכיה, פרס, אפגניסטן, שהן מקורות העליה
העיקריים בתקופה זו; ארצות אלה מעניקות לארץ ברכת העולים, אבל עולים אלה
ברוּבם המכריע נטוּלים גם הון וגם השכלה יהודית וכללית, ולמען התערוּתם
הפרוּדוּקטיבית בארץ יש הכרח באמצעים כספיים וביכולת מקצועית ממרכזי
היהדות החפשית והעשירה. בשעת קום המדינה ישבו בארצות אלה 889,700 יהודים,
מהם עלו עד תחילת 1952 — 329,561.
4. ארצות מערב אירופה, דרום אמריקה ודרום אפריקה. ליהודי
ארצות אלה יש גם ההון וגם ההשכלה וגם הכושר המעשי הדרושים לבנין המדינה
ובטחונה, אבל העליה מארצות אלה בתקופה זו מצומצמת ומעוטה. ויש קשיים
חוקיים בהעברת הון מארצות אלה לישראל. זכות העליה בארצות אלה היא ללא כל
הגבלה — אבל רק יהודים מעטים משתמשים עכשיו בזכות זו. בארצות אלה יושבים
(1951) 1,746,230 יהודים. מזה 953,200 באירופה, 627,030 באמריקה הדרומית,
110,000 באפריקה הדרומית, באוסטרליה ובניו־זילנד — 56,000. עד תחילת 1952
עלו לארץ 39,805 מכל הארצות האלה.
5. ארצות־הברית של אמריקה. גם תנועת ההון וגם תנועת
אנשים חפשית בהחלט בארץ זו, ופה שוכנת כמעט מחציתה של יהדות העולם; מכאן
בא ויבוא למדינה מן החוץ רוב ההון שהושקע עד עכשיו ועוד יושקע בבנין
המדינה: הון ציבורי (מגביות ומלוה עצמאות), הון פרטי, הון ממשלתי (מלוות
מבנק ליצוא ויבוא והענקות הממשלה האמריקנית).
כאן, לרבות קנדה, יושבים 5,201,000 יהודים, ומראשית יסוד המדינה עד תחילת 1952 עלו מהם ארצה — 1,682.
גם לאחר השואה והחורבן מידי הנאצים יש עכשיו ביכלתו
הכוללת של העם היהודי לבנות המדינה, לפתחה ולבצרה למען תעמוד בשליחותה
ההיסטורית ותוּכל לכל קשייה, אבל יכולת זו היא מפורדת ומפוצלת ובכמה
ארצות — כבולה, ושלושת הדברים הדרושים למדינה: אנשים, הון וכושר המעשה שוב
אינם צמודים, כאשר היו בתקופת המנדט, אלא מרכזי העליה לחוד, ומרכזי ההון
וכושר המעשה לחוד.
העליה היתה בכל הזמנים פרי המצוקה היהודית, גם עליית ביל״ו
וגם העליה השניה והעליות שבאו אחריה. למצוקה נלווה גם חזון; בלי חזון לא
היתה המצוקה נהפכת לכוח משחרר וגואל כאשר נעשתה העליה לארץ, אבל החזון
כשהוא לבדו לא היה בכוחו מעולם להעלות המונים. אפילו במולדת הרנסנס
היהודי — ביהדות רוסיה, כשהיתה עדיין חפשית גם לעלות וגם להעלות הונה, היתה
העליה מצומצמת לחוגים של יחידי סגולה חלוציים. אפילו מנהיגי הציונות ברוסיה
הצארית, ביניהם בעלי יכולת רבה, לא זזו ממקומם ולא העבירו הונם לארץ,
כשעדיין היתה הברירה בידם לעשות כך. ואין יהודי אמריקה טובים מיהודי רוסיה
הצארית; גם יהודי בבל לא שעוּ בשעתם להצהרת כורש ולא שבוּ עם זרוּבבל, עזרא
ונחמיה אלא כארבעים ושנים אלף, ורק עם ״הסרת הטבעת״ על־ידי ממשלת עיראק
בימינו — שבה גלוּת בבל מקץ אלפּיִם וחמש מאות שנה למולדתה
הקדומה…
בימי כורש ניתן ליהודים לשוב מבבל

״בִּכְלֵי כֶסֶף
בַּזָהָב בָּרְכוּש וּבַבְּהֵמָה וּבַמִגְדָנוֹת״

(עזרא ב, 6),
וכורש הוציא פקודה לאמור:

״מִי בָכֶם מִכָּל עַמוֹ — וְיַעַל לִירוּשָׁלַיִם אֲשֶר


בִּיהוּדָה וְיִבֶן אֶת בֵּית ה׳ ־ וְכָּל הַנִּשְׁאָר מִכָּל הַמְּקוֹמוֹת


אֲשֶׁר הוּא גָר שָׁם יְנַשְׂאוּהוּ אַנְשֵׁי מְקוֹמוֹ בְּכֶסֶף וּבְזָהָב


וּבִרְכוּשׁ וּבִבְהֵמָה״

(שם, שם, 3—4).
נחמיה מסר לנו בדיוק מספר העבדים
והאמהות והמשוררים והמשוררות והסוסים והפרדים והגמלים והחמורים וזהב
הדרכמונים וכסף המנים שהביאו אתם שבי הגולה.
בימינו אלה לא הורשו יהודי עיראק לקחת רכושם, ורובם הגדול
בא בעוני ובחוסר כל. והוא הדין ביהודי תימן, ומרוקו, ותוניס, ואלג׳יר,
ומצרים, וטריפולי, ותורכיה, ורומניה, ופולין, ועוד ועוד…
מרכזי העליה נפרדו ממרכזי ההון, ואין זיקה פנימית בין שני
הזרמים, פירוד זה כמובן אינו מקל על המדינה ביצוע שתי משימותיה המרכזיות:
קיבוץ גלויות ובנין הארץ.
מאמציה של מדינת ישראל נתבעים לא רק לקליטת עליה ופיתוח
המשק. היא נדרשת להשקיע כוחות ואמצעים כבירים לקיים בטחונה הצבאי והמדיני,
לשמור על ריבונוּתה כלפי חוץ ולבצר חירוּתה הדימוקרטית ועצמאותה הרוחנית
בפנים.
חמישה יעוּדים ראשיים אלה של ישראל גוזרים על דרכה
במדיניות חוץ ופנים, קובעים כיווּן יחסיה הבינלאומיים ומעמיקים זיקתה לעם
ישראל בעולם.
בשלושה מעגלים פועלת המדינה.
א. במעגל גלובלי, המקיף כל כדור הארץ. אין ישראל יכולה
להצטמצם רק במסגרת ארגון האומות המאוחדות, כי כמה מדינות בעולם אינן
משתתפות באו״ם, ואין ארץ בעולם, קרובה או רחוקה, שאין למדינת ישראל בה
ענין, ולוּ רק מפני פזוּרי ישראל שבתוכה.
ב. מעגל המזרח התיכון. שבתוכו שוכנת ישראל.
מעגל זה כולל ארצות החבר הערבי, תורכיה, פרס. מעגל זה צופן בתוכו סכנות חמוּרות וגם סיכויים רבי־משמעות לעתידה של ישראל.
ג. מעגל העם היהודי ברחבי הגולה — במעגל זה תלוי יותר
מכל עתידה של ישראל. זיקת מדינת ישראל לעם היהודי היא לא זיקת צרכים
ותועלת, אלא זיקת יעוּד וגורל.
חרדה לשלום בין עמים, לזכויות אדם באשר הוא אדם ולחופש
קשרים עם התפוצה היהודית — חרדה משולשת זו מונחת ביסוד מדיניותה הבינלאומית
של ישראל. ומשום כך אדיר חפצה — לקיים יחסים תקינים עם כל המדינות, עם
ממשלותיהן ועם עמיהן, מבלי לבדוק בציציות של משטרן הפנימי, ולתת יד לכל
נסיון ולכל צעד שיש בו להפיג המתיחות שבין המעצמות הגדולות ולחזק השלום
בעולם.
ישראל אינה אדישה למאבק האידיאולוגי הנלווה לתחרות המדינית
והצבאית שבין האומות. זיקת ישראל לערכי החירות האנושית, חירות המחשבה
והרוח, חופש הבחירה והביקורת, חופש היצירה והעבודה — טבועה במהותה ובמורשתה
הרוחנית של האומה היהודית, והיא שנתנה ליהודים הכוח המוסרי לעמוד נגד
נסיונות של כפיה ואונס, גם כשעמדו מאחריהם כוחות פיסיים עליונים. כאומה
היחידה בעולם שאין לה בנות לויה של שותפי גזע, דת ולשון, ועומדת אלפי שנים
בבדידוּתה המזהירה והטרגית, ונוסף לכך היא מפוזרה בין כל הגויים והארצות,
