,Title,Translator,Lang,Author,Text
אובייקטיבי לריב עם ישראל; וגם השתתפותן בפלישה היתה במידה רבה מקרית;
הלבנון חציו נוצרי, והמרוניטים ברובם רואים בעין יפה הקמת מדינת ישראל.
החלק המוסלמי בלבנון אינו רוצה ואינו מעונין להקניט יותר מדי האוכלוסין
הנוצרים, ואלמלא החשש לליגה הערבית היה הלבנון מקדים לעשות שלום עם ישראל.
יש גורמים מדיניים וכלכליים חשובים המזקיקים את הלבנון ליחסי ידידוּת
ושכנוּת טובה לישראל.
גם מצרים אין לה כל סיבה אובייקטיבית להסתבך ולהסתכסך עם
ישראל. בין שתי המדינות משתרע מדבר רחב וגדול, מדבר סיני, ואין מקום
לסכסוכי גבולות. מבחינה כלכלית ומדינית אין כל ניגודים בין שתי הארצות.
להפך, נוכח הקשיים המדיניים והחברתיים שבהן מתחבטת מצרים היא היתה יכולה
להעזר לא במעט בישראל, ושלום עם ישראל היה מחזק מעמדה של מצרים. התפתחותה
התרבותית והכלכלית של מצרים וגם מעמדה הבינלאומי היו רק מרויחים משיתוף
פעולה עם ישראל. יחסי ישראל ומצרים הם עתיקי יומין. בעצם זוהי המדינה
הראשונה שנתקלנו בה במסענו הארוך על במת ההיסטוריה במשך ארבעת אלפים שנה.
הפגישה הראשונה שלנו עם מצרים בימי יוסף — היתה של עזרה הדדית. אך לא כל
המצרים ידעו את יוסף. פלישת מצרים לארצנו עם קום מדינת ישראל היתה בלי ספק
אחד מהמשגים הפזיזים והאויליים וחסרי־האחריוּת ביותר שעשו שליטי מצרים לפני
ארבע שנים.
גם יחסינו עם הלבנון בימים הקדומים היו יחסי ידידות ועזרה
הדדית. מדינת הלבנון תופסת עכשיו רוב ערי הכנענים (הפיניקיים) — צור,
צידון, ארוַד, גבל, בירות ועוד. העיר המרכזית הכי קרובה לישראל היתה צור,

״הַיוֹשֶׁבֶת עַל מְבוֹאֹת יָם, רוֹכֶלֶת הָעַמִים אֶל אִיִים רַבִּים…


כְּלִילַת יֹֹּפִי״

(יחזקאל יז, 3).
לדוד המלך וכן לבנו, שלמה, היו קשרי
ידידות אמיצים עם חירם מלך צור,

״כִּי אֹהֵב הָיָה חִירָם לְדָוִד כָּל
הַיָּמִים״

(מלכים א׳, הי, 15)
ואהבה זו נמשכה גם אחרי מותו,

״וַיְהִי חִירוֹם נֹוֹתֵן לִשְׁלֹמֹה, עֲצֵי אֲרָזִים וַעֲצֵי בְרוֹשִׁים


כָּל־חֶפְצוֹ… וַיְהִי שָׁלֹם בֵּין חִירָם וּבֵין


שְׁלֹמֹה וַיִכְרְתוּ בְרִית שְׁנֵיהֶם

(מלכים א׳ ה', 24—26).
ואין כל סיבה
מדוע לא יחודשו יחסים אלה, בין ישראל ובין הלבנון.
אולם המדיניות הערבית היא אי־רציונלית. גורמים אישיים וכנופייתיים, פחד
מהיריב, ממלאים תפקיד גדול, לעתים מכריע, במדינות אלה. ואין שום ערוּבה שמצרים או הלבנון יפעלו לפי תביעת צרכיהן
המדיניים ומעמדן בעולם.
עלינו להיות נכונים לתקופה ממושכת של חוסר שלום, ולבצר
בינתיִם מצבנו. הזמן פועל בכמה דברים לטובתנו. הניתוק מארצות ערב מקשה
במידה ידועה מצבנו הכלכלי, אבל מאידך הוא מאפשר לנו לפתח משקנו ללא כל זיקה
ותלוּת בארצות השכנות. בתקופת המעבר (מעבר — מבחינת
שלום ומלחמה) עלינו להשקיע כל כוחנו בהתבצרותנו, בגידולנו, בחיזוק כוחנו
הפנימי. כל שנה, כל חודש נותנים תוקף לעובדות החיוביות שיצרנו; הגבולות
המורחבים שלנו, וגידול ירושלים היהודית והתערוּתה המעשית במדינה כוחם יפה
מכוח המלצה פורמלית בלתי מבוצעת של או״ם. גם בבעיית הפליטים הזמן פועל לא
נגדנו. אם לפני שנתיים עוד נשמעו קולות רציניים על שיבת הפליטים, כולם או
חלקם, הרי במרוצת הזמן חודרת ההכרה לכל החוגים האחראים באו״ם, שהפתרון
הממשי היחיד של בעיית הפליטים הוא ישוּבם בארצות ערב; פתרון זה — אַל נשלה
עצמנו — ביצועו אינו קרוב, אבל חשוּבה לנו ההכרה הבינלאומית בשאלה
זו.
גם במעגל הגלובלי וגם במעגל של המזרח התיכון אין אנו
יכולים להישען על כוחנו בלבד. בלי כוח — נרָמס, גם בשבתנו במדינה עצמאית,
כאשר נרמסנו תמיד, בהיותנו בגולה.
מגילת או״ם, אין לזלזל בערכה וביקרה, וכן הצהרת שלוש
המעצמות — אמריקה, אנגליה וצרפת, על שמירת הסטטוס קבו בין ישראל ובין שכניה
— אף לה יש ערך כלשהו. אבל קיומה של ישראל יֵהפך לאשליה מסוכנת ומופרכת אם
ישָׁען על מגילת או״ם בלבד או על הצהרות של מעצמות זרות. ישראל קמה בכוחה
היא, והיא תתקיים אם תישען קודם כל על עצמה ועל כוח עצמה, כוח גדל והולך.
עדיין יש בתוכנו אנשים בעלי הרגלי מחשבה גלותית הכופרים בערכו ובחשיבותו
המוסרית והמעשית של הכוח ואינם מאמינים בכוח יהודי. הם נוהגים לצטט פסוק
מפורש האומר: ״לֹא בְחַיִל וְלֹא בְכֹחַ כִּי אִם בְּרוּחִי״ (זכריה ד',
6), ושוכחים שאפילו משה רבנו האמין כי אלוהים הוציא עמו ישראל ממצרים

״בְּמִלְחָמָה וּבְיָד חֲזָקָה וְבִזְרועַ נְטוּיָה וּבְמוֹרָאִים גְדוֹלִים״.

כל עוד לא קוים חזון הנביאים — והוא יקוים! — ""לֹא יִשָׂא גוֹי
אֶל גוֹי חֶרֶב וְלֹא ילְמְדוּ עוֹד מִלְחָמָה״ — וכל עם ישב לבטח בתוך
משפחת העמים המאוחדים בעולם — שומה על ישראל לבנות
בלי הרף כוחה ולשקוד על בטחונה באמצעיה היא, כי בנפשה הדבר. אבל טועים
ומטעים גם אלה הרואים בכוח חזות הכל. יש גבולות לכוחנו וליכלתנו, ואם אין
ספק שכוחנו הוא גורם — וגורם חשוב ויקר — הרי יש בעולם כוחות גדולים משלנו,
ואף הם משמשים גורם, ובמאזני הכוח כשהוא לבדו לא נכריע הכף
ההיסטורית.
הישענותנו על עצמנו פירושה שני דברים: הישענות על כוחנו
ועל צדקתנו. אחד משני אלה כשהוא לבדו לא יעמוד לנו. כל ימינו האמנו
במצפוּן אנושי ובכוח הצדק. הגלוּת הכזיבה אמוּנה זו פעמים אין ספור, כל עוד
היינו תלוים בחסדי זרים בלבד, וברגש הצדק של השליטים אשר חלשו על גורלנו.
עכשיו אנו נשענים על עצמנו, אבל אַל נמהר לזרוק מאחורי גונו אמונתנו בכוחות
המוּסריים, לאחר שהיינו לכוח בלתי מבוטל. כוחנו היום גדול משהיה בימי מלחמת
הקוממיות והוא הולך וגדל, ועלינו לטפח אותו בלי ליאוּת. אבל אַל נשכח אף
לרגע שיש כוחות גדולים יותר, וביניהם — כוחות העוינים אותנו, ולא רק במזרח
התיכון. מאורעות שנתרחשו בעיר־הנצח שלנו לפני
כאלפיִם שנה, זכרם עודנו חי בלב מיליוני אנשים בעולם, ואין סולחים לנו עד
היום שדחינו משיחם, והם מאמינים שנגזר עלינו להיות נודדים בגויים לעולם
ועד, ואינם משלימים עם העובדה שאחרי מאות שנות
נדודים חזרנו לארצנו, חידשנו קוממיותנו וירושלים שוב היתה לבירת ישראל. ויש
כוחות אחרים בעולם שאינם רואים בעין יפה עצמאותנו הרוחנית, כי הם אינם
מודים בזכותה של שום אומה לחרוץ גורלה בעצמה, כפי ראות עיניה, ולסדר חייה
לפי צרכיה ומאוַייה. הם תובעים קבלת מרוּת עליונה אחת, מרוּת מוּחלטת
גם בעניני כלכלה וחברה ומדינה בעניני רוּח, מחשבה ומדע, ומי כעם ישראל — עם
״סורר וּמורה״ מאז ומעולם?
אולם ביחסי העמים פועלים לא רק כוחות ואינטרסים חמריים. אם
אין עדיין המצפוּן והצדק שליטים בעולם, אין זאת אומרת שאינם קיימים. הם
פועלים ומורגשים בכל שלב היסטורי, ובימינו לא פחות מאשר בכל זמן, למרות
המתיחות בעולם. התקדמותנו במשך שבעים וחמש השנים האחרונות — מיסוּד הכפר
העברי הראשון על גדות הירקון ועד הקמת המדינה ולאחריה — נעזרה לא במעט
באהדה וביחס הטוב, שמפעלנו בארץ עורר בקרב טובי האומות. ולא נתכחש לתמיכה
המוסרית, המדינית, ולאחר קום המדינה, גם העזרה הכספית, שקיבלנו מעמים
שונים. ועזרה ואהדה זו באה מפני שהעמים הכירו בצדקת מפעלנו וברכתו האנושית,
ואנו רוכשים ידידים באשר הם יודעים כי ישראל משמשת מבצר לקידמה חברתית,
לחירות מדינית ולרצון שלום במזרח הקרוב. אהדה בינלאומית זו תידרש לנו בעתיד
כמו בעבר, אם לא יותר. גם כוחנו מושך ידידים, כשם שהוא בולם אויבים, אבל
אסוּר שנשכח אף לרגע שאנו ״המעט מכל העמים״, כלומד יחידים ובודדים, שלא
כעמים דוברי אנגלית, העמים הסלביים, דוברי ספרדית, העמים הקתולים,
המוסלמים, או העמים הסקנדינביים. אין עם צמוד לנו בלשון, בדת, בגזע. אנו
״גוי אחד בארץ״, ולא גוי גדול, ורק אם נבנה על השנים, על הכוח ועל הצדק,
נעמוד. השנים מן ההכרח שיהיו משולבים וכרוכים זה בזה בחיינו, כאשר שילב
אותם נעים זמירות ישראל, באמרו:

״לְךָ זְרוֹעַ עִם גְבוּרָה תָּעֹז יָדְךָ


תָּרוּם יְמִינְךָ״ ומיד הוסיף: ״צֶדֶק וּמִשְׁפָּט מְכוֹן כִּסְאֶךָ,


חֶסֶד וֶאֶמֶת יְקַדְמוּ פָנֶיךָ״.

(תהלים2 פט, 14—15).
צירוף קדום זה, מחייב אותנו גם היום, והיום אולי יותר מאשר בכל זמן
אחר. ורק משום שידענו לטפח שניהם, הגענו למדינה, ורק אם נמשיך לטפח שניהם,
תתבצר המדינה ותעמוד בפני כל אויביה, כל עוד יהיו לה אויבים.
עתידה של ישראל תלוי במידה רבה ביחסיה עם אומות העולם
ובמעמדה במזרח התיכון. בשני המעגלים האלה תעמיד ישראל בשורה הראשונה דבר
חיזוק השלום. ולגבי שלום לא תבחין בין ארצות שמשטרן קרוב לה או מקובל
עליה ובין ארצות שמשטרן לא רצוי או מעורר ספקות. יחס האיבה של שליטי ערב לא
יערער בקרב ישראל הרצון לשלום אמת בינה ובין שכנותיה. ישראל לא יכלה להתעלם
מהמציאות כמות שהיא, אבל יש לעם ישראל נסיון היסטורי רב וממושך, והוא יודע
שמציאוּת משתנה, ואין לעשות חשבון הרגע בלבד.
אם מדינות ערב אינן משלימות עדיין עם קיומה של ישראל — אין
ישראל חייבת להשלים עם המצב הקיים במזרח התיכון. יש מגמות יסוד בהיסטוריה,
שבמוקדם או במאוחר יגלו ויפעילו כוחן. השלום בין ישראל ובין ארצות ערב יחיש
בואו אם מצד אחד, ישראל תתבצר בצרון כלכלי ומדיני, ויֵעקר מלב אויביה כל
סיכוי שמדינה זו תיפול תחת משאה, ויורחקו סלעי המחלוקת העומדים בינה ובין
שכניה, ומצד שני תחול ליברליזציה ודימוקרטיזציה בארצות ערב. גם דבר זה יבוא
במוקדם או במאוחר. לא לעולם קפאון.
לשני העמים השמיים, לעם העברי ולעם הערבי, יש יעוּד משותף
בחלק זה של העולם. היהודים לא יזוזו מכאן, וגם הערבים לא יחליפו מקומם.
ההיסטוריה הטילה על שני עמים אלה לחיות בשכנוּת; זוהי לא רק שכנוּת
גיאוגרפית. יש קרבה רבה בלשון, בתרבות ובהיסטוריה. שיתוף פעולה בין העם
העברי בארצו ובין ערב העצמאית הוא הכרח היסטורי, והוא יקום. הוא דרוש לעמי
ערב לא פחות מאשר לישראל. שיתוף פעולה זה יִתּכן רק על יסוד של שויון וכבוד
הדדי ועזרת גומלין. שיתוף ישראל וערב יהפוך המזרח התיכון לאחד המרכזים
התרבותיים בעולם, כאשר היה לפנים, בתקופת התנ״ך. לכל אחד משני העמים יש
משהו לתת לחברו מבלי לגרוע כלום מעצמו. הפראה הדדית זו תהיה לברכה לשניהם,
למזרח התיכון ולעולם כולו.
ישראל חייבת לראות צרכי השעה בכל הבהירות האכזרית, מבלי
להתעלם מצרכי הדורות. המצב הקיים על כל סכנותיו החמורות (ויש להסיק ממנו כל
המסקנות המוכרחות) אינו צריך להגביל אפקי הראיה שלנו. יש הכרח היסטורי
בברית יהודית־ערבית, וכשיוכשרו התנאים היא תבוא, אבל לא תבוא מאליה — אלא
אם יהיה רצון דרוך לקראתה. עם כל הסתירה המדוּמה שיש בדבר, חייבת ישראל גם
בכוננות צבאית יעילה וגם בדריכות נפשית לקראת שלום אמת ושיתוף פעולה עם עמי
ערב.
המעגל העולמי והמעגל במזרח התיכון דורשים מאמצים דרוכים
ומתמידים, צבאיים ומוסריים מצד ישראל. אבל גורל ישראל תלוי כולו במעגל
השלישי — במעגל העם היהודי ברחבי הגולה. מדינת ישראל היא חלק של המזרח
התיכון רק מבחינה גיאוגרפית, שהיא בעיקרה בחינה סטטית. מבחינה יותר מכרעת,
מבחינה דינמית, מבחינת התהוותה וגידולה, הרי מדינת ישראל היא חלק של העם
היהודי בעולם.
מהעם היהודי תשאב מדינת ישראל כל הכוחות והאמצעים הדרושים
לבנין האוּמה הישראלית ולפיתוח הארץ. בכוח היהדות בעולם תיבּנה ותבנה.
שותפות גורל ויעוּד מקשרת בקשר בל ינתק את מדינת ישראל לעם היהודי. קיימת
זיקת עולם, זיקת חיים ומוות, בין מדינת ישראל ובין העם כולו.
מדינת ישראל היא מדינה ככל המדינות: ריבונית בתוך תחומיה
ומוגבלת בתחומיה. סמכותה הריבונית חלה על כל תושביה, אבל היא חלה על תושביה
בלבד, ורק אזרחי המדינה קובעים דרכה, בוחרים ממשלתה, וחוקי המדינה מחייבים
רק היושבים בתוכה, וכל תושביה, בין שהם יהודים ובין שאינם יהודים, שווים
בזכויותיהם.
היהודים החיים במדינות אחרות הם אזרחי אותן המדינות;
כפופים הם לחוקים ולמדיניות של המדינות ההן, ואין למדינת ישראל כל סמכות
לדבר בשמם או לכוון מעשיהם. מבחינת היחס והזיקה של יהודי חוץ־לארץ למדינות
שבהן הם יושבים, אין הבדל ביניהם לבין האזרחים הלא־יהודיים, כשם שאין הבדל
במדינת ישראל בין יהודי לבין לא־יהודי. אולם פרט לארצות טוֹטליטריוֹת, אין
המסגרת הממלכתית ממַצה כל התכנים והיחסים האנושיים. רק מדינה טוטליטרית אינה מכירה בערך האבטונומי של האדם, ושלטונה
בתושביה הוא שלטון ללא מצרים; היא גוזרת על המחשבה, על האמונה, על הטעם, על
האמנות, על כל הליכות האדם, הפרטיות והציבוריות, והיהודים כשאר התושבים
בארצות אלה משוללים כל אפשרות של ביטוי עצמי חפשי, והם למעשה מנותקים בעל
כרחם מן העם היהודי, עבָרוֹ ועתידו.
בארצות הבנויות על חירות האדם ועל בחירתו החפשית אין הזיקה
למדינה סותרת זיקת התושב לערכים, ליחסים ולגופים שאין למדינה שליטה עליהם,
והם רשות היחיד. ליהודים בארצות אלה ניתן להיות אזרחים שווי זכויות וחובות
ככל שאר האזרחים, והם יכולים להגדיר יהדותם וקשריהם היהודיים לפי רצונם
החפשי, לא רק עם הקיבוץ היהודי בארצם, אלא גם עם העם היהודי בעולם. זיקת
היהודי לעמו אינה פוגמת ואינה נפגמת על־ידי זיקתו למדינתו, והיהודים
המתכחשים לעמם — ויהודים כאלה היו בכל הארצות ובכל הדורות — עושים זאת לא
מפני שהם אזרחים יותר נאמנים, אלא מפני שהם אנשים פחות הגונים, ואין להם
הכבוד עצמי והכוח הפנימי להשתחרר מרגש של נחיתוּת הנדבק באנשים ירוּדים
השייכים לעם קטן וחלש.
מדינת ישראל הרואה עצמה כיצירתו של העם היהודי ונועדה
לגאולתו, רואה את היהודים בעולם כולו כעם אחד, לא רק בעבר אלא בהווה
ובעתיד. ושורש האחדוּת והרציפוּת של העם היהודי, למרות פיזוריו בגויים,
נטוע לא רק במורשת העבר הכללית, אלא בשותפות גורל היסטורית. ובאחדוּתו
ורציפוּתו ההיסטורית של העם היהודי אין כל סתירה לזיקה הממלכתית של אזרחי
ישראל בחוץ־לארץ למדינות שבהן הם יושבים, כל זמן שהם יושבים בהן.
מדינת ישראל היא פרי חזון גאולתו של העם היהודי במשך
דורות. אין זאת המדינה היחידה שקמה בעקבות חזון לאומי, בעקבות מאמציה של
תנועת שחרור לאומית. במאה ה־19 ובמאה ה־20 קמו לתחיה הרבה מדינות באירופה
ובאסיה כתוצאה של חזון תקומה אשר החיה ושחרר עמים משועבדים. ואף־על־פי־כן
תקומת מדינת ישראל היא יחידה במינה בהיסטוריה.
מאחורי כל חזון תקומה לאומית עמדה מציאוּת של עם יושב
בארצו, אם כי משועבד לשלטון זר. ותנועת השחרור ינקה ממציאוּת זאת,
ולהגשמת שאיפתה לא חסר אלא פריקת עול השלטון הזר. בהשתחררה מהעול הזר, קמה
השאיפה הלאומית בשלימוּתה. לא כן חזון תקומת עם ישראל. החזון הזה התפרנס רק
מתוכו ומעצמו, מנפשו של העם, וכל המציאוּת הממשית עמדה נגדו. העם היה מפוזר
ומפורד בכל קצוי תבל. הארץ היתה תחת שלטון זר — שלטון רומאי, ביצנטי, פרסי,
ערבי, סלג׳וקי, פראנקי, ממלוקי, תורכי, בריטי; ולא עוד אלא שגם הארץ היתה
מיושבת על־ידי זרים, והאדמה היתה הרוסה ועזובה. חזון הגאולה היהודית ינק רק
מתוך כוחות נפשו של העם.
עם תקומת המדינה לא הוגשם עדיין חזון הגאולה, כי העם
היהודי ברוּבו המכריע עודנו מפוזר בגויים, והמדינה היהודית עדיין איננה
ביצוע הגאולה היהודית. היא רק המכשיר והאמצעי העיקרי לגאולתו.
עם הקמת המדינה ניתן לחזון הגאולה היהודית המצע והבסיס
המעשי, המציאותי להתגשמותו, ומשום כך היתה המדינה לכוח המלכד והמאחד של העם
היהודי בתפוצות, כאשר לא ליכד ואיחד אותם שום דבר אחר.
יוצר ההסתדרות הציונית, ד״ר הרצל, נתן הגדרה קולעת וממַצה
לציונוּת, כפי שהוא הבין אותה, הגדרה שמרבית עסקני התנועה הציונית שכחו
ועזבו. הוא אמר: ״הציונוּת היא העם היהודי בדרך״. כלומר: העם היהודי בדרך
לשׁוּב לארצו. אִמרה עמוקה ונאמנה זאת נשתבשה אחר־כך ונהפכה למימרה חסרת
שחר, שההסתדרות הציונית היא מדינה בדרך. אין מדינה בדרך. או שיש מדינה או
שאינה. כשאמר נפוליון על צבאו שזוהי צרפת בדרך, היה לדברו תוכן. לכל מקום
שהלך צבאו — שם היתה צרפת. אבל המדינה היהודית יכלה לבוא רק מתוך ״העם
היהודי בדרך״. מדינת ישראל לא יכלה כמובן, לקום יש מאין. התרקמות המדינה
והתהווּתה במשך שנים היו לא בתוך ההסתדרות הציונית, אלא בצמיחת הישוב,
בגידולו ובהתעצמותו. את מדינת ישראל הקימו העולים, העולים שבכל הדורות, וגם
להבא תיבנה המדינה ותגדל ותעצם על־ידי העולים. רק העליה ״העם היהודי בדרך״,
כפי שהגדיר הרצל, הוא הכוח הבונה והמגשים של החזון הציוני. זוהי אמת ציונית
וראשונית. בלי העליה לא היה נוצר הישוב. בלי העליה לא היתה מוקמת המדינה.
בלי העליה המדינה לא תעמוד.
ההסתדרות הציונית לא היתה ולא יכלה להיות הסתדרות של
עולים. ההסתדרות הציונית לא חייבה חבריה לעליה, ואיננה מחייבת גם עכשיו.
כמובן היה מוּתר לציוני לעלות ארצה, והיו ציונים לא מעטים שהשתמשו בהיתר
הזה. אבל הם לא עלו בתוקף חברוּתם להסתדרות הציונית, ועלו לארץ לא רק חברי
ההסתדרות הציונית בלבד. העליה לארץ קדמה להסתדרות הציונית, והיא־היא
שהולידה אותה. העולים מכל הדורות, וילידי הארץ, הניחו היסוד הממשי למדינת
ישראל. יוצאי חומות ירושלים מלפני יותר משבעים שנה, סלומון וחבריו,
והחלוצים הראשונים מהונגריה, שטמפר, ראב וחבריהם, שבנו את הכפר העברי
הראשון, פתח־תקוה; בני ביל״ו מרוסיה והחלוצים הראשונים מרומניה שבנו בשנות
ה־80 במאה הי""ט את ראשון־לציון, גדרה, זכרון־יעקב וראש־פינה, רחובות, חדרה
ומטולה — אלה היו מיסדי הישוב החדש, ובכך מניחי היסוד הראשון למדינת ישראל.
700,000 העולים שהגיעו ארצה לאחר יסוד המדינה, הם־הם שיחד עם הישוב הוָתיק
בנו המדינה במשך ארבע השנים האלה והפכו פני הארץ.
