,Title,Translator,Lang,Author,Text
אבל אמת ראשונית ויסודית זאת אינה ממצה כל האמת. העולים
לבדם, בלי עזרת העם, לא היו יכולים לעלות, לבנות הישוב, להקים המדינה
ולקיים אותה בעבר ולהבא. העליה לארץ אינה דומה להגירה לאמריקה או לארץ
הגירה אחרת. בלי עזרת העם, בלי העזרה הכלכלית, הפוליטית והמוּסרית, לא היתה
העליה היהודית לארץ אפשרית ולא תהיה אפשרית עוד זמן לא מעט. כי ארץ־ישראל
לא היתה ארץ ריקה, אם כי אדמתה היתה עזובה והרוסה. היה בה ישוב, לא מתמול
שלשום, אלא מזה מאות שנים. הישוב הבלתי יהודי לא ראה בעין יפה את העולים
היהודים, ומזמן לזמן גם עמד נגדם בכוח. הארץ לא היתה הפקר גם מבחינה
פוליטית. היה בה שלטון זר, שלטון תורכי, במשך ארבע־מאות שנה, ושלטון בריטי
במשך שלושים שנה. גם התורכים וגם הבריטים לא היו שונאים לעם היהודי, אבל
השלטון לא תמיד ראה בעין יפה עליה יהודית, והיו קיימים איסוּרי עליה, גם
בזמן התורכים וגם בזמן הבריטים.
אבל לא רק הישוב והשלטון הזר הפריעו; הארץ עצמה, במצבה
הקיים, בהריסתה ובדלדולה ובשממונה, לא היתה מסוגלת לקלוט עליה. בכוח עצמו
לא יכול היה העולה היהודי, לא בדורות קודמים ולא בדורנו אנו, להתגבר על
המכשולים והמפריעים החיצונים, לא על המכשולים מצד השלטון ולא על הקשיים מצד
דלות הארץ, ונדרשה עזרה מתמדת, גם כלכלית, גם פוליטית וגם מוסרית, של
חובבי־ציון ו״הנדיב הידוע״ בתקופה הראשונה, ושל התנועה הציונית והעם ביובל
האחרון.
העזרה לעליה היהודית לפני הולדת ההסתדרות הציונית היתה
ספורדית, מקרית ונטולת בסיס רחב, רעיוני ומדיני, עד שקמה ההסתדרות הציונית
על־ידי הרצל, חוזה הציונוּת הממלכתית. מגמתו ורצונו של הרצל היו לארגן
ולגייס העם היהודי כולו לביצוע החזון הציוני. אפס לא היה בכוח הרעיון
הציוני המופשט, גם בלויית הקסם האישי העצום של הרצל, לגייס ולארגן כל העם,
ובמקום ״עם יהודי בדרך״ קמה ההסתדרות הציונית. כבר צויין שזו לא היתה
הסתדרות של עולים או של מועמדים לעליה. זו היתה חוּלשתה המוּסרית של
ההסתדרות הציונית, אבל זה היה גם יתרונה המעשי. זאת היתה הסתדרות
שמטרתה היתה להפעיל העם בכל התפוצות למען הגשמת הציונות, לגייס העם לפעולה
חינוכית, מדינית וכלכלית, אשר בלעדיה היתה העליה לארץ נכשלת, כמו שנכשלו כל
הנסיונות בדורות הקודמים לשוב לארץ ולבנותה. רק הצירוף והשותפות שנוצרו
ביובל השנים האחרון בין חלוצי העליה וההגשמה ובין התנועה הציונית, רק אלה
אִפשרוּ והכשירו צמיחתו המתמדת של הישוב, התעצמותו התרבותית והמדינית,
התגברותו הכלכלית והמשקית ויכלתו לעמוד בפני כל ההפרעות וההתקפות, בפני כל
הקשיים הטבועים במצבה המדולדל של הארץ ובהרגלי היהודים יוצאי הגלויות
השונות, תושבי ערים, בלולי לשון ונטולי מסורת לאומית ממלכתית.
התנועה הציונית דגלה בשאיפה שלא היה לה, לכאורה, כל בסיס
מציאוּתי, לא בארץ ולא בעם. ומשום כך נתקלה בהתנגדות חזקה מצד חוגים
רבי־השפעה ביהדות; מצד האדוקים הקיצונים שהאמינו אמנם בגאולה, אבל רק
בגאולה שלא כדרך הטבע; מצד רובה של תנועת הפועלים היהודית, שראתה תיקון מצב
היהודים רק במהפכה העולמית; מצד החוגים המתבוללים שכפרו בעצם מציאוּתו של
העם היהודי, ויותר מכל, מצד ההמונים האדישים, שלא האמינו בממשוּתו ובכושר
התגשמוּתו של חזון הגאולה. תקומת מדינת ישראל זהו הנצחון הגדול ביותר שנחלה
המחשבה הציונית בעם היהודי.
וחלקה של התנועה בנצחון זה הוא לא קטן. בלי מאמציה
החינוכיים, הארגוניים, המדיניים והכספיים לא היה הישוּב הקיים, ולא היו
העולים שנוספו עליו, מגיעים עד הלום. דוקא מפני שההסתדרות הציונית לא היתה
הסתדרות של עולים ולא מועמדים לעליה — יכלה להפעיל סביבה חלקים גדולים של
העם, ולפעמים גם רוּבו של העם, ואת היהדות כולה בכמה וכמה ארצות.
זכות מוסרית שמורה לה להסתדרות הציונית לראות בתקומת מדינת
ישראל גמול נאמן למאמציה, מאבקיה ומפעליה והוכחה ניצחת לאמיתות תפיסתה.
אולם ההסתדרות הציונית תעשה משגה פטלי ותתכחש לאמיתה הרעיונית אם תראה
במדינת ישראל נכס התנועה הציונית בלבה ולא נכס העם היהודי כולו.
הקמת מדינת ישראל הוא לא כיבוש ציוני בלבד — זהו מאורע
גדול ומרכזי בתולדות העם היהודי, אחד מארבעת המאורעות העיקריים בתולדות
ישראל מימי האבות ועד ימינו. מהרגע הראשון של קום המדינה עומד כל העם
היהודי, מחוץ למרשיעי ברית מעטים מימין ומשמאל, סביב המדינה ורוצים בשלומה,
בבטחונה והתעצמותה, וגם מושיטים יד נאמנה לבנינה ולפיתוחה. הסתדרות ציונית
שתעמיד עצמה כמחיצה בין עצמה ובין העם היהודי תתכחש למקורה ולנפשה.
העליה לארץ אינה באה משורות ההסתדרות הציונית בלבד, וגם
העזרה המדינית והכספית למדינה אינה מצטמצמת בחוגי הציונוּת המאורגנת.
המדינה הצליחה ללכד ולאחד העם היהודי כאשר לא הצליח עד עכשיו שום גורם אחד
בחיי היהודים. אהבת העם ועזרתו למדינה אינה יכולה להיות נתונה אלא למדינה,
ואהבת העם ועזרתו הוא נכס יקר וחיוני שיש לשמור עליו כעל בבת עינינו,
וקודם כל חייבת לשמור עליו התנועה הציונית. אך כשם שאין ההסתדרות הציונית
רשאית לראות במדינה נכס מפלגתי הסתדרותי שלה, אלא נכס העם כולו, כך אין
מדינת ישראל בתקופה זו יכולה לראות בעצמה כביצוע חזון הגאולה של העם
היהודי.
בתנועת שחרור לאומית של עמים אחרים שישבו על אדמתם תחת
שלטון זר היה בהשגת העצמאות הממלכתית ביצוע מלוא שאיפתם הלאומית. לא כן
בישראל. בכינון עצמאותנו במולדת לא הגענו לקצה הדרך בשאיפת גאולתנו — אלא
לראשיתה; גם אחרי ביצוע המפעלים האדירים של עליה והתישבות בארבע השנים
הראשונות לקיום המדינה, שעלו על כל מה שנעשה במשך שבעים השנים שקדמו לקום
המדינה, עוד לא הגענו אלא לבנין עשרים אחוז של אדמת המדינה ולריכוז של פחות
מחמישה עשר אחוז מהעם היהודי. ועוד קשה ורבה הדרך אשר לפנינו, — ועדיין
יעוּד קיבוץ הגלויות עומד, כמקודם, במרכז משימותינו הראשיות.
העולים אשר יעלו ארצה הם יהיו הבונים הישירים של המדינה
ומגשימי היעוּד הגדול של קיבוץ גלויות. אך גם להבא, גם לאחר קום המדינה, לא
יתכנו קיבוץ גלויות ובנין המולדת בלי שותפות העם היהודי כולו.
אותם המפריעים והמכשולים שעמדו בדרך העולים מקודם לפני קום
המדינה, נשארו גם עכשיו, אם כי פשטו צורה ולבשו צורה אחרת, וכמה מהם
חמוּרים ומסוּכנים הרבה יותר מאלה שידענו לפני קום המדינה.
עכשיו אין שלטון זר, אנו עצמאיים בארצנו, אבל יש כוחות
עולמיים העויינים אותנו ועדיין אינם משלימים עם תקומת ישראל ועצמאותו בארץ
היסטורית זו, והמערכה הצפויה לנו בזירה העולמית דורשת גיוס כל כוחותיו
המדיניים של העם היהודי.
הישוב הבלתי יהודי בארץ שוב אינו משמש מכשול ומעצור
להתישבותנו ולגידולנו. הכרזת עצמאותנו ומלחמת השחרור שינו הרכב האוכלוסין
בארץ באורח יסודי ומהפכני. ובתוך תחומי המדינה אנו עצמאיים, בטוחים וחפשים
ושום כוח לא יעמוד לנו כצר. אולם במקום הישוב הבלתי יהודי בתוך הארץ, יש
לנו עכשיו מעבר לגבולות שכנים רבים ועצומים שעודם רואים עצמם במצב
מלחמה אתנו, ואינם מסתירים כלל מזימותיהם לתקוף אותנו שנית ולמחות אותנו
מעל פני האדמה. עוד זמן רב תידרש לנו העזרה המוסרית והחמרית של העם היהודי
לחיזוק בטחוננו ושלומנו.
אמנם אין להשוות יכלתה של מדינת ישראל ליכלתו של הישוב
לפני העצמאות. אדמת המדינה כולה היא ברשותנו; תקציבה של המדינה בשנה אחת
עולה על כל תקציביה של ההסתדרות הציונית במשך יובל שנים. אבל המדינה
בכוחותיה בלבד לא תעצור כוח לקלוט עליה המונית בקצב ובממדים שנעשו אפשריים
והכרחיים עכשיו.
אין איש יכול להגיד בימינו אם קיבוץ הגלויות, היעוד העליון
של המדינה, פירושו ריכוז כל העם בארצו או רובו של העם היהודי או של כמה
וכמה חלקים ממנו. ישנם רק עמים ספורים המרוכזים כולם או כמעט כולם בארצם,
אלה הם עמים שאף פעם לא נותקו מעל אדמתם. התפוצה היהודית אין דומה לה
בהיסטוריה האנושית ואין היא הופעה חדשה. התפוצה קדמה לגלות, לא רק לגלות
השניה אלא גם לגלות הראשונה.
עוד לפני גלות בבל היתה תפוצה יהודית במצרים, ובמאה השישית
לפני הספירה הנוצרית, לפני 2500 שנה, לפני תקופת זרוּבבל, עזרא ונחמיה
נמצאה עדה יהודית צבאית בדרומה של מצרים. בשיבת־ציון הראשונה לא חזרו כל
הגולים; רק חלק מגולי בבל שב בימי זרובבל, עזרא ונחמיה; ולפני חורבן הבית
השני כבר נמצאה תפוצה עצומה באימפריה הרומית אשר מנתה משלושה עד חמישה
מיליון יהודים. באלכסנדריה של מצרים בלבד ישבו לפני החורבן כמיליון יהודים,
יותר יהודים מאשר ישבו אז בירושלים. תפוצת ישראל מעולם לא היתה כה מפוזרת
ורחבה כאשר היא במאות השנים האחרונות.
עם השמדת שני שלישים של יהדות אירופה על־ידי הנאצים עבר
מרכז הכובד הכמותי של העם היהודי מהעולם הישן לעולם החדש, מאירופה ואסיה
לאמריקה. עם כל הירושה התרבותית והמדינית שהעולם החדש ירש מהעולם הישן —
המדע, הספרות, האמנות, המסורת הנוצרית, הרי קמה ביבשת אמריקה ובאוסטרליה
חברת־עמים חדשה, שבכמה תכונות יסוד היא שונה מחברת העמים שבאירופה ובאסיה,
ולא מן ההכרח שכל התנאים והנסיבות, שהיו קיימים בעולם הישן לגבי היהודים,
יהיו קיימים גם בעולם החדש.
האידיאולוגיה הציונית — לא החזון הציוני שימיו כימי
היהדות, אלא האידיאולוגיה הציונית המדינית — נתגבשה בקרב יהודי אירופה במאה
ה־19, והיא ינקה לא במעט מהגילויים האנטישמיים ומהתנועות הלאומיות
והמדיניות בקרב עמי אירופה. כל נסיון להעתיק באופן אבטומטי, על פי
גזירה־שוה פורמַלית, יחסי אירופה לאמריקה, עלול להתבדות. העולם החדש נבנה
כולו על־ידי מהגרים במאות השנים האחרונות שבאו מארצות שונות ונתמזגו יחד
במידה רבה, ומעמד היהודים באמריקה אינו דומה למעמד היהודים באנגליה או
בצרפת, אם כי גם ארצות אלה זיכו היהודים בשויון־זכויות; כל היחסים והתנאים
הפוליטיים באמריקה אינם דומים לאלה שבארצות אירופה, ואין להעביר באופן
מיכאני אידיאולוגיה פוליטית שנולדה במציאוּת אירופית במאה ה־19 למציאוּת
האמריקנית במאה ה־20. מה שקרה באירופה יכול לקרות באמריקה, אבל לא מוכרח
לקרות, והציונוּת אינה יכולה להיות בנויה על ספקוּלציה מסוּפקת ולא רצוּיה
זו.
כמו לפני הקמת המדינה כן גם עכשיו, המצוקה והחזון הם גורמי
העליה, אבל עם קום המדינה נוצר גורם חדש שעלול במשך הזמן לרשת מקומו של
גורם המצוקה, וזהו הכוח המושך של המדינה. אם המדינה תתבצר, תתיצב
ותיצור תרבות חיים גבוהה ועשירה אשר לא תיפול מרמת התרבות של איזו ארץ אחרת
שהיא, גם מבחינה חמרית וגם מבחינה מוסרית ורוחנית — ודבר זה אינו נבצר
מאתנו — יִתּכן שגם יהודים בארצות שאין בהן מצוקה ולחץ ימצאו בישראל כל
הרוָחה והחירות שיש בארצות מגוריהם, ונוסף לכך ימצאו כאן ערכים ונכסים
יקרים שאין ליהודים בשום ארץ אחרת — עצמאות יהודית בכל גילוייה העשירים,
בתחום הכלכלה, המדיניות, התרבות, המדע, האמנות והמעמד הבינלאומי. אבל לשם
כך — לקיבוץ גלויות ולטיפוח עצמאותה החמרית, המדינית והתרבותית של מדינת
ישראל — הכרחית כמקודם השותפות היוצרת בין המדינה ובין העם היהודי.
מדינת ישראל היתה עכשיו לחלק אורגאני של ההוָיה והחוָיה היהודית בכל התפוצות. מדינת ישראל כבר העשירה חיי
העם היהודי וחיי כל יהודי באשר הוא, ואין לתאר עכשיו המציאוּת היהודית
בתפוצות בלי מדינת ישראל, ללא התדלדלות והתערערות פנימית של היהודים. אבל
אין גם לתאר קיומה, גידולה ומילוי יעודה של מדינת ישראל בלי השתתפות עם
ישראל כולו. בין שני אלה קיימת זיקת גומלין מוכרחת, אוֹרגנית, היסטורית,
חיונית, אם כי ללא דוּגמה ותקדים ביחסי עמים ומדינות, ואף־על־פי שהם שונים
זה מזה בתכונות היסוד שלהם.
העם היהודי אינו מושג מופשט, אינו רק שם עצם קיבוצי להמוני
יחידים ובודדים המפוזרים בארצות שונות. העם היהודי הוא יחידה קיבוצית שאין
כל ספק בממשוּתה, ברצונה ובגורלה המשותף. אבל על־פי טבע הדברים אין ליחידה
זו מסגרת מגובשת, מחייבת, מאורגנת וכשרת פעולה, כי עם זה מפוזר ומפורד בכל
הארצות החיות בתנאים שונים ומתנגדים, ואפילו הקיבוץ היהודי שבכל ארץ וארץ
אינו נתון במסגרת כוללת ויחידה. כל יהודי כפוף כלא־יהודי לחוקים ולמדיניות
של ארצו, אבל קשריו עם בני עמו נתונים לרצונו החפשי ולנטייתו האישית של כל
אחד ואחד.
בפני קושי זה עמד חוזה הציונוּת המדינית כשרצה לגייס העם
היהודי למען ריכוזו המחודש במולדת וכינון עצמאותו הממלכתית, ומתוך כך יצר
ההסתדרות הציונית, הסתדרות הבנויה על הצטרפות של רשות ועל פעולה מתנדבת,
ללא מסגרת של כפיה וחובה ממלכתית.
בהסתדרות הציונית נתבטא הרצון הקולקטיבי וההיסטורי של העם
היהודי בשאיפתו לגאולה, ובמשך יובל שנים עמדה ההסתדרות הציונית בראש תנועת
העם היהודי לשוב למולדתו ונשאה באחריות מרכזית לכינון מדינת ישראל, לעתים
לבדה, לעתים בשיתוף חוגים וגופים יהודיים אחרים.
התנועה הציונית לאחר קום המדינה שונה בהכרח בכמה בחינות
עיקריות מהתנועה הציונית שלפני קום המדינה. נשתנה תוכן פעולתה של התנועה
הציונית כלפי פנים וכלפי חוץ.
מה היה תכנה של התנועה הציונית לפני קום המדינה?
קודם כל היה זה מאבק רעיוני בתוך העם היהודי.
התנועה הציונית דגלה בשאיפה שלא היתה. מקובלת על דעת רוב
היהודים, אם כי היו לה שרשים עמוקים בעברו של העם היהודי, בספרותו
ובאמונתו. רבים ראו בשאיפה הציונית — דבר מזיק, פסול, מסכן קיום היהודים,
מחלל דת ישראל, רעיון בטלני בלתי מעשי, אוטופיסטי, ריאקציוני. האדוקים
הקיצונים ראו בציונות פגיעה קשה בדת וכפירה באמונת המשיח. הם דוקא האמינו
בגאולה, אבל בגאולה בידי שמים, ולא בדרך הטבע, כפי שהטיפה לה הציונות.
המתבוללים ראו בציונות סכנה לזכויות היהודים, להכרת שויונם האזרחי ולמעמדם
שרכשו להם או שאפו להשיג בארצות מגוריהם. אם שואפים למולדת יהודית, סימן
שאין היהודים אזרחים נאמנים בארצם. הסוציאליסטים ראו בציונות שאיפה
ריאקציונית, המסיחה דעת ההמונים מהמלחמה הפוליטית או המעמדית להטבת מצבם
ולהשוָאת זכויותיהם. גם אלה האמינו בגאולת העם היהודי, אבל גאולה זו צריכה
לבוא על־ידי מהפכה סוציאלית עולמית; כשיתוקן העולם במלכות הסוציאליסם —
יתוקן מצב של היהודים ממילא. הנאורים ואנשי המעשה התנגדו לציונות באשר היא
חלום שוא ואוטופיה ריקה. היתכן שהיהודים ישובו לארץ קדומים פראית, הרוסה,
מיושבת ערבים, נתונה לשלטון תורכי? היתכן שבני עיר יהיו לעובדי אדמה, ואנשי
אירופה יתישבו בארץ אסיאתית? התוגר לא יתן, הערבים לא יסכימו וכו׳
וכו'.
בן ימינו קשה לו לתאר לעצמו המציאוּת היהודית לפני 40—50
שנה, ולהעריך האינרציה הרוחנית והרעיונית שבה נאבק הרעיון הציוני, ועד כמה
עמד בניגוד להלך־הרוחות ששררו אז ברחוב היהודי, גם במערב וגם במזרח. התנועה
הציונית נאבקה בכוחות התרבותיים ובהרגלי המחשבה ששלטו בעם היהודי מימין
ומשמאל, בקרב החרדים והחפשים, בקרב העשירים והעניים; ואם כי בתוך התנועה
הציונית היו חילוקי דעות פנימיים, חשובים ולא חשובים, עמוקים ושטחיים, הרי
כלפי חוץ עמדה כל התנועה הציונית על אגפיה, סיעותיה וזרמיה בפני קיר אטום
של דעות קדומות והתנגדות נפשית ומחשבתית. ומאבק רעיוני זה, מאבק פורה ומפרה
כלפי פנים, בתוך העם היהודי, מילא חללה של התנועה הציונית כל הימים.
והיה מאבק שני, מאבק פוליטי, מאבק כלפי חוץ. אין צורך
לחזור לתקופה התורכית בראשית ימיה של הציונות הקונגרסיסטית. לצרכי הבירור
הנוכחי אפשר להסתפק בתקופת המנדט. הציונות לא היתה רק השקפת עולם, תפיסה
פילוסופית או דתית, שאינה תלויה בזמן ובמקום ובתנאי המציאוּת. אמנם לציונים
רבים היתה הציונות בעיקר — השקפת עולם יהודית, בניגוד להשקפת העולם של
המתבוללים. אבל לתנועה הציונית היה אובייקט ארצי, ממשי — ארץ־ישראל. וארץ
זו היתה נתונה בתנאי מציאוּת מסוימים, מדיניים, ישוביים, כלכליים,
תרבותיים, והתנועה הציונית שאפה לשנות ולהפוך אותם כדי להגיע למחוז חפצה.
היא עסקה בעבודה יִשובית, ונאלצה לעמוד גם במערכה מדינית, כי ארץ־ישדאל לא
היתה חלל ריק, שכל הרוצה עושה בתוכה כאדם העושה בתוך שלו. הארץ היתה נתונה
במשטר מנדטורי, משטר יחיד במינו, שנתחדש רק לאחר מלחמת העולם הראשונה.
והמנדט בארץ־ישראל היה נתון בתנאים מיוחדים, ללא דמיון בשום ארץ מנדטורית
אחרת. בעלת המנדט, אנגליה, לא שלטה בארץ כאשר שלטה ברודסיה או בציילון,
מבלי שתהיה אחראית למוסד בינלאומי ומבלי שיהיו מוטלות עליה התחייבויות
מסוימות כלפי הישוב בארץ. המנדט נתן מעמד מוּכּר להסתדרות הציונית, כָּלַל
התחייבויות מפורשות כלפי הבית הלאומי, עליה והתישבות יהודית, כלל גם
התחייבויות ידועות כלפי הערבים. ובמרובע זה שהכיל המנדט — יהודים, ערבים,
אנגליה וחבר הלאומים, היה להסתדרות הציונית מקום להתגדר בו. על ההסתדרות
הוטל לעמוד במערכה בלתי פוסקת, גם כשאנגליה היתה נוטה פחות או יותר למלא
הבטחותיה לעם היהודי, כפי שהיהודים הבינו אותן וגם, וביחוד, כאשר סטתה בלא
יודעים או ביודעים מהבטחות אלה. והמאבק עם ממשלת המנדט — בתנאים שונים
ומשתנים, בצורות מתחלפות, מילא חללה של התנועה הציונית במשך שלושים שנה.
וחלק גדול של הויכוחים הפנימיים, חילוקי הדעות וריב המפלגות בהסתדרות
הציונית נסבו על דרכי מאבק זה, תכנו וצורתו.
הקונגרסים הציוניים, ישיבות הוַעד הפועל, העתונות הציונית
— עיקר תכנם היה הוויכוח הפוליטי על היחסים עם ממשלת המנדט, על שיתוף פעולה
אתה, על התנגדות לכמה ממעשיה, ועל צורת ההתנגדות וכיוצא באלה.
התנועה הציונית עסקה גם בעבודה ישובית וחינוכית בארץ, אבל
